full_text,tweet_id,screen_name
"What’s out see #chakkachakkalathi 💥💥💥 
 https://t.co/VGMM81a3HG",1519604760097148928,A_for_Shreya
"If Akshay Kumar sees this tweet, he is going to report it and block this handle to avoid second-hand embarrassment. https://t.co/XUUCzgu2gI",1519601530717884416,DearthOfSid
Liked on YouTube: Akshay Kumar &amp; John Abraham funny 😂 comedy 😂😁 Job interview #shorts https://t.co/13oi7mzIQs,1519599050143719429,masum606
@ActorMadhavan Sir Pushpa movie jaisa script hai mere pass please different script just a a five minute time sir please believe me sir sir sir sir plz plz plz plz plz  south ka Radheshyam movie se bhi achcha and Akshay Kumar Bachchan Pandey se bhi achcha @ActorMadhavan,1519597155987894272,bhakta_tapas
"This is my very first tweet...
I m here just to underline on a topic that cannot be changed now .
Dear #ANEES_BAZMEE sir it is not done sir..
""NO #AKSHAY_KUMAR IN #BhoolBhulaiyaa2.....
I have watched bhool bhulaiya ONE HUNDRED AND NINE TIMES TILL NOW...
You broke my heart sir",1519596709348708352,DeepDut35091834
@FarOutAkhtar Sir Pushpa movie jaisa script hai mere pass please different script just a a five minute time sir please believe me sir sir sir sir plz plz plz plz plz  south ka Radheshyam movie se bhi achcha and Akshay Kumar Bachchan Pandey se bhi achcha @FarOutAkhtar,1519596503207391232,bhakta_tapas
@shivadirector83 Sir Pushpa movie jaisa script hai mere pass please different script just a a five minute time sir please believe me sir sir sir sir plz plz plz plz plz  south ka Radheshyam movie se bhi achcha and Akshay Kumar Bachchan Pandey se bhi achcha @shivadirector83,1519596212802179072,bhakta_tapas
"If Ajay Devgn was starred instead of Akshay Kumar in the movie Baby, to wo religion wale column me Bokd aur Italics me Indian likhte.",1519595224246329345,sentiyapaa
@prashanth_neel Sir Pushpa movie jaisa script hai mere pass please different script just a a five minute time sir please believe me sir sir sir sir plz plz plz plz plz  south ka Radheshyam movie se bhi achcha and Akshay Kumar Bachchan Pandey se bhi achcha @prashanth_neel,1519595088111824897,bhakta_tapas
Sir Pushpa movie jaisa script hai mere pass please different script just a a five minute time sir please believe me sir sir sir sir plz plz plz plz plz  south ka Radheshyam movie se bhi achcha and Akshay Kumar Bachchan Pandey se bhi achcha @karanjohar,1519594546367111169,bhakta_tapas
"Akshay Kumar: I’m sorry for Vimal thing. I’ll donate all the money.

“Great! Where will you donate sir?”

Akshay: Ye Vimal kha ke jinko cancer hoga, unke ilaaj je liye 😆
@ruchikokcha",1519593648685748224,UsmanS88
"Dear 'akshay Kumar'
Sir, what am I hearing about you, Have you done 'Vimal Gutka' Advertise?
As much as I know that you do not do such ads, but something is going on on social media about you.
@akshaykumar",1519590813252079618,Maheshpatil_10
"Akshay Kumar’s PR team is on 🔥 

All ‘Vimal Elaichi’ income has been spent well on a definite ‘worthy cause’.",1519590434389237760,Utsaaaaav
"Elon Musk must buy #VimalPanMasala Company and sue Akshay Kumar, Shahrukh Khan and Ajay Devgn for endorsing tobacco and fooling the public.",1519587332026138624,heistkid
I think Ajay Devgan is the new poster boy for government - in addition or substitution of Akshay Kumar 😁,1519583817174228992,renugupta
Hmm Just like Megastar Akshay Kumar saved bollywood with Bell Bottom nd BP https://t.co/Jx7iublCNn,1519583180206280704,ImStranger__
He wanted to cash in on that Akshay Kumar sanghi wave but got the reality check both vimal pan stars https://t.co/daB8vmX2So,1519580739465261058,sathish_cule
@remodsouza Sir Pushpa movie jaisa script hai mere pass please different script just a a five minute time sir please believe me sir sir sir sir plz plz plz plz plz  south ka Radheshyam movie se bhi achcha and Akshay Kumar Bachchan Pandey se bhi achcha @remodsouza,1519580236672761856,bhakta_tapas
@theabbasmustan sir plz Pushpa movie jaisa script hai mere pass please different script just a a five minute time sir sir please believe me  plz plz plz plz plz  south ka Radheshyam movie se bhi achcha and Akshay Kumar Bachchan Pandey se bhi achcha @theabbasmustan,1519580038156324865,bhakta_tapas
@priyankachopra mame plz Pushpa movie jaisa script hai mere pass please different script just a a five minute time mame please believe me  plz plz plz plz plz  south ka Radheshyam movie se bhi achcha and Akshay Kumar Bachchan Pandey se bhi achcha @priyankachopra,1519579734945918976,bhakta_tapas
Sir Pushpa movie jaisa script hai mere pass please different script just a a five minute time sir please believe me sir sir sir sir plz plz plz plz plz  south ka Radheshyam movie se bhi achcha and Akshay Kumar Bachchan Pandey se bhi achcha @actorvijay,1519578906902237185,bhakta_tapas
Sir Pushpa movie jaisa script hai mere pass please different script just a a five minute time sir please believe me sir sir sir sir plz plz plz plz plz  south ka Radheshyam movie se bhi achcha and Akshay Kumar Bachchan Pandey se bhi achcha @AlwaysRamCharan @tarak9999,1519578808973545472,bhakta_tapas
Sir Pushpa movie jaisa script hai mere pass please different script just a a five minute time sir please believe me sir sir sir sir plz plz plz plz plz  south ka Radheshyam movie se bhi achcha and Akshay Kumar Bachchan Pandey se bhi achcha @dhanushkraja,1519578664899280896,bhakta_tapas
Sir Pushpa movie jaisa script hai mere pass please different script just a a five minute time sir please believe me sir sir sir sir plz plz plz plz plz  south ka Radheshyam movie se bhi achcha and Akshay Kumar Bachchan Pandey se bhi achcha @SunielVShetty,1519578623249768448,bhakta_tapas
Sir Pushpa movie jaisa script hai mere pass please different script just a a five minute time sir please believe me sir sir sir sir plz plz plz plz plz  south ka Radheshyam movie se bhi achcha and Akshay Kumar Bachchan Pandey se bhi achcha @ssrajamouli @ssk1122,1519578583190032384,bhakta_tapas
Sir Pushpa movie jaisa script hai mere pass please different script just a a five minute time sir please believe me sir sir sir sir plz plz plz plz plz  south ka Radheshyam movie se bhi achcha and Akshay Kumar Bachchan Pandey se bhi achcha @SonuSood,1519578518429913088,bhakta_tapas
Sir Pushpa movie jaisa script hai mere pass please different script just a a five minute time sir please believe me sir sir sir sir plz plz plz plz plz  south ka Radheshyam movie se bhi achcha and Akshay Kumar Bachchan Pandey se bhi achcha @juniorbachchan,1519578475648077824,bhakta_tapas
Sir Pushpa movie jaisa script hai mere pass please different script just a a five minute time sir please believe me sir sir sir sir plz plz plz plz plz  south ka Radheshyam movie se bhi achcha and Akshay Kumar Bachchan Pandey se bhi achcha @rajinikanth,1519578431452631040,bhakta_tapas
Sir Pushpa movie jaisa script hai mere pass please different script just a a five minute time sir please believe me sir sir sir sir plz plz plz plz plz  south ka Radheshyam movie se bhi achcha and Akshay Kumar Bachchan Pandey se bhi achcha @TheNameIsYash,1519578374955429888,bhakta_tapas
Sir Pushpa movie jaisa script hai mere pass please different script just a a five minute time sir please believe me sir sir sir sir plz plz plz plz plz  south ka Radheshyam movie se bhi achcha and Akshay Kumar Bachchan Pandey se bhi achcha @alluarjun,1519578337462562816,bhakta_tapas
Sir Pushpa movie jaisa script hai mere pass please different script just a a five minute time sir please believe me sir sir sir sir plz plz plz plz plz  south ka Radheshyam movie se bhi achcha and Akshay Kumar Bachchan Pandey se bhi achcha @arbaazSkhan @BeingSalmanKhan,1519578292596056065,bhakta_tapas
He probably exchanged notes with Akshay Kumar during those gutkha shoots https://t.co/dGc01rlRZX,1519578262045102080,beyalora
Sir Pushpa movie jaisa script hai mere pass please different script just a a five minute time sir please believe me sir sir sir sir plz plz plz plz plz  south ka Radheshyam movie se bhi achcha and Akshay Kumar Bachchan Pandey se bhi achcha @arbaazSkhan,1519578200967286785,bhakta_tapas
"Akshay Kumar calls on fans to suggest name for new film - https://t.co/69DifNKmBH 
Get your news featured use #IndiaPostUSA 
#Actors #Actress #AjayDevgn #AkshayKumar #AkshayKumarMovies #Bollywood #Celebrities #Entertainment #Hollywood #Movies #RadhikaMadan",1519574044072423425,IndiaPost_News
"Scenario 1: Akshay Kumar: me gutka promote nhi karunga; in vimal ad
Scenario 2: Ajay Devgan didn't mention anything &amp; in vimal ad.

Still a famehunter youtuber never mentioned S1 b4 outrage but still trolls in S2. And isko lgta ye ghr me rehke investigation karta h.",1519572424290799616,sammy_9211
@madhukant_kumar AE Mahesh closed my complaint without taking any action regarding L-43 kalkaji having height way above MCD guidelines and running Guesthouse. JE had checked the property and action as per dmc act was initiated but AE closed the matter.. pls check photo https://t.co/8LDH5BgqCP,1519567259361980417,Akshay_0555
"#Adivisesh's #Major to clash with #Akshaykumar's #Prithviraj
https://t.co/6IZeE3oxC3",1519566167907909634,ETimesTelugu
"Hey...Elon Musk if u r buying Coca-Cola pls do not take Akshay Kumar in ur Advt....We are already fed up.

#ElonMusk 
#CocaCola 
#Twitter",1519566065696714752,GreenMirchiii
"With rising oil prices, I am worried whether Akshay Kumar's car is now standing in the queue at the petrol pump or is it out of the petrol pump. !!! Gutka gang https://t.co/rsjK6XNl3E",1519564208060321792,HamzaFadul12
Where is there so much Akshay Kumar on my feed?,1519563509381857280,annu3052
"WHY SO FORMAL
Akshay Kumar Mesmerises In The New TVC Of Dollar Bigboss https://t.co/0js9PIWQ8V",1519557925806944257,prachiti_30_
"Lol calling actors who Do MVs as wannabe stars.

Matlab

Akshay Kumar, Vicky Kaushal, Nora Fatehi, Rubina Dilaik, Jasmin Bhasin, Shehnaaz Gill sab wannabe stars he? 😭😭😭😭😭

Kids please go back to school.",1519554245913157633,adityaxkaran
"@Swamy39 Hello Sir,
Akshay Kumar, Shah Rukh Khan and Ajay Devagan all the three are receipient of Padma Shri. I see all the three on Vimal Keshri Paan Parak Ad, which people of such stature should not be promoting tobacco. I want your you to revoke the prestigious award.",1519548474651406336,bachu_rohit
"My mom doesn't like the idea of me dating now, but would love it if I were with Akshay Kumar's son🤷🏼‍♀️",1519547392156381184,seeyaaaduh
"#Review #BachchanPandey #akshaykumar #movies 
My movie-goer friends know that I am a great fan of Akshay Kumar. But nothing - nothing had prepared me for the movie Bachchan Pandey. It took me some time to understand whether it was a comedy gone wrong or a…https://t.co/hmVs8C9tdc",1519544134335225857,rubina_ramesh
Only Akshay Kumar is the OG character for bhool bhulaiyaa ain't nobody got that spot,1519540545714274304,hs_girn96
"What is happening please !?
Akshay Kumar pics and tweets and news all over my TL !? 😏🤔🧐",1519537521994129408,Eimhamy
Fyi Akshay kumar is national award winner actor.. As per you he has same 2rs expression but that's why he is highest paid indian actor for last 30yrs.. 🤡 https://t.co/NGHPjOpkC5,1519536485451460608,KhiIadiMass
Suddenly I'm getting bombarded with Akshay Kumar content all over twitter. Twitter needs to fix this habit of putting weeds within my interested topics and hoping I interact with it. Never!,1519534366371708928,SinoperdarkBlog
"Ajay Devgan, a Punjabi, was desperately trying to be Marathaon ka Manoj Kumar. Now he wants to be India ka Manoj Kumar. Akshay Kumar has competition.

#Hindi
#HindiIsAlanguage
#NationAndLanguageAreSeparate

@ajaydevgn
You don't need Twitter beefs bro. You need another vowel.",1519530872877182978,rishikamath
There is a difference. Mohanlal plays a psychiatrist in the malayalam version while Akshay Kumar plays a clown/magician from a circus. https://t.co/ThaNk7SSRm,1519520145105768448,RoKoN24x7
It’s a test among the best at the Khelo India University Games: Boxer Akshay ‘Kumar’ Siwach https://t.co/bSB82QSBqK,1519514736974516226,OdishaDiary
"Akshay Kumar in Corona Crisis

☆PM CARES - 25Cr
☆BMC -3Cr
☆Mumbai Police - 2Cr
☆Helped Theatre Owners Financially
☆Helped 1500 Daily Wage Workers (45L) 
☆1000 Fitness Bands
☆GGC -1Cr
☆100 Oxygen Concentrator Worth 1Cr

PRIDE OF INDIA @akshaykumar

https://t.co/yUMkIgS0h1",1519512084815351808,Khiladi_Meraj
And I thought Canadian Akshay Kumar had this degree 👇 but no it's #AjayDevgn who declared Hindi as India's national language. https://t.co/B7eE5lro7P,1519506539542978560,Esmilebhai
"And then Akshay kumar stared working with Dharma production, Farah Khan, Noland, government's  SOCIAL  INFLUENCER. https://t.co/USpOX6I7JX",1519504996647153665,bravo_bravooo
"Adivi Sesh-starrer Major pushed by a week, to clash with Akshay Kumar’s Prithviraj https://t.co/p9PLNZya9R",1519499799476666368,WorldOpinionInd
"Alia Bhatt ranks sixth on top influencer list; ahead of Priyanka Chopra, Akshay Kumar, Robert Downey Jr | Entertainment News,The Indian Express https://t.co/XKrZszM7xj",1519497010272907264,NimianeStandish
"#NushrrattBharuccha is all set to team up with #AkshayKumar for #Selfiee and the shooting for their next is underway. She shared a funny reel on Instagram, featuring her co-star Akshay Kumar as well! 
READ MORE- https://t.co/r3p2AjCSVj https://t.co/hQJZKgnaVz",1519486067912716290,desisLIVE
"People like Ajay Devgan / Shahrukh khan  / Akshay Kumar by no means the only one ,by acting in Gutka ads shows how there is no ethical boundaries left in pursuit of money  . And when it suits them they cloak themselves as nationalists .",1519478051595337728,75JaiA
"[2204.12745] Mainak Mondal, Ajit Kumar Dash, Akshay Singh: Optical microscope based universal parameter for identifying layer number in two-dimensional materials https://t.co/KUIJHhawMc https://t.co/dPjtQ5tpbl #physics_optics",1519478027238838272,_arXiv_physics
"The stand taken by Padma Lakshmi against the impending genocide of Muslims in India must be appreciated. This, while homegrown celebs either turn a blind eye to (Priyanka Chopra) or cheer on (Akshay Kumar) the atrocities being committed. Really good.",1519469391108136960,xtahzy
"Memers should officially thank  akshay kumar and rajpal yadav.
#AkshayKumar #Memes",1519454384043790337,Jwaad18403555
"@babylook800 please stop liking the tweets of Akshay Kumar.
🥲",1519444902815289344,_lavaas_
"Akshay Kumar remade this movie as Housefull 2.

🤣🤣 https://t.co/imRK6tObJq",1519443042872164352,ganeshmantra
Poor Akshay Kumar is behaving like PM Justin Trudeau. https://t.co/dWkrxKlWiN,1519437613588877314,joytrichur
"Today I realised if you see Akshay Kumar's laughing picture late night you won't be able to sleep whole night.
It's scarry 😵‍💫😓",1519433346253697025,Surbhi16_t
"This is the quality of our film fraternity. Poor Ajay Devgn try to read our hindi version of the constitution as English may be difficult for him to understand. If he has any difficulty, either he can contact kangana Ranaut or Akshay Akshay Kumar https://t.co/YOnMmKcAB9",1519432998080303104,joytrichur
Akshay Kumar was a star of old Bhool Bhulaiyaa. That was some era. Can’t believe we are getting a terrible sequel to ruin this classic! 😭 https://t.co/iLtKdwjRsN,1519424683774517249,PcUnfinished
The difference is that #MohanLal is an acting legend and a proud Indian Padma Bhushan awardee while Akshay Kumar has that same 2₹ expression in all his movies. Even in serious roles 🤦‍♂️ https://t.co/4cUmCEXU5l,1519415594361270274,SRKgaurav1
"no-one can replace akshay kumar but for the sake of it, I'll watch #BhoolBhulaiyaa2 with an open mind &amp; then I'll give my verdict on it, hopefully it's positive. like people are so reactionary, movie's not released yet &amp; they've already started shit-talking &amp; bashing it.",1519408728256045057,stiflerftw
"Akshay Kumar better than Mohanlal? 😂😂😂
This video was literally proving how far down is Akshay Kumar's acting ability when compared to Mohanlal. https://t.co/5aPLWrBsCw",1519405547165937664,Sayanth_rajith
"Adivi Sesh-starrer Major pushed by a week, to clash with Akshay Kumar’s Prithviraj https://t.co/R3KBE93eaj",1519404827931037698,BlogToMe
"Whom would you choose in #bhoolbhulaiyaa between #AkshayKumar &amp; #kartikaaryan ?

Comment down below.

#Bollywood #Bollywoodcelebs #Tellychakkar

https://t.co/ucYc8oTRXP",1519403559913398272,tellychakkar
"First Akshay Kumar now Ajay Devgan, Amitabh Bachchan was alway a hypocrite, Kangna Ranaut is a sellout. Please treat these celebraties as entertainers &amp; nothing more, they can not be your idols or ideals. 
They work for money, your money.
#AjayDevgn #KicchaSudeep",1519400556103536642,TheBhaaratKurda
"Alia Bhatt ranks sixth on top influencer list; ahead of Priyanka Chopra, Akshay Kumar, Robert Downey Jr https://t.co/8uxTCJzX17",1519399356515950593,anand_market
should've been akshay kumar instead https://t.co/CAYelsQGuQ,1519392171828203521,vminhopist
Akshay Kumar And Nushrratt’s Selfie Has A Funny Foodie Twist – Healthy Food 2022 https://t.co/O3b7j5M5D3,1519389463880732673,RoameraD
"You'll be in splits after knowing the reason why once #AkshayKumar tried to remove #SalmanKhan's role in ""Jaan-E-Maan""

Click to read.

#Bollywood #Bollywoodcelebs #Tellychakkar

https://t.co/N2iyIpRJlh",1519389083227004928,tellychakkar
"@SanjanaVK_18 

U r social media nibbi

Akshay Kumar made 6 south remake after 2014 

And salman make no South remake after 2014 

But social media par pada salman k against , waha se 15-16 utha liya 🤣

Use your own brain ,make your opinion 
Akshay made most no remakes",1519386764502306819,impraveen0
"Congratulations to Ajay Devgun on completion of his Wattsapp degree 
But Akshay Kumar is a post graduate there.",1519382272604254208,RoshanTahaseem
"Ajay Devgan &amp; Salman Khan have remade MORE FILMS than Akshay Kumar

Why baseless tweet ? https://t.co/SAsC24LiRm",1519379573623779328,Cinema_Soul
I think there's secret cameo of Akshay Kumar in #BhoolBhulaiyaa2,1519379096333025280,PMparasmalhotra
"ManiChithrathaazhu is a psychological horror drama you dumbo,it is not a comedy(over acting)film.And your akki also copied our Ramji Rao speaking,Vellanakalude Nattil etc. And Everyone knows that as an actor Mohanlal&gt;&gt;&gt;&gt;&gt;&gt;&gt;&gt;&gt;&gt;&gt;&gt;&gt;&gt;&gt;&gt;&gt;&gt;&gt;&gt;&gt;&gt;&gt;&gt;&gt;&gt;&gt;Akshay kumar
#Mohanlal #Mammootty https://t.co/GRzjwC11SR",1519378733098237952,AnekhC7
Chill people. @ajaydevgn has a movie coming up and the hype is super less. So he had to pull off this stunt so that the people who too believe Hindi is a national language (&amp; also believe him and Akshay Kumar are real superstars coz they r Hindus) go for his film #Runway34,1519376491041107968,filmyinsaan
@akki_dhoni Ok we can accept the fact that you are an Akshay Kumar fan but that didn't make any sense that you can blame any actor.... If you compare in terms of acting Your Star is far behind mine.... So..... കൊണ്ക്കാതെ കേറി പോടാ മൈരെ .......,1519376341384134656,EMPURAA62158241
"The ruined ""Welcome(2007)"". Now ""Bhool Bhulaiyya 2's"" turn. Cringe content , forced comedy on the way. Shouldn't say anything before the release though
Ps. Karthik Aryan is a good actor but Akshay Kumar,... He's a maestro ❤️
#BhoolBhulaiyaa2 #AkshayKumar #KartikAaryan #Bollywood",1519374974200467457,KhanUqbaan
"'I'm sorry': Akshay Kumar steps back as tobacco brand ambassador after backlash, will donate ad fee | Celebrities News – India TV https://t.co/Rc2gMdsVdp",1519372103887339528,louise01067
"The Outrage about B-Wood &amp; South Indian Movies Come to end when it's About @iamsrk Proud to be a Fan of an Actor Who did Experimental Films like FAN &amp; ZERO But Never Went for a South Indian Remake, 

Salman Khan, Akshay Kumar and Rohit Shetty These 3 are Piller of Reamkes https://t.co/Myo9wFFSfM",1519368047672401920,SrkianFaizy
David mammunni thaayoli john today night with akshay kumar 🤤 https://t.co/Jozt290XuW https://t.co/h9W0QI11ag,1519367565776416769,Abhinair178
"Adivi Sesh-starrer Major pushed by a week, to clash with Akshay Kumar’s Prithviraj https://t.co/Fd5uquCKP3",1519365109721800711,anand_market
"Ajay Devgan, Akshay Kumar and SRK are PAN-Indian stars. 
Because they relish Vimal PAN Masala.

#AjayDevgn #HindiImposition",1519364211364696065,Chilipili
"Congratulations to @ajaydevgn on completion of his Wattsapp degree 
But Akshay Kumar is a post graduate there.",1519364132625174530,rajanoberoi10
"Akshay Kumar’s reaction after watching #BhoolBhulaiyaa2Trailer 
#BhoolBhulaiyaa2 #BhoolBhulaiyaa2Teaser https://t.co/5mmVuHAQJp",1519364124982976513,iSandesh_mj
"Next Akshay Kumar.
Whats the problem all sanghi face when someone speaks their language.
Boli Zuban kesari!!! https://t.co/DBkXkLB0VW",1519360896254246913,kushagra0804
"I’m all down for beef and drama but Ajay Devgn leaves all Hindi Movie actors aside and picks a fight with South Movie star. Can’t help but think its because of their success. 🤔

Idk Ajay and Akshay Kumar often do stunts to please govt too.",1519358519757131778,SRKsEvilFan
Shawn Micheals and Akshay Kumar have some uncanny resemblance between them,1519358254354161667,ahsanzawar
"Buzz is that the film will pick up after the events of 'Sooryavanshi' and is touted to have Akshay Kumar and Ranveer Singh teaming up for the project.... 
#SinghamOurRealHero #ISupportAjayDevgn https://t.co/8PTh3qPOiU",1519354218577944577,GuruSingh1432
Akshay Kumar And Nushrratts Selfie Has A Funny Foodie Twist https://t.co/KrJ20cEtfV,1519352259045380098,anand_market
I’m so fed up of seeing Akshay Kumar in movies bro.,1519348760442294277,camestonsbored
Akshay Kumar And Nushrratt’s Selfie Has A Funny Foodie Twist https://t.co/o55Mrny5YI,1519348698668539905,times_indie
Don't create hate for AKSHAY KUMAR by supporting Vimal Devgn....Please 🙏,1519344530633289728,AkshayC76166841
"Do the film stars Sasta Singham Ajay Devgan and Canadian Akshay Kumar really consume Vimal Elaichi? If not, why do they take up such ads? https://t.co/tVVgUGRZqu",1519344266501582848,vijayment
"EXCITING #NEWS for South Indian and Bollywood fans👇

#akshaykumar𓃵 #Suriya #entertainment #Bollywood #trending #KGF2 #viral #AjayDevgn #Southindian 
https://t.co/oN6M6lqzOO",1519339760589836289,ImTejaswii
"Exciting news Guys!!!!!! 👇

#akshaykumar𓃵 #Suriya #entertainment #Bollywood #trending #KGF2 #viral
https://t.co/oN6M6lqzOO",1519338603272278016,ImTejaswii
"@akshaykumar Alia Bhatt beats Jennifer Lopez, Priyanka Chopra, Akshay Kumar on Top Celeb Instagram Influencers list
4 hours ago",1519337883894972416,faisalKhiladi
"@akshaykumar Selfiee: Akshay Kumar, Emraan Hashmi’s UNSEEN pics from sets gives a glimpse of their hard work and fun times
8 hours ago",1519337716185694208,faisalKhiladi
So true. The trailer was great but no one can beat Akshay Kumar!! https://t.co/mdaSGNvp1D,1519336228260261888,amisheeparikh06
"That 1 keedanu left while using Harpic.
Akshay Kumar nte nd.🥱 https://t.co/aCF16NAAEi",1519334139623018496,iamsarath_10
"Tellychakkar poll! Fan chooses the look of Akshay Kumar over Kartik Aaryan’s look for Bhool Bhulaiya, check out the poll results: Upcoming movie of Kartik Aaryan Bhool Bhulaiya 2, is that current talk of the town, the fans are already drawing many… https://t.co/0s33a6ovl6 https://t.co/y4Y8qygTWn",1519331947264176134,BetterknowYou
Akshay kumar With His Talent Should be Drinking the water which is soaked to clean Mohanlal's feet 🚶🏾‍♂️ https://t.co/JsVmJZtsHv,1519331559475597314,BarathNalan
Irrfan Khan was 53 and played Radhika Madan Father in Angrezi Medium. Akshay Kumar is 54 and will be playing Radhika’s love interest? 😬 https://t.co/t8V7pHHcfL,1519328275759255552,LyraNoor
That was event film don't see any film could have survived front of Kashmir files... Still BP opened 13cr+ just bcoz of Akshay power....if you have stardom your film will definitely open good rest depends on content.  13cr still Underperforming for akshay Kumar.. https://t.co/M6UXrdCyXV,1519327781762760705,dhruv_gunda
"Don't take this chap seriously.

This Bollywood lot of Akshay Kumar, Anupam Kher and Ajay are fair weather friends...
If there is a regime change, this lot will change their colors again. https://t.co/KaJcUP3nyH",1519325064604241920,anushakunmittal
"Such a shame that Ajay Devgun, Akshay Kumar and Shah Rukh Khan are selling Gutka related products. Deep down they know what they are selling in the name of Kesari. They should not fall so low.",1519324792670801925,KrishnamHQ
If it has to b big then first replace Akshay kumar https://t.co/dv64vhZz53,1519321311218061313,iShaharyar_MD
Why ? Every regional language is important &amp; part of our culture - our diversity makes us unique #HindiImposition @ndtv is he trying to become another Akshay Kumar and sucking it up to the politicians @ajaydevgn https://t.co/DzMKETdCPy,1519320608185724932,amitnath2014
"Alia Bhatt ranks sixth on top influencer list; ahead of Priyanka Chopra, Akshay Kumar, Robert Downey Jr https://t.co/zQI8RqigNU https://t.co/EL0bTbhX13",1519319767265386497,d_raagz
"If Cigarette Smoking in Movies is Considered Right..Why Akshay Kumar is wrong then??
I think Akshay should write ""Pan Masala is injurious to Health"" on Screen while doing add. https://t.co/xgXpN6EVv3",1519319519562403840,Mahendr89901112
"CEO of Twitter     CEO of Remake 
Elon Musk             Akshay Kumar https://t.co/qgjEPKiiuA
#AkshayKumar #ElonMusk https://t.co/MdWPryxZLO",1519318926634541068,DalimKh53337753
"Me: oh no now Akshay Kumar also joined the Vimal group

Others: Inki aakhe phod do nahi to ek din galti khud hi phod denge

#AjayDevgn",1519316763049340929,WebPatil
