full_text,tweet_id,screen_name
"Lightweight Title
First Strawweight Title Rematch
Conor McGregor Sweepstakes

My body is ready for Saturday",1520914546705190912,lagsthegreek
"Raufeon Stots explains why he’s rooting for ‘highlighter-headed ass’ Danny Sabatello to beat Leandro Higo in Bellator grand prix 

UFC #UFC274 #UFC274  #MMA  Dana White #Boxing Conor McGregor #wrestling Khabib #fight Khamzat Chimaev https://t.co/NzrFY0V9Yn",1520909762648543235,MMAHWatch
"Main event loser set six different strike/significant strike records for the Bantamweight division. Follow Us on Instagram : https://t.co/aQ6VZC8zvr 

UFC #UFC274 #UFC274  #MMA  Dana White #Boxing Conor McGregor #wrestling Khabib #fight Khamzat Chimaev https://t.co/TwOD7Fc3km",1520909749168005120,MMAHWatch
Conor McGregor Trash Talks Jake Paul After Katie Taylor's Victory over Amanda Serrano https://t.co/wQP8hVmxfD via @TMZ,1520907860900777988,SportsCrunch_US
"Shinya Aoki taking down BJJ legend Garry Tonon and then taking his back Follow Us on Instagram : https://t.co/8D209ChOvL 

UFC #UFC274 #UFC274  #MMA  Dana White #Boxing Conor McGregor #wrestling Khabib #fight Khamzat Chimaev https://t.co/lOMUN9bdoB",1520903425357197313,MMAHWatch
Conor Mcgregor Advised to Fight UFC Bus Assault Victim By Chael Sonnen https://t.co/0y2VmSTA1k,1520901910538047490,The_MMA_Planet
Would Jake Paul be Conor McGregor be the biggest PPV ever?,1520901372761153536,Ash1MMA
"Uncle Chael says Conor needs to beat up Michael Chiesa.. 👀 Does it happen?

https://t.co/iON9TFpgki",1520897972573192193,MmaMakoa_
"Nate Diaz doesn’t agree with Justin Gaethje’s assessment of his performance against Khabib Follow Us on Instagram : https://t.co/8D209ChOvL 

UFC #UFC274 #UFC274  #MMA  Dana White #Boxing Conor McGregor #wrestling Khabib #fight Khamzat Chimaev https://t.co/D2FtwhyOu5",1520895989204271107,MMAHWatch
"Jake Paul and Conor McGregor didn't hold back
https://t.co/u9SZXqrfg4",1520895846581256195,brotips
"Conor McGregor blasts Jake Paul and pair exchange insults in Twitter war of words after Katie Taylor vs Amanda Serrano fight https://t.co/CpuKErth0y 
NO DOUBT, THEY'RE BOTH TWO IDIOTS WITH LEGS.",1520893220376301568,ByronRu21077815
"You could be anyone if you put the time. Conor McGregor
https://t.co/mOhe9zgHKX https://t.co/S6DXOtrpQj",1520887960278913025,phiofkhem
Why the fuck would anyone idolise Conor McGregor???? https://t.co/WRVt53MdS1,1520887455251148800,32_ireland
Jake Paul slams Conor McGregor: He’s ducking me | Video | Watch TV Show https://t.co/2ZOVlvNBW5,1520881054315429888,petgroomerNG
"I'm sorry but why was he so intense abt pushing his own fights? Stop bringing up Conor McGregor and stop promoting your own events Jake. This is the moment for Amanda, Katie and women's boxing. You took that away. @jakepaul https://t.co/aWDL9udwQZ",1520880650349338626,_lovely_212
i think the worst thing to ever happen was conor mcgregor,1520878692561563649,erodarrry
"Hey @TMZ @TMZ_Sports, these women are ✨BOXERS✨ — this wasn’t a UFC fight, nor was there an octagon in sight at @TheGarden. https://t.co/GeWudw4oVh",1520877821354147840,__kath
"[SPOILER] Strike differential between Rob Font vs. Marlon “Chito” Vera. Nearly 2:1 difference. Follow Us on Instagram : https://t.co/8D209ChOvL 

UFC #UFC274 #UFC274  #MMA  Dana White #Boxing Conor McGregor #wrestling Khabib #fight Khamzat Chimaev https://t.co/UVEzcLt2jb",1520874693007482887,MMAHWatch
"Urijah Faber explains why rival T.J. Dillashaw should get next title shot against Aljamain Sterling 

UFC #UFC274 #UFC274  #MMA  Dana White #Boxing Conor McGregor #wrestling Khabib #fight Khamzat Chimaev https://t.co/XqnhtcAgcG",1520874683415113728,MMAHWatch
"Both Taylor and Fury look to God for their strength. I'll take them any day over Conor McGregor, who effectively worships himself. https://t.co/XygjakIvJq",1520873892386123776,ianclary
"Conor McGregor, Jake Paul get into Twitter spat during Katie Taylor-Amanda Serrano fight https://t.co/Awt73fwnfW",1520872528843087880,guncelkalnet
"#e_RadioUS Conor McGregor, Jake Paul get into Twitter spat during Katie Taylor-Amanda Serrano fight https://t.co/OtMYJcYofr",1520872340116094976,eRadioUS
2022 Prizm UFC Conor McGregor Flashback #7 Green Pulsar SSP 06/25 EBAY 1/1 https://t.co/xGeDd4Nf60 eBay https://t.co/KZk8BIKkIn,1520870198751883267,SportsTradingC9
Conor McGregor Trash Talks Jake Paul After Katie Taylor's Victory over Amanda Serrano via @TMZ https://t.co/KViFzw4sNA,1520869322838716422,PattyDempsey2
"Serrano Conor McGregor, Jake Paul get into Twitter spat during Katie Taylor-Amanda  #Serrano fight https://t.co/UDyhoXSuZ4",1520865883115114496,PresshubU
"Conor McGregor, Jake Paul Twitter spat during Taylor-Serrano fight https://t.co/lKCmNrLXpV",1520865325193039872,gospaddiction
"Conor McGregor, Jake Paul get into Twitter spat during Katie Taylor-Amanda Serrano fight - https://t.co/lMSLcXRh9D https://t.co/1vm71jJj6B",1520863842246483970,e_newsUS
"Conor McGregor.
The GOAT 🐐🐐🐐🐐🐐
If he is not killing it in the octagon, he is killing it in the style game. 👟👢👢🧦🧦🧦👖👖🩳👕👔🎽🎽

He is a rule breaker.

But when you know the Fashion rules  – you can break them with confidence. https://t.co/oqMidb2xw0",1520863558694838279,BuyitL
"#ConorMcGregor thinks #KatieTaylor is the GOAT after her thrilling win over #AmandaSerrano! 🐐

https://t.co/xL8XUEa5cR",1520863127369306113,sports_manor
"Conor McGregor Trash Talks Jake Paul After Katie Taylor's Victory over Amanda Serrano: There were 2 fights connected to the UFC showdown between Katie Taylor and Amanda Serrano Saturday night -- the fight in the Octagon, and the fight between their… https://t.co/0OUZWzGUh9",1520862255310458882,GossipBucket
Conor McGregor Trolls Jake Paul Following Taylor vs. Serrano Fight: 'Who the F*ck Is This Asshole’ https://t.co/YmU91v2GfA,1520860142098472960,NikeStoreNG
"Conor McGregor, Jake Paul get into Twitter spat during Katie Taylor-Amanda Serrano fight https://t.co/gDo78fnNd0 via @nypost",1520859618573885440,Chris_1791
"Conor McGregor, Jake Paul get into Twitter spat during Katie Taylor-Amanda Serrano fight https://t.co/R4pzhJx0E4",1520859278826954752,adabagcompany
So glad to say I was never ever a fan of Conor McGregor.,1520859119284011008,gabegorman92
Conor McGregor Trolls Jake Paul Following Taylor vs. Serrano Fight: ‘Who the F*ck Is This Asshole’ https://t.co/XSVhdl6IOe,1520858292985155587,JesusChrysler1
"Was #KatieTaylor vs #AmandaSerrano the best women's boxing fight of all time? Here's what the stars have to say! 😳😳😳

https://t.co/rtpHTA8YMp",1520848028147625984,sports_manor
"Alexandr Romanov suggests Jon Jones fight after dominant win: ‘I have heard that Mr. Bones wants back in the game’ 

UFC #UFC274 #UFC274  #MMA  Dana White #Boxing Conor McGregor #wrestling Khabib #fight Khamzat Chimaev https://t.co/paFfQ6IRig",1520844902137057286,MMAHWatch
#FRESHSPORTS Conor McGregor took shots at Jake Paul in the aftermath of boxer Katie Taylor's victory.  https://t.co/oFaM4COG9I #SineadFresh,1520840786119639040,SineadFresh
Errol Spence/Bud taking shots at each other &amp; jake paul/Conor McGregor doing the same is keeping the sabbath holy for me,1520840728515162112,BoxingWK
Conor McGregor Reacts as the Value of His Prized Possession Skyrockets by More Than 100% https://t.co/8GR2p7kwKt #MMA #UFC,1520840496511262720,CunningSports
Conor mcgregor FUCKS jake even verbally.that c**t does not stand a fucking chance 💀,1520838777648062464,CLASHMS
Jake Paul issues scathing response following “jackass” comment from Conor McGregor: “I’m the one who has done more for fighters than you ever have” https://t.co/HswiZhtqec,1520835076036210689,zewkey2
"A Youtube vid you might like https://t.co/tREhVWcKiq Joe Rogan says Dana White wants to give next lightweight title shot to Conor McGregor,Islam on Conor",1520834651782275075,itsMMATalkLive
#JakePaul Accuses #ConorMcGregor Of Ducking Him https://t.co/Ex5MlybwlR,1520832976971575296,thirstyfornews
Why’s he walking round like Conor mcgregor at the end the clown https://t.co/kBalyT23zh,1520832637362966533,jshclkbrd
"https://t.co/sc4RizOI0U Jake Paul Responds to Conor McGregor: ""He Hasn't Won a Fight in 5 Years. Dana White Owns Him"" https://t.co/FCWhtkL2j7 https://t.co/BNjlw71eMB",1520831564065566721,Hoops227_NFL
"Conor McGregor, Jake Paul, Ryan Garcia among stars weighing in on Katie Taylor's victory over Amanda Serrano https://t.co/BPFmr5m01A",1520830891244859392,THETOPICisCOOL
"Jake Paul confirms next fight date with Conor McGregor, Mike Tyson, Tommy Fury and even dad John possible opponents https://t.co/l7AO7Iu9ZR",1520825896751570945,boxingtonightl1
"Jake Paul confirms next fight date with Conor McGregor, Mike Tyson, Tommy Fury and even dad John possible opponents https://t.co/F8gEPs7i9v",1520825892158820353,BoxingLiveToday
It's really funny watching Jake Paul desperately try to bait Conor McGregor into a fight and Conor probably doesn't even really know who he is.,1520825702265806849,Aleccarrmma
Conor McGregor Trash Talks Jake Paul After Katie Taylor's Victory over Amanda Serrano - TMZ https://t.co/xvhp6LVMEL #news #topstories #berkleybearnews,1520816081283149824,BerkleyBearNews
Conor McGregor Trash Talks Jake Paul After Katie Taylor's Victory over Amanda Serrano https://t.co/BuAXL2qUVS,1520815577564016641,JumpyPoindexter
"Andrei Arlovski ‘super upset’ with UFC Vegas 53 performance, was ‘really worried’ about scores 

UFC #UFC274 #UFC274  #MMA  Dana White #Boxing Conor McGregor #wrestling Khabib #fight Khamzat Chimaev https://t.co/WVtPayFQOp",1520815460434030599,MMAHWatch
"So I guess baseball isn’t a real sport? This tweet makes no sense. I still can’t believe your dunking the Conor McGregor fight. 😂 You get on Twitter &amp; beg for a UFC fight, but won’t fight Conor? What joke you’ve been busted in the head too many times. 🤡 https://t.co/hRPVuw5g9l",1520814185042612227,RealDylanStiles
"Bill Burr, an old comedian, threw a better opening pitch than Conor fucking  McGregor lmao 🤣😂😭😂😂😆🤠😂",1520813522137014272,HillcrestCardCo
"Jake Paul confirms next fight date with Conor McGregor, Mike Tyson, Tommy Fury and even dad John possible opponents https://t.co/cFv4gmoRx7",1520811705604972546,adabagcompany
Conor McGregor vs Jake Paul in the middle of any ring should be interesting,1520811607277899777,4evaX__
Jake Paul Promises Major Consequences for Dana White-Owned Conor McGregor Amidst Katie Taylor Remark https://t.co/QJ2rq4kkIX #Boxing #MMA,1520810822242430978,CunningSports
"QUESTION?

Outside of Conor McGregor who are the UFCs top 3 assets?",1520808307467948033,HolaDera
#ConorMcGregor Trash Talks #JakePaul After #KatieTaylor ‘s Victory over Amanda Serrano #UFC  https://t.co/7VLnPnZAnO,1520807866038464513,TheTraceC
"Could Katie Taylor beat Conor McGregor on pay-for-view? I don’t mean in a fight, I mean gaffer tape him to a chair and get her to punch him as hard as she can while we pay to watch?",1520805167750336512,edoloughlin
"#ConorMcGregor didn’t miss the chance to poke fun at Jake Paul on Saturday night, as he watched his compatriot Katie Taylor beat Amanda Serrano at Madison Square Garden

Continue reading at https://t.co/cx251a70Nc | 10z Soccer",1520805050842558466,lovehatemos
"My success isn’t a result of arrogance – it’s a result of belief. Conor McGregor
MISSION 300K LOADING
DESERVING WINNER ANJALI 
#AnjaliArora #Anjalians",1520804077713584128,ANJALIARORAFAN4
"Lynch (@BeckyLynchWWE) has once more welcomed the chance to team up with compatriot, McGregor (@TheNotoriousMMA) in the future. 
https://t.co/Z94kmpSoU3",1520803652142784515,LowKick_MMA
"#JakePaul Accuses #ConorMcGregor Of Ducking Him (via @ThirstyForNews)
https://t.co/1KKRPTgQZf",1520802766410629123,PWStream
https://t.co/IHuyjtire0 Jake Paul Responds to Conor McGregor Saying 'Who the F--k Is This Jackass' https://t.co/wpndYsz68h 🥊 https://t.co/1t3PWTR3w3,1520797224653004800,WomeninBoxing
Jake Paul’s Rival Eddie Hearn Throws Massive Shade at Conor McGregor Using Katie Taylor https://t.co/cL0D09sVsq #Boxing #MMA,1520794066681614336,CunningSports
"#JakePaul Accuses #ConorMcGregor Of Ducking Him (via @ThirstyForNews)
https://t.co/fX3I8HB4Gr",1520791421581729794,prowrestlingmag
Conor McGregor Trash Talks Jake Paul After Katie Taylor’s Victory over Amanda Serrano https://t.co/F9IzD9lyYO,1520790909503344641,dailynewskit1
"Coach: Colby Covington is ‘the next step up’ for Khamzat Chimaev 

UFC #UFC274 #UFC274  #MMA  Dana White #Boxing Conor McGregor #wrestling Khabib #fight Khamzat Chimaev https://t.co/ug7I1XrcYf",1520788061591937026,MMAHWatch
"Conor McGregor Trash Talks Jake Paul After Katie Taylor's Victory over Amanda Serrano  
https://t.co/Wmzfbcoxtl
#movies #movietrailers #celebritynews #movierecommendations https://t.co/lsHmdlJ8BA",1520784769071685632,TheGossipMash
"Check out UFC star Conor McGregor's unique and heartful message to conjoined twins posing with former’s belt

Full Details 👇

#UFC #ConorMcGregor #wrestling #WrestlingTwitter 
https://t.co/WiUNx4cLUb",1520782191059374080,sportstigerapp
- Conor Mcgregor clean https://t.co/pe2Dv2u13s,1520780587191128064,I_AM_CALLYWOOD
Is this normal behaviour at UN #NATOexpansion #NWO meetings @nbc @NBCNewsWorld #bbcsnooker Conor McGregor #StrayKids #Ukraine #nsfwtwt #Nuremberg2 #vaccineinjured https://t.co/gSlHQGVqKu,1520777784632750083,NewsNetq
NBA Leader: 24.7 PPG Conor McGregor vs Jake Paul- A Review!!!! https://t.co/waXDVFE8OT https://t.co/g8O6PoNV3K,1520777457485287424,Hoops227_NFL
"I fear no man,if u breathe,it's a 
fair game -Conor McGregor",1520777090458607616,Denuar_007
#latestnews Conor McGregor Trash Talks Jake Paul After Katie Taylor's Victory over Amanda Serrano - https://t.co/xTYUnLugkx (POST_EXCERPT} https://t.co/c7yoh9b9pr,1520776236817162243,ClickySound
"Conor McGregor, Jake Paul, Ryan Garcia among stars weighing in on Katie Taylor's victory over Ama... - via @ESPN App.   https://t.co/3szKip40K0",1520774091959148547,QueensIceZ
Everytime i see pickford i see conor mcgregor,1520770808309821440,Triple_jay8
"Jordan Pickford strutting around like Conor McGregor, after that double-save.

#EVECHE https://t.co/SL2iMuyTf3",1520770019365433345,RickOShea54321
"He’ll be shite for months, then make one amazing save and act like prime Conor McGregor, proper dickhead https://t.co/ozvkcrdwyJ",1520769978563059713,RitsonLFC
Conor McGregor Trash Talks Jake Paul After Katie Taylor's Victory over Amanda Serrano https://t.co/qKwQxu7g6k,1520769938104983555,AttrRadio
"Football needs people like Pickford man, he’s so funny. If he has to save a shot he loses his head and then if he saves it he’s doing the Conor McGregor walk around his box.",1520769934430777344,FourFourJordan
Pickford doing Conor McGregor  walk 😅😅😅😍,1520769530464808962,thabelo_maxi
What’s the difference between Conor McGregor and my mom? My mom likes being choked out 🤣✋🏻,1520768334815453185,RealJadenRex
Hosted By MFrazz: Conor McGregor Trash Talks Jake Paul After Katie Taylor's Victory over Amanda Serrano https://t.co/l0NYxcYYI2,1520767391613038592,MFRZProductions
Jake would get smashed by Connor easy.  https://t.co/RTDypVnmxy,1520766704195977216,NXTisLove
"Breaking story: Jake Paul trashes Conor McGregor following Taylor vs. Serrano: ‘He’s ducking me’ - MMA Fighting https://t.co/7ALpsPScDX, see more https://t.co/LxU3CMoK3R",1520766175621545984,redneckoz
Conor McGregor Trash Talks Jake Paul After Katie Taylor's Victory over Amanda Serrano https://t.co/tiQlKXXn2h,1520765874545733633,worldnews_guru
Conor McGregor Trash Talks Jake Paul After Katie Taylor's Victory over Amanda Serrano https://t.co/7GLAOIZBHw,1520765573570961409,OpeningDayNFL
Duro cruce entre Jake Paul y Conor McGregor en redes https://t.co/pnbHh1LHGI,1520765546114990082,Salta4400com
"Main card fighter high 5s Keith Peterson Follow Us on Instagram : https://t.co/8D209ChOvL 

UFC #UFC274 #UFC274  #MMA  Dana White #Boxing Conor McGregor #wrestling Khabib #fight Khamzat Chimaev https://t.co/GUmp5qZJ7O",1520765357077766146,MMAHWatch
Conor McGregor Trash Talks Jake Paul After Katie Taylor's Victory over Amanda Serrano https://t.co/HfeULfBIPJ,1520762986352324608,AllInMyGrill_
Conor McGregor Trash Talks Jake Paul After Katie Taylor's Victory over Amanda Serrano https://t.co/VkbzUIkAdP,1520762789731749889,K4S_Ent
WWE: Becky Lynch vorrebbe far coppia con Conor McGregor #BeckyLynch #WWE https://t.co/1RMNPukBDY,1520762516086927362,SpazioWrestling
"Conor McGregor and Tommy Robinson are top primary sources
https://t.co/dWaLOpoOZ9 https://t.co/JxwDBDTxaO",1520761548901388289,AACaragea
Conor McGregor Trash Talks Jake Paul After Katie Taylor's Victory over Amanda Serrano https://t.co/8tH49qVxY7,1520760670257561603,bouncenationke
"I respect men who talk shit or talk a lot ""like a little sissy"" but can back it up. Esp when they beat the ""strong silent types"".

Always hated stereotypes. For one, prime Conor McGregor was hella entertaining to watch.",1520759994098253829,DarKVoiD_FGC
Conor McGregor Trash Talks Jake Paul After Katie Taylor’s Victory over Amanda Serrano https://t.co/6WNNN5SjBX,1520759197415227395,NikhilS18830535
Conor McGregor Trash Talks Jake Paul After Katie Taylor’s Victory over Amanda Serrano https://t.co/2sKRSaoDYE,1520759193187328000,Wowbabytoys
not that i support conor mcgregor but this ratio hahahahahahah https://t.co/q53B2rP2ZO,1520758764307107843,EmmaIsAinmDom
Conor McGregor Trash Talks Jake Paul After Katie Taylor's Victory over Amanda Serrano https://t.co/0DVW6YdZ1K,1520758432281899008,gospaddiction
"Marlon Vera calls for Jose Aldo rematch: ‘I would love to kick his ass’ 

UFC #UFC274 #UFC274  #MMA  Dana White #Boxing Conor McGregor #wrestling Khabib #fight Khamzat Chimaev https://t.co/IV1eyjYxPz",1520758235900387329,MMAHWatch
"[SPOILER] Former UFC Bantamweight Champion and UFC Lightweight contender Side-By-Side Follow Us on Instagram : https://t.co/8D209ChOvL 

UFC #UFC274 #UFC274  #MMA  Dana White #Boxing Conor McGregor #wrestling Khabib #fight Khamzat Chimaev https://t.co/Tf4lcMLeK1",1520758229646594048,MMAHWatch
Conor McGregor Trash Talks Jake Paul After Katie Taylor's Victory over Amanda Serrano - https://t.co/9CXf0gS6ph,1520758065787666432,globaltimesng
Conor McGregor Trash Talks Jake Paul After Katie Taylor's Victory over Amanda Serrano https://t.co/S9T09y2iA7 https://t.co/FxqbTgMY8m,1520757568175452160,Knewz_Currently
Conor McGregor Trash Talks Jake Paul After Katie Taylor's Victory over Amanda Serrano https://t.co/Q4VfyeTzgy,1520757451859148801,Gossipy01641419
Conor McGregor Trash Talks Jake Paul After Katie Taylor’s Victory over Amanda Serrano https://t.co/JJM6JW6ptf,1520756969216385024,olas_tv
Conor McGregor Trash Talks Jake Paul After Katie Taylor's Victory over Amanda Serrano https://t.co/qoXbRaoAY7,1520756438125080577,CunningShowbiz
"Conor McGregor Trash Talks Jake Paul After Katie Taylor's Victory over Amanda Serrano https://t.co/UdaW77l395 Earn money now. Work on the Internet! https://t.co/XBKDNZ447g
 (#Siguemeytesigo) (#Followback) (#News) (#SDV)",1520755759868481541,smorffer
Conor McGregor Trash Talks Jake Paul After Katie Taylor’s Victory over Amanda Serrano https://t.co/4xSJxDlL3l,1520755349120241666,ArleneValledo
Jake Paul trashes Conor McGregor following Taylor vs. Serrano: ‘He’s ducking me’ - https://t.co/QXKG7XhLhr,1520753147089719298,worldofmma
Conor McGregor and Jake Paul engage in war of words after Katie Taylor vs Amanda Serrano fight https://t.co/pd5eNBqw1n https://t.co/roZKo8NvHR,1520746377210335234,SPORTSCIRCUSINT
"Conor McGregor, Jake Paul, Ryan Garcia among stars weighing in on Taylor's victory - via @ESPN App These Ladies were NOT scared to go toe to toe and exchange blows ! NO running ! NO whining ! NO showboating and NO B/S either ! Guys take note !  https://t.co/UNYLNkCUsY",1520746339348496384,INFAMOUS69K
"“If you deserve it, go get it.” – Conor McGregor

SUBAH SE SHAAM WITH PRATIK
SUBAH SE SHAAM OUT TOMORROW",1520745190763360258,sambitdas3
"""All that matters is how you see yourself.” – Conor McGregor

SUBAH SE SHAAM WITH PRATIK
SUBAH SE SHAAM OUT TOMORROW",1520745062350475265,sambitdas3
"“I stay ready so I don’t have to get ready.” – Conor McGregor

SUBAH SE SHAAM WITH PRATIK
SUBAH SE SHAAM OUT TOMORROW",1520745016099938304,sambitdas3
"""Do I hate my opponents? How can I hate someone who has the same dreams as me?” – Conor McGregor

SUBAH SE SHAAM WITH PRATIK
SUBAH SE SHAAM OUT TOMORROW",1520744987180212226,sambitdas3
"""Be grateful with everything you have and you will be successful in everything you do.” – Conor McGregor

SUBAH SE SHAAM WITH PRATIK
SUBAH SE SHAAM OUT TOMORROW",1520744946147332097,sambitdas3
"My success isn’t a result of arrogance. It’s a result of belief.” – Conor McGregor

SUBAH SE SHAAM WITH PRATIK
SUBAH SE SHAAM OUT TOMORROW",1520744886617579521,sambitdas3
"Look out for those who look out for you. Loyalty is everything.” – Conor McGregor

SUBAH SE SHAAM WITH PRATIK
SUBAH SE SHAAM OUT TOMORROW",1520744859568537600,sambitdas3
"We’re not just here to take part. We’re here to take over.” – Conor McGregor

SUBAH SE SHAAM WITH PRATIK
SUBAH SE SHAAM OUT TOMORROW",1520744829398880256,sambitdas3
"Winner focus on winning. Losers focus on winners.” – Conor McGregor

SUBAH SE SHAAM WITH PRATIK
SUBAH SE SHAAM OUT TOMORROW",1520744800860876802,sambitdas3
"Smart work pays best. Trust it.” – Conor McGregor

SUBAH SE SHAAM WITH PRATIK
SUBAH SE SHAAM OUT TOMORROW",1520744771412668416,sambitdas3
"What defines us is how well we rise after falling.” – Conor McGregor

SUBAH SE SHAAM WITH PRATIK
SUBAH SE SHAAM OUT TOMORROW",1520744740630663169,sambitdas3
"Always look to learn. Learning something new is a great feeling. The feeling of progress.” – Conor McGregor

SUBAH SE SHAAM WITH PRATIK
SUBAH SE SHAAM OUT TOMORROW",1520744707986366464,sambitdas3
"I’m going to the stars and then past them.” – Conor McGregor

SUBAH SE SHAAM WITH PRATIK
SUBAH SE SHAAM OUT TOMORROW",1520744681449000961,sambitdas3
"When I say something is going to happen, it’s going to happen.” – Conor McGregor

SUBAH SE SHAAM WITH PRATIK
SUBAH SE SHAAM OUT TOMORROW",1520744654802542592,sambitdas3
"Nothing good ever comes from worrying or sitting there feeling sorry for yourself… keep positive and keep pushing on and things will turn good.” – Conor McGregor

SUBAH SE SHAAM WITH PRATIK
SUBAH SE SHAAM OUT TOMORROW",1520744614700851200,sambitdas3
"Jake Paul trashes Conor McGregor following Taylor vs. Serrano: ‘He’s ducking me’ 

UFC #UFC274 #UFC274  #MMA  Dana White #Boxing Conor McGregor #wrestling Khabib #fight Khamzat Chimaev https://t.co/m65mcEEqhe",1520744250727710720,MMAHWatch
"[Spoiler] Main event fighter landing a heel kick Follow Us on Instagram : https://t.co/8D209ChOvL 

UFC #UFC274 #UFC274  #MMA  Dana White #Boxing Conor McGregor #wrestling Khabib #fight Khamzat Chimaev https://t.co/4oZGpQbXXG",1520744240543932416,MMAHWatch
"Doubt is only removed by action. If you’re not working then that’s where doubt comes in.” – Conor McGregor

SUBAH SE SHAAM WITH PRATIK
SUBAH SE SHAAM OUT TOMORROW",1520743885265268736,sambitdas3
"I have never encountered a winner that held hate towards something.” – Conor McGregor

SUBAH SE SHAAM WITH PRATIK
SUBAH SE SHAAM OUT TOMORROW",1520743838796591105,sambitdas3
"It’s not really that much big of a deal – you brush it off and you come back. Defeat is the secret ingredient to success.” – Conor McGregor

SUBAH SE SHAAM WITH PRATIK
SUBAH SE SHAAM OUT TOMORROW",1520743798480900098,sambitdas3
"I’m just going to keep doing what I’m doing. Keep proving people wrong and proving myself right.” – Conor McGregor

SUBAH SE SHAAM WITH PRATIK
SUBAH SE SHAAM OUT TOMORROW",1520743700996919297,sambitdas3
"“At the end of the day, you’ve gotta feel some way. So why not feel unbeatable? Why not feel untouchable?” – Conor McGregor

SUBAH SE SHAAM WITH PRATIK
SUBAH SE SHAAM OUT TOMORROW",1520743654687592449,sambitdas3
"“I keep having vivid dreams of success. Then it’s time to sleep.” – Conor McGregor

SUBAH SE SHAAM WITH PRATIK
SUBAH SE SHAAM OUT TOMORROW",1520743590434988032,sambitdas3
"Failure is not an option for me. Success is all I envision.” – Conor McGregor

SUBAH SE SHAAM WITH PRATIK
SUBAH SE SHAAM OUT TOMORROW",1520743534709469184,sambitdas3
Jake Paul trashes Conor McGregor following Taylor vs. Serrano: ‘He’s ducking me’ https://t.co/Z8GI5Vtb9l via @MMAFighting,1520743471258083328,MMAAlley
"Excellence is not a skill. Excellence is an attitude.” – Conor McGregor

SUBAH SE SHAAM WITH PRATIK
SUBAH SE SHAAM OUT TOMORROW",1520743465092456449,sambitdas3
"I stay ready so I don’t have to get ready.” – Conor McGregor

SUBAH SE SHAAM WITH PRATIK
SUBAH SE SHAAM OUT TOMORROW",1520743418200092673,sambitdas3
"All that matters is how you see yourself.” – Conor McGregor

SUBAH SE SHAAM WITH PRATIK
SUBAH SE SHAAM OUT TOMORROW",1520743348578881536,sambitdas3
"“Do I hate my opponents? How can I hate someone who has the same dreams as me?” – Conor McGregor

SUBAH SE SHAAM WITH PRATIK
SUBAH SE SHAAM OUT TOMORROW",1520743276470435841,sambitdas3
"Conor Mcgregor winning the biggest fight in MMA history
Katie Taylor winning the biggest female fight in boxing history 

Irish &amp; Fighting legends🇮🇪🇮🇪🇮🇪 https://t.co/wvhkTNTeXd",1520742436179427329,MattCFC16
Conor McGregor ridicules Jake Paul: Who is this jackass in the pink Jimmy Saville glasses? https://t.co/fNZ4SoVRei ⚽️⚽️  📲 Bet now via ⟶ https://t.co/0I4IIflkwI √ https://t.co/2j4BFZEXqa,1520736825102372864,SportsbookBTC
