full_text,tweet_id,screen_name
"@MarkRuffalo you are a total idiot

Over +20K dead Ukrainians &amp; Russians and you make a play on green energy…

Get a clue

https://t.co/Hah6gxFgsF",1519100402297409538,RCUSA86
Mark Ruffalo calls Ukraine war 'gift' for President Biden's climate change agenda | Fox News How thoughtful of you ⁦@MarkRuffalo⁩  https://t.co/YSykEuWFlx,1519100230456823808,jchristian61
"Mark Ruffalo’s medicine cabinet must be the size of a steamer trunk. 

https://t.co/NWBWUuxRyc",1519100222852501504,MichaelHoff
"Mark Ruffalo calls Ukraine war 'gift' for President Biden's climate change agenda

https://t.co/BqqOz6Eokv",1519099462362181635,westcoast_lyfe
"Paying to keep the War going to get Green New DEAL MARK !! Great way to EXPOSE how pay with our TAX $$ THANKS for Letting the CAT out to f the BAG  Mark Ruffalo calls Ukraine war 'gift' for President Biden's climate change agenda

https://t.co/wxOLRA8MzC",1519099243067285511,busters2215
evil genius Kim Kardashian described Mark Ruffalo near The White House,1519097066525368320,celebheadlinesb
Mark Ruffalo calls Ukraine war 'gift' for President Biden's climate change agenda https://t.co/mqJhSJaSrR #FoxNews,1519096725973131266,TX_ojc
"@MarkRuffalo please go over to #Ukraine and tell that to the families of all the dead. 

Mark Ruffalo calls Ukraine war 'gift' for President Biden's climate change agenda

https://t.co/vbhtlf4xgw",1519095358139387906,RandyCaputo
Mark Ruffalo calls Ukraine war 'gift' for President Biden's climate change agenda https://t.co/AKZa1God4F #FoxNews,1519094189501435910,JasonSeasons
"I guess #markruffalo hasn't seen people putting $5 worth of gas in their car so they can get to work. Maybe he'll start donating electric cars to those who can't afford em

Mark Ruffalo calls Ukraine war 'gift' for President Biden's climate change agenda

https://t.co/vbhtlf4xgw",1519093758960222209,RandyCaputo
"They don’t care about how the war affects the people of Ukraine, only about how it affects their agenda. Which tells you everything you need to know.

Mark Ruffalo calls Ukraine war 'gift' for President Biden's climate change agenda

https://t.co/M2Rx0Ht6m5",1519092579832315904,RP72880
Mark Ruffalo calls Ukraine war 'gift' for President Biden's climate change agenda https://t.co/vl0ulIPfLL #FoxNews,1519092346973036544,EdvElizabeth
"@MarkRuffalo ur foolishness pushing all green energy will put lives at stake.  Please be informed!
Mark Ruffalo calls Ukraine war 'gift' for President Biden's climate change agenda

https://t.co/sQRBiCR102",1519091728178987011,lvirish126
"Have you no decency @MarkRuffalo? I mean, spokesmen for the #nazi party rarely do. But, even for you this is low. 

#Hateful #compassion 

https://t.co/TIyOfFilTk #FoxNews",1519090990354780160,bwood2022
Seems like an investigation movie starring Mark Ruffalo. https://t.co/o7XyoyO5Kb,1519090432453480448,robinbenty
"Ruffalo is nuts.

Mark Ruffalo calls Ukraine war 'gift' for President Biden's climate change agenda

https://t.co/oQUeHH2XN9",1519088060574715904,psychforensic
"Mark Ruffalo the Israel hater, who according to GOOLGE is a very wealthy socialist worth $35 million. He spends his time saying what's for you, not himself. 

Mark Ruffalo calls Ukraine war 'gift' for President Biden's climate change agenda https://t.co/Qu6AAmIGe2 #FoxNews",1519088014093389828,m4s1w7
"Mark Ruffalo calls Ukraine war 'gift' for President Biden's climate change agenda https://t.co/k5JAlCzuxa #FoxNews a gift, people are dying and he calls it a gift to Biden, wtf is wrong with him",1519087436982370304,LBLucky9
"This war is no one's 'gift'. There are other non-offensive words he could've used. Civilians are being killed and raped, millions have fled &amp; don't know where to go. Not a 'gift'.

https://t.co/W6StHoqoWv",1519087230970605568,TrudnowskiDiana
"Calling the war in Ukraine a gift is an absolute piece of shit move. Classic liberal thinking 
https://t.co/KxIITl1U9B",1519087110741016578,CopseOfTrees
"And there it is...

Mark Ruffalo calls Ukraine war 'gift' for President Biden's climate change agenda https://t.co/stKmkkNTy2 #FoxNews",1519086913960960009,WesleyHuntingt1
Mark Ruffalo: Ukraine war is 'gift' for President Biden's climate change agenda |  https://t.co/mBOz0uHSzQ.  A “gift” ??  Mark….you are a dim witted celeb.  I am sure the Ukrainian’s would take exception to your nonsense.  Pitiful.,1519086845338005504,gbogeymaker
"A gift from and to himself then? It's like saying a man raping a woman is a gift to the man. He was instrumental in starting the war, now he fuels it for own gain. Crazy eat ze bugs syndicate.
https://t.co/WUWYhgEJby",1519085860611932163,swee_la
Mark Ruffalo calls Ukraine war 'gift' for President Biden's climate change agenda https://t.co/dJ2J1JQDGD,1519084794239356929,Briefing__Room
"This clown is using the deaths of thousands of people to push the fraud known as climate change. Disgusting, but not surprising. It's what liberals do.
Mark Ruffalo calls Ukraine war 'gift' for President Biden's climate change agenda https://t.co/3NbltPVjxx #FoxNews",1519084638072938496,bobharrison63
Mark Ruffalo calls Ukraine war 'gift' for President Biden's climate change agenda https://t.co/hggFBvkYJ9 #FoxNews This guy is a buffoon!!,1519083488837877761,Roxieco63752201
"TYPICAL ""NEVER WASTE A TRAGEDY!"" LIBS MANTRA
Actor Mark Ruffalo claimed on MSNBC Reports Tuesday that the war in Ukraine has been a ""gift"" for President Joe Biden’s climate change initiatives and called on the president to ""use"" people’s ""fear,"" ""disgust"" of the war in Ukraine.",1519083387931152384,blerma54
"Mark Ruffalo, a bad actor, is a big dick.",1519083084293017602,babbs50
"Mark Ruffalo calls Ukraine war 'gift' for President Biden's climate change agenda

https://t.co/XPoTWgQKC2

This guy is not us
He is an elite. Listen to nothing he says.",1519082949509103617,RTRAMERICA
"Mark Ruffalo calls Ukraine war 'gift' for President Biden's climate change agenda

https://t.co/vC4WOOfw08

And how much money do YOU make a year, ⁦@MarkRuffalo⁩ ?",1519082316022398976,DarrenHemann
"⁦What a truly blind and heartless cult member this guy is: ⁦@MarkRuffalo⁩ calls Ukraine war 'gift' for President Biden's climate change agenda

https://t.co/nszxDOeMef",1519082265615155201,miamivandynyu
Mark Ruffalo calls Ukraine war 'gift' for President Biden's climate change agenda https://t.co/ele4YgJawo #FoxNews,1519081762894147584,stefan231
"Sicko. War is NEVER a gift. Wholesale slaughter of civilians is not a gift War crimes are not a gift. Mass graves are not a gift. Rampant rape of women a children is not gift.

https://t.co/Q7e3TUByrr #FoxNews",1519081081445752832,ZuzaZasada
Mark Ruffalo is a total ass!! https://t.co/xWP5LlaDom,1519077288549228544,katey_dids
"Just opened Twitter for the first time in 7 years, followed 60 conservatives (with 3 exceptions) and my top suggested likes are WHO, CDC and Mark Ruffalo...
THANK YOU @elonmusk #ElonMuskBuysTwitter",1519076822419488769,Fishtopher24
"Mark Ruffalo claimed the war in Ukraine is a ""gift"" to President Biden to help make America's transition to clean energy happen.... https://t.co/UoPgZS1UHa",1519075665231826949,SkyNetPlatform
"Mark Ruffalo is celebrating and referring to genocide of thousands of Ukrainians as a 'gift.'  This is why Hollywood is bleeding cash. 

Mark Ruffalo calls Ukraine war 'gift' for President Biden's climate change agenda

https://t.co/A9hmoVtGC0",1519071745646411776,Scott100234372
"Actor and self-proclaimed ""environmental justice"" advocate Mark Ruffalo called on President Joe Biden Tuesday to accept the war in Ukraine as ""a gift"" for making steps toward clean energy production.... https://t.co/DQe6yhgr2Q",1519069800185561088,SkyNetPlatform
"WATCH: Actor Mark Ruffalo says Ukraine war is ""a gift"" for clean energy efforts https://t.co/pF4TXWPLRF #boycott #boycottmarkruffalo #stopmakinghollywoodrich #Hypocrite #soinsentitive",1519069183988072448,Meln3533
Mark Ruffalo calls Ukraine war 'gift' for President Biden's climate change agenda https://t.co/hssFGsBq1Y #FoxNews,1519067626911240192,JaycoxHenry
Progressive Mark Ruffalo calls Ukraine war 'gift' for President Biden's climate change agenda https://t.co/7Cyvt5Cy3S #FoxNews,1519067026706345985,fiorazo
Mark Ruffalo Explains Why Gas Prices Are a 'Gift' to Biden // as a political pundit Mark Ruffalo should stick to acting https://t.co/GiKg0cMMje,1519066071734665218,lvdjgarcia
Mark Ruffalo calls Ukraine war 'gift' for President Biden's climate change agenda https://t.co/5lRVG2ngvR #FoxNews,1519065212506230787,jimtony72399821
Mark Ruffalo calls Ukraine war 'gift' for President Biden's climate change agenda https://t.co/VydOAxUOfT #FoxNews,1519064232247152643,thmsm74
"Fear and Disgust Over War, #GasPrices Is a ‘Gift to the President’ on Climate, #MarkRuffalo Tells #MSNBC https://t.co/XNhyT1G5dj https://t.co/fUBCGN7Gz3",1519059576024297472,Knewz_Currently
"Apparently @MarkRuffalo  has found a good side to Russia's invasion of Ukraine.
https://t.co/c2Hfa2A0ch",1519058449409138689,gabrieljhays
Mark Ruffalo calls Ukraine war 'gift' for President Biden's climate change agenda https://t.co/aSX8YXHqNF #FoxNews,1519057090580553731,RayEvan19849476
"Mark Ruffalo calls Ukraine war 'gift' for President Biden's climate change agenda

https://t.co/HvGWzd8n2L It's because of Biden we're in the war.",1519056306937769984,jmor539
"Actor and self-proclaimed ""environmental justice"" advocate Mark Ruffalo called on President Joe Biden Tuesday to accept the war in Ukraine as ""a gift"" for making steps toward clean energy production. Ruffalo promised that he and his clean energy

https://t.co/apnBoyWaIo https://t.co/t2er7mHhHe",1519052498136444928,Newsenm
"Fear and Disgust Over War, Gas Prices Is a 'Gift to the President' on Climate, Mark Ruffalo Tells MSNBC https://t.co/9gSAPes7Zf",1519051988775940097,WritingLeeman
"Mark Ruffalo calls Ukraine war 'gift' for President Biden's climate change agenda

https://t.co/JKCTqr40ON",1519051101886197760,JJDJ1187
Mark Ruffalo en 13 going on 30. That’s the tweet,1519050428943634434,jedduriez
"Mark Ruffalo, I will do my part for climate change and burn no fossil fuels driving to any movie you in! Of course there are other movies for me to drive too! And I will! Often!",1519048485319766016,MarkHatton22
"ICYMI: Veteran and clean energy leader @Johnson_Kevin2 and @MarkRuffalo  joined @KatyTurNBC to talk about clean energy independence. 

Watch here:
https://t.co/ALXmYI6vEY",1519047144832970753,ce4america
"Mark Ruffalo calls Ukraine war 'gift' for President Biden's climate change agenda

https://t.co/27sMpSobM2
Are you seriously doing this? This invasion you ⁦@MarkRuffalo⁩ consider this a “gift” ? People have died &amp; you  consider this a “gift “ to sell climate change? Idiot",1519046005936869376,SabrinaNC10
CONFIRMED: Mark Ruffalo’s Bruce Banner/Hulk will appear in #ThorLoveAndThunder post-credit scene! https://t.co/kBHFkznZOn,1519045727636361216,MCUSource
Mark Ruffalo calls Ukraine war 'gift' for President Biden's climate change agenda https://t.co/i3WdBopijw https://t.co/h2vp6ov49j,1519045462946287616,ZyiteGadgets
Mark Ruffalo calls Ukraine war 'gift' for President Biden's climate change agenda https://t.co/zeHWdWHHrN #news #topstories #berkleybearnews,1519045452921925632,BerkleyBearNews
Mark Ruffalo calls Ukraine war 'gift' for President Biden's climate change agenda https://t.co/wklpxInm1i via @foxnews,1519045424870420481,Chris_1791
"Andy Vermaut shares:Mark Ruffalo calls Ukraine war 'gift' for President Biden's climate change agenda: Mark Ruffalo claimed the war in Ukraine is a ""gift"" to President Biden to… https://t.co/8OoAbyNNR7 Thank you. #ThankYouJournalistsForTheNewsWeGetFromYou #AndyVermautThanksYou https://t.co/e1t6WNT0f5",1519045422328602629,AndyVermaut
"Mark Ruffalo calls Ukraine war 'gift' for President Biden's climate change agenda                                                What is wrong with these people?!  ⁦@MarkRuffalo⁩ Tell that to the family members of those in mass graves!  DISGUSTING!

https://t.co/iuHFiEhwJx",1519044707942338561,TW_WarDog
"Mark Ruffalo calls Ukraine war 'gift' for President Biden's climate change agenda https://t.co/tKHZ4CgLKu #FoxNews 

Idiot, it proves this climate change garbage is russian propaganda meant to take over world energy moron.  And that why russia is doing this.",1519044405247754243,SouthFloridaJoe
"Mark Ruffalo calls Ukraine war 'gift' for President Biden's climate change agenda
#123INFO
https://t.co/dcJK1NWFKM",1519044109717102594,123_INFO_USA
"Fear and Disgust Over War, Gas Prices Is a ‘Gift to the President’ on Climate, Mark Ruffalo Tells MSNBC https://t.co/uaV2fI15K0",1519039651784237061,realTuckFrumper
"""Stick around. Don’t lose your heart, just keep going, keep at it."" - Mark Ruffalo",1519033258570362880,alirazaabbass
"""Stick around. Don’t lose your heart, just keep going, keep at it."" - Mark Ruffalo",1519032816083816449,EzuieQuotes
Jonas had a twitter argument with Loki for fancasting Mark Ruffalo as Noh Varr,1519028801274929152,YAhottakes
World renowned expert on nuclear power. “To whom should we go for an incisive and educated statement on nuclear power?” “Mark Ruffalo?” “Of course! Why didn’t I think of that!?!” https://t.co/qYdjGkbyno,1519028520730697729,DougWagner
STAY YOUR ASS HOME OR MARK RUFFALO GETS IT !!!🔫🦠,1519021275745644546,STAYYOURASSHOME
VIDEO - Mark Ruffalo: ‘Nuclear [Energy] Is Very Expensive and It’s Very Dangerous’  https://t.co/StrOqU8CGZ,1519019838424952832,GrabienMedia
i think pedro pascal and mark ruffalo should be in a movie together,1519014764256636931,wlwaititi
"I have told 2 people about my crush on Mark Ruffalo, and both times I got laughed at.",1519008570335019011,AyeCaptainMar
mark ruffalo is delectable and im tired of pretending he’s not,1519005505250811911,joeleigh_
Mark Ruffalo is so hot. Hottest avenger bye.,1519001342521585669,megs_christina
Actor Mark Ruffalo Challenges President Biden on New Clean Energy Campaign https://t.co/RYeBOIH5hS via @YouTube #EarthDay2022 #CleanEnergy #GreenNewDeal #markruffalo #CleanEnergyFreedom #MARK #politics #new #news #BreakingNews #MSNBC #ClimateCrisis #climate #climatechange #biden,1518998460556529664,ShyDux1
"YES! I’ve been waiting for them to have a reunion! Now add Mark Ruffalo, Rachel Weisz, and Rinko Kikuchi 🤩 https://t.co/FZQYsBYK1w",1518990730445869056,hawloffame
Just got off the phone with Mark Ruffalo and we're taking GeoCities private!!!  💸 🥳🤯🌠🚀 #ToTheMoon,1518961754918862848,escargotpro_
Mark Ruffalo is the best! 💚 https://t.co/HAHF3wNoHD,1518961453058908161,mayke_marcelo
"#OTD 2019 #AvengersEndgame starring #RobertDowneyJr  #ChrisHemsworth Mark Ruffalo, #ChrisEvans #ScarlettJohansson Benedict Cumberbatch, Don Cheadle, #TomHolland #chadwickboseman Directed by Anthony Russo, Joe Russo #fantasy #superheroes #action https://t.co/4NxqelCD16",1518958338616094721,lionsroar91406
Mark Ruffalo at the Avengers Endgame premiere (2019) https://t.co/fHY5VI5TSc,1518956832747892738,hourlyruffalo
"I just saw Mark Ruffalo in an episode of ""Due South"" - 'A Cop, A Mountie and a Baby'  (episode 10, season one).

Had no clue he worked in TV, back in the day.",1518952721176571904,Snoproblem11
"my dream cast for a Hercules live action ☺️
tom holland as hercules 
ariana grande as meg 
mark ruffalo as zeus 
kate winslet as hera 
william dafoe as hades
danny devito as phil 
the muses: jenifer hudson, amber riley, jordan sparks, janelle monae, and jasmine cephas jones",1518952381450436610,sydandsuch
"You're Annie, you like puzzles, and little monsters on your pencil, and some guy named Mark Ruffalo. You're a fierce competitor, and a sore loser. You expect everybody to be better than who they are, and you expect yourself to be better than everyone, which... is cool.",1518951406228492289,nadiaquotestm
".@kenroth has lavished praise on antiSemitic actors like Mark Ruffalo and others. But when Noa Tishby defended Israel, Roth disparaged her as a mere ""actress"". So it turns out that Roth is not only an antiSemite but he is an antiSemite and sexist all rolled into one.",1518938163858874369,HowieGoldfarb24
"Avengers: Endgame, directed by Anthony and Joe Russo and starring Robert Downey Jr., Chris Evans, Mark Ruffalo, Chris Hemsworth, Scarlett Johansson, Jeremy Renner, Don Cheadle, Paul Rudd, Brie Larson, Karen Gillan and Josh Brolin, was released on this day in 2019 (USA) 🎬 https://t.co/K4dkr0TC4I",1518927733358796802,SciFi31
My two fav things about old TV shows are period toy cameos &amp; surprise pre-fame appearances by big stars. This 1995 episode of Due South features a Turtle Copter (plus a mystery blue thing) &amp; Mark Ruffalo as a guy trying to sell his baby. Maybe he wanted cash for a Turtle Copter? https://t.co/K5MQJ0XsVF,1518916624790827010,Slightlyonfire
Be There or Be Square (Slowly Going the Way of Mark Ruffalo) - Lamonta [Pop-Punk] (2020) https://t.co/kKlraJlpkh,1518875131455627264,Frankieandthebb
AVENGERS 5: Age Of #Galactus Teaser (2022) Mark Ruffalo &amp; Tom Holland    https://t.co/KpeWL8Uf5S https://t.co/v7wN2EmkH7,1518862596887228416,jameskittehmon
sexy Mark Ruffalo washed Joe Biden beside the AMC by Union Square,1518855418163851264,celebheadlinesb
I made the mistake of taking a nap from 8pm to 10pm and now I’m wide awake and crying at a Mark Ruffalo movie.,1518850314933178371,hanschf16
"Yeahh Mark Ruffalo

Uh?",1518844570372653058,VirtualBusta
lizard loving Mark Ruffalo described Mick Jagger next to Mom's kitchen,1518840572814888960,celebheadlinesb
"If I was mark ruffalo and they made me look like this post-editing, I too would be embarrassed https://t.co/MHGRP26IEs",1518809646458228736,wonderwallh8r
we’re back https://t.co/50D9KszS8l,1518801576592351232,mark__ruffalo
"would hold hands with: Anthony Fantano, Grimes, Chelsea Manning, Mark Ruffalo, Porter Robinson, Adam Young

Wouldn't let anywhere near me: @vaush 

chasers genuinely scare me",1518788513772277760,TrashBlankit
"Has anyone checked on Alyssa Milano, Mark Hamill, Mark Ruffalo, AOC and Rob Reiner to make sure they're ok?",1518782784319410176,Zartman44
".@elonmusk When you take over, can you make it so that Twitter stops sending me emails every time Chris Evans or Mark Ruffalo has a brainfart?  I watch the Marvel movies but that doesn't mean I want self-important actors' opinions clogging up my inbox.",1518769918782713861,CheckersSpeech
fashionable Mark Ruffalo fat shamed Kris Jenner next to Mars,1518764883495374848,celebheadlinesb
Mark Ruffalo has been in so many romcoms.,1518761038384177152,Pilnok
I got called an alcoholic Mark Ruffalo.  I'll take it. https://t.co/uo3fCRJs18,1518759014804434944,prodigal_paulo
The Bon Jovi loving Mark Ruffalo confused Cher in Mom's kitchen,1518742213672398849,celebheadlinesb
Looks like Mark Ruffalo https://t.co/JZ1gF8wN1R,1518741050231246849,UrbanDale78
"Facial Paralysis in the News
In 2000, actor Mark Ruffalo was diagnosed with acoustic neuroma, a non-cancerous tumor that can develop in the main nerve between the inner ear and brain. 
Read the article ➡️ https://t.co/c2BxdbiSeN",1518734361004285960,NewYorkFPC
Thought this was mark ruffalo https://t.co/7MKfqzsl8y,1518729393417371649,freshsteves
I'm not deleting my Twitter account until Mark Ruffalo lets me watch him eat a banana.,1518729100264886273,marroneist
Mark Ruffalo blames Israeli ‘occupation’ for Temple Mount violence https://t.co/0X6SnZCFQq,1518713676324298757,JonathanWeine12
"“Steve Carell, Mark Ruffalo, and Channing Tatum. Three different generations of actors all performing at the highest level.” - Park Chan-Wook on Foxcatcher
 
https://t.co/Vv3YdlNHr1",1518711186656620544,AraujoPedroo
one of my undergrad profs walked into the library and I had forgotten (1) that he existed and (2) that he's a vaguely hot off-brand mark ruffalo,1518707836381020160,KGrantFic
"gotta laugh bc alyssa said she'd love to act alongside mark ruffalo and kate winslet and when she got asked if she'd like to play a romcom with mark i just went ""why mark when kate is right there"" 😭",1518700422256599041,norawestallens
"*Mark Ruffalo: Israel attacks Muslim worshipers, journalists at al-Aqsa Mosque*

https://t.co/OvdWMn2RUO",1518692929107337216,gazaapost
"boo rich people.  yay Nancy Pelosi, Chuck Schumer, Rachel Maddow, Joe Biden, Hunter Biden, Ellen, the ladies of The View, Chris Hayes, Oprah, Mark Ruffalo, Stephen King",1518688379692531717,CosmicJt23
"oh my god i swear i just found the love of my life on tiktok no joke he looks like mark ruffalo, he has a CAT and HE LOVES DYLAN OBRIEN HES LITERALLY MY SOULMATE I NEED TO FIND HIM IM IN LOVE",1518680678023536645,harrysplaceinme
"Coming soon:
Mark Ruffalo returns as Wilder Eagle, a writer with a six pack, made desperate by driving a lot of cars in John Carpenter's 'Magazines Full Of Harvest 2'
UNNECESSARY JOKES!!!",1518659450684383232,Upcoming_Action
STAY YOUR ASS HOME OR MARK RUFFALO GETS IT !!!🔫🦠,1518658879176945664,STAYYOURASSHOME
just watched a mark ruffalo romcom i’d never seen before 1) how is this possible and 2) the things i would do for this man my GOD,1518634140677115907,scrapfem
did  Mark Ruffalo  seriously announce he's quitting acting by accusing israel systematic genocide?,1518631806937059331,protiv_vucica
mark ruffalo impersonators in my dms rn,1518631671574245376,meIaniebarrera
I think on the last day of classes I should tell this guy that I’ve been calling him Mark Ruffalo in my head all semester,1518604449572401153,babbygorl
"Crossing my fingers this doesn't get watered down 🤞 For an intro understanding of ""forever chemicals"" and how insidious they are, watch Dark Waters on Netflix starring Mark Ruffalo. I haven't been able to stop talking or thinking about that movie since I first watched it https://t.co/kkYUUOJGL5",1518584696560623617,mfbieger
forever so damn glad they took fight club out and let mr mark ruffalo in god bless https://t.co/5u7JIH6WRw,1518582812089192448,gagasbooobs
Anything that pisses off Mark Ruffalo is a good thing in my book.,1518582811032125441,Futbollfan
Jonas had a twitter argument with Tommy for fancasting Mark Ruffalo as Nate,1518575850546864128,YAhottakes
"After watching spider-man: No way home and understanding how the multiverse works, 
Who wants to see these hulks in one movie?

Eric bana 2003
Edward Norton 2008
Mark Ruffalo 2012
#MarvelStudios
#Hulk
#MultiverseOfMadness https://t.co/YUUDMRARVg",1518573801637822467,WahidSkaikay
Kate had a twitter argument with Billy for fancasting Mark Ruffalo as America,1518573347029749762,YAhottakes
Adam Project - @NetflixUK . Great SF escapism. I don't think I've seen a Ryan Reynold's film I've dislike. Great guy who almost plays himself somewhat like Cary Grant did. Good to see Mark Ruffalo always looks like he's been dragged thru hedge backwards. Kid is a future star.,1518572105876611072,BillUU55
"Released #onthisday in 2019: Avengers: Endgame
Starring: Robert Downey Jr., Chris Evans, Mark Ruffalo

Click for more info: https://t.co/bqRE5YQYPl

#Avengers:Endgame
#filmlover #cinema #filmbuff",1518560522345623552,OnThisD63943806
Mark Ruffalo says Israel systematically targets Muslim worshipers and journalists at the Aqsa Mosque compound. https://t.co/oJTeyPOaqV,1518559103408394245,AflakiM
I can’t be the only fag around here who does not find Mark Ruffalo any attractive https://t.co/CIIPHJI6dz,1518554178976882688,kolyatheeswift
"No movie scene has ever made me cry this hard. 
i need mark ruffalo to adopt me. https://t.co/ZoeUgq4ZNO",1518538427947687936,ghostofachiIIes
"From the Haddid Film School, starting Mark Ruffalo https://t.co/bs2UqZMlDl",1518503307895087107,gabbynoonyraffy
"Apr 25th 2012
The Avengers

Director: Joss Whedon
Cast: Robert Downey Jr., Chris Evans, Mark Ruffalo https://t.co/cVVcqnQIGe",1518500117170601985,Released2Day
A fatigued Mark Ruffalo lathered Kylie Jenner below Paris,1518462960863113216,celebheadlinesb
Mark Ruffalo says Israel systematically targets Muslim worshipers and journalists at the Aqsa Mosque compound. https://t.co/16VVtWSHJn,1518458021961101312,VviewSsonicMair
i'm having a mark ruffalo brainrot again oh no,1518434609708802050,kojiharunyansus
"young mark ruffalo, you will always be famous &lt;3 https://t.co/RGAlQNv7ZQ",1518394603405078528,hourlyruffalo
Mark Ruffalo and Don Cheadle are both replacements and are universally loved so I’m all for it https://t.co/CcnCyshaIV,1518388498205712384,NickFowl444
Hot (weird?) take: I automatically like a movie more if mark ruffalo is in it,1518387484744462336,lurkeratlaw
Making Taylor watch Just Like Heaven because I love mark ruffalo in a rom-com.,1518387377089257478,juleeuhchew
MARK RUFFALO A&amp;U magazine May 2014 Judy Gold Allen Sowelle Josh Feinman hiv aids #eBay🇺🇸 #Magazines https://t.co/xLFaCSeHer,1518371415652814849,MagazinesAlert
"𝒁𝒐𝒅𝒊𝒂𝒄 (2007). David Fincher's masterpiece. A great obsessive detective story that gives you the full picture, but prompts you to draw your own conclusion(s). Based on the Robert Graysmith book. With Jake Gyllenhaal and Mark Ruffalo. #FilmNoir #NeoNoir #Noir https://t.co/mvUbelbgRn",1518367179833499650,JimAllder
The one of Mark Ruffalo and him is what the inside of my heart looks like at all times https://t.co/5HHo7L2CTO,1518348805388873730,kyndacool
"Mark Ruffalo a famous American actor and director says Israel systematically targets Muslim worshipers and journalists at the Aqsa Mosque compound in the occupied al-Quds, amid intensified Israeli assaults on Palestinians at the holy site. https://t.co/Ul6EKH2gSV",1518337440968232961,Filomen03258997
An over joyed Tina Fey chewed Mark Ruffalo at the AMC by Union Square,1518327212637782016,celebheadlinesb
