full_text,tweet_id,screen_name
"I've been meaning to watch this since it first released in 2019

Finally going to delve into it today

Mark Ruffalo wis extremely adamant that this story be told, told as accurately as a movie can be... Its gonna be a heavy one https://t.co/wmjXThZIlx",1519392909904146432,B0Ob_bee
Actor Mark Ruffalo Says Ukraine War Is A ‘Gift’ For Biden’s Climate Change Initiatives https://t.co/gKnxwcbi4P,1519391946946535425,mzee26
"Great interview from @KatyTurNBC and info about the #CleanEnergyFreedom campaign. Mark Ruffalo, and Board Director of the Environmental Defense Action Fund, Kevin Johnson, urge Biden to prioritize clean energy independence https://t.co/n3OI8LEL8N via @msnbc",1519389455810916352,CarlyNMarcoe
I wouldn’t piss on Mark Ruffalo’s burning corpse https://t.co/dMpjNvLkUS,1519385111707324416,chris_b4
Glad Mark Ruffalo is reveling in the deaths of Ukrainians for the sake of climate change. https://t.co/zsMVj7hwj6,1519382351050117120,SeanDKnight
Actor Mark Ruffalo Says Ukraine War Is A ‘Gift’ For Biden’s Climate Change Initiatives https://t.co/BNj7FedECX,1519382179339460609,CLOUDOFLARGE
"a sandwich, where the ingredients are lee pace me and mark ruffalo (im in the middle obviously)",1519380042505105408,teandhoney
Mark Ruffalo calls Ukraine war 'gift' for President Biden's climate change agenda! https://t.co/p49ByfIWBm,1519379203493441537,CREEKWARRIOR47
Mark Ruffalo Calls Ukraine War ‘A Gift’ That Biden Can Use For Green Transition https://t.co/0Qt2iowdSc https://t.co/QnmVsHSWpC,1519379005014687744,ClimateNews_a10
where’s mark ruffalo when you need him😔 https://t.co/Z1tDALYFnu,1519372882895261696,coneyislandrry
"Mark Ruffalo referred to the late convicted pedophile Joseph Rosenbaum as ""JoJo,"" and mourned his death along with convicted wife beater, Anthony Huber.

Disney has yet to respond. https://t.co/b0U6zJnp7P",1519370593690427395,RiahTsehcSmomRu
"Law&amp;Orderoff my TV list. Mark Ruffalo ""actor"" calls the Russian invasion of Ukraine, the war, a gift to Biden &amp; all green dummies. Guess slaughter &amp; rapes r important to the green movement.Every part of batteries, car frames, wind turbines require petroleum &amp; mining. Go nat gas!",1519368920485883904,mlnconstitution
seth rogen and mark ruffalo are the only white men i'll fold for,1519367248493826051,coochiemuffins
muting mark ruffalo instead of unfollowing him bc i don't want to hurt his feelings,1519365596357566471,poutinepoutine6
"Mark Ruffalo calls Ukraine war 'gift' for President Biden's climate change agenda

https://t.co/FR9zdFtOGo #FoxNews",1519365164729962496,FieldRoamer
Mark Ruffalo thinks that the atrocities in Ukraine are a help to Biden  Administration. So people being murdered by the thousands are good for climate change 🤔,1519362377560608768,DanielM52030307
Edward Norton a better version of the Hulk than Mark Ruffalo! https://t.co/YuajcIYbMY,1519362179820326912,AjthreetJ
"Mark ruffalo,I just heard you say on outnumbered saying, war is a gift for Biden. War is no gift. You r one dumb insensitive fool, I can’t ever watch u in a movie ever again!  Ps.  You r an idiot!!!",1519361563773349889,BarrysSchneide1
Mark Ruffalo is a green idiot.,1519361532295098369,KarenLeeCC
Everything I know about the Barbie and Oppenheimer casting decisions is knowledged I have acquired against my will. I do not want or need to know that Mark Ruffalo has been cast as a background nuclear physicist in Barbie.,1519361239717195776,TattyBojangles8
WATCH: Actor Mark Ruffalo says Ukraine war is 'a gift' for clean energy efforts https://t.co/yNb8rOW2Vm,1519361026269106177,BabeeHyeinK2021
Twitter when Elon Musk takes over I will say it again about mark Ruffalo.,1519360023176130562,Gizmodo50
"@caitrionambalfe First time I've heard that this Ukrainian war is a ""gift."" How righteous of him.Tosser. https://t.co/liLFKHCPoW",1519359656942092288,janeedoc
Am l the only one sick of the Hollywood Commies. Omg STFU and make your stupid movies. They drive fast gas cars fly big jet planes and Iive in castles. Mark Ruffalo is a butthole liberal ass wipe.,1519358325900693511,hubbard_doc
Mark Ruffalo is an ASS!!!!!,1519358218434224135,NancyPugarelli
"Mark ruffalo continues to prove he is a racist, antisemitic, idiot pos. https://t.co/WAK9wuGz9l",1519357823267876864,laltp
"Mark Ruffalo is why people dislike hollywood!  

He states: Ukrainian WAR is a ""GIFT"" for Biden's green energy efforts. Now is the time to solidify a message to Americans to ""transition"" &amp; WE'LL KEEP PUSHING HIM TO DO IT! 

Imagine using war/horrific deaths for your GE agenda!",1519357540559167489,KatBaloo65
"Tone deaf, sick, &amp; stupid doesn't begin to describe this. For the extreme greens, the loss of human life can always be twisted into a ""gift"" for their political goals.Mark Ruffalo calls Ukraine war 'gift' for President Biden's climate change agenda https://t.co/h0viul4JZ5",1519356641543696385,jasonthayes
Mark Ruffalo: Ukraine war is 'gift' for President Biden's climate change agenda |  https://t.co/V8NyB04od3,1519356230149586945,Ken50767820
"Mark Ruffalo is a cancer in the American body,he should never be allowed on an airplane.......ever.",1519355626555539457,Seabeesix
"MARK RUFFALO A POLITICAL ACTIVIST AND A PATHETIC ACTOR SAYS.....""THE WAR IN UKRAINE IS A ""GIFT"" FOR CLEAN ENERGY PUSH."" ARE YOU KIDDING ME??? THESE ELITIST THAT THINK THEY HAVE THE RIGHT BECAUSE THEY ARE ACTORS???? SO GENOCIDE IS A GIFT HUH MARK????",1519355479524184064,deesmiling72
"@MarkRuffalo celebrates war and does it with a smile on his face, what a putz. https://t.co/DVVjcOtsVt",1519355279573458944,solomicky2
"@HARRISFAULKNER @OutnumberedFNC @kayleighmcenany So…you don’t like Mark Ruffalo telling you what to do because he’s an elite, but you’re okay with Twice Impeached Donald Trump telling you what to do…..got it!",1519355189240553473,mlthed
"This is fine. 

Liberal actor Mark Ruffalo says the bloody war in Ukraine is actually a “gift” for Joe Biden and for a clean energy push.",1519355117379588096,MSMCali
"No one should be surprised Mark Ruffalo called the Ukraine war a 'gift' for the climate change agenda.

How many eco-leftists called Covid a ""gift"" as well?

Like all cultists, their ideology comes first, no matter how many are suffering.

https://t.co/j6EBdUiMTS",1519354906070634497,larrybehrens
"Mark Ruffalo (actor ?) is a psychotic nightmare, and should be planted head first in the stack of BS that obviously serves as the support system for his brain. He was chosen for his ignorance to take the emphasis off of the more prominent liberals. He’s a throwaway.",1519354715238281218,efm1126
"Next time @MarkRuffalo so much as makes a peeps about Israel, remind @Twitter population that he literally defined the misery of Ukraine as a rare gift for @POTUS ... to pass and enforce Green Energy laws. Carpe Diem, Ruffalo-style.
https://t.co/VEuVnsBi2w https://t.co/lTwrjiQ8ll",1519354644245499905,Spinozasrose
Mark Ruffalo: Ukraine war is 'gift' for President Biden's climate change agenda https://t.co/LirOGr3GuA,1519354590273183744,Madshirt
Mark Ruffalo the actor I guess he’s an actor said the war in Ukraine is a gift to the Biden administration and the energy crisis what a horrible thing to say Mark Ruffslo May God help you you ignorant stupid ass just my opinion,1519354501102280709,DavidWi90493885
"Mark ruffalo
What happened during the ice age?  The Earth is a living element always changing.  China Russia India are the biggest culprit when it comes to clean enviro.  Go and protest them. We have tge best water and air in the planet.",1519354418919088129,Sylvia48381993
"Actor and environmental advocate, Mark Ruffalo, and Board Director of the Environmental Defense Action Fund, Kevin Johnson, urge Biden to prioritize clean energy independence https://t.co/b83gWZiovp via @msnbc",1519354333246246913,SMConover83
Mark Ruffalo is an asshole,1519354016597262338,dolfaniac02
"Mark Ruffalo: Ukraine war is 'gift' for President Biden's climate change agenda

https://t.co/ZpBO3UQsw2",1519354011454951425,cheffijay
Mark Ruffalo needs to watch the next 30 years when we are all experiencing the chill of the earth.,1519353812732891136,we711kings
"Mark Ruffalo says the Ukraine War is a Gift for Climate Change Activists, and for Joe Biden...what kind of Sick, Vile, SubHuman is #MarkRuffalo? https://t.co/QeZr7cB0GK",1519353793380421634,MaryandBessie
Mark ruffalo is the biggest looser IV ever heard talk about climate change and that war will bring us there to change from fossil fuels loo rly pal?,1519353783494586371,Michael69289056
"Mark ruffalo has to be one big dummy! Saying this Ukrainian war has been a gift to biden. How dare you ruffalo, I will never see another movie you do ever!",1519353683120693248,shirleyo859
"Stalin once said that 1 death is a tragedy but a million deaths are just a statistic. Sociopath Mark Ruffalo says that all of the rapes, mutilations, and deaths in the Ukraine war are nothing but a gift to Biden which he can use to fight climate change.
https://t.co/wqeWCicAUX",1519353600115298304,GaltRand13
@sikkat10 Mark Ruffalo should never be allowed on an airplane or allowed to drive a car.,1519353530422726657,Seabeesix
I’ve only seen 2 Mark Ruffalo movies and that was the last 2 avengers. #Outnumbered,1519353484017029122,ALRambler2
Who the hell is mark ruffalo?  Never heard of him til his idiotic comment today,1519353275841228803,DonnaThroneburg
"Mark Ruffalo just said that he thinks Biden should use the war in Ukraine to move the climate change agenda. How would he feel if his home was destroyed, &amp; family decimated? Would that be a good moment to say - great news for climate change? Another thoughtless bad actor.",1519353236267966464,WeStand4USA
Mark Ruffalo needs to layoff the alcohol and stick to acting not politics!,1519353087386923009,JackAttackII
"After Mark Ruffalo spoke on TV about the Ukraine war being a gift to Biden, it is official,  he belongs on a ship of fools.",1519353086325805056,lanny487177
Mark Ruffalo Calls Ukraine War 'A Gift' That Biden Can Use For Green Transition https://t.co/POCiSdORDI,1519353066197512197,ccdeditor
"Mark Ruffalo fell into sh*t when Marvel ditched Ed Norton as the Hulk. If it wasn't for that, no one would have heard of him. #outnumbered",1519352826606100481,realfullpro
"Mark Ruffalo, The Incredible Schmuck #Outnumbered",1519352823917461506,AkosScott
Mark Ruffalo is out of his mind.,1519352741474320386,OneMugManTwo
Mark Ruffalo dumbest man in Hollywood war is a gift what an ass,1519352738420776963,madonna_dom
mark ruffalo is sexy and can kill me if he wants. please don’t @ me,1519344870351159297,lillygraceeeee
"100% accurate + this project has huge support from #Indigenous communities

“Our lives, economies, &amp; security today depend on continued access to energy until alternative sources are feasible,” ⁦@RBC⁩ to ⁦@MarkRuffalo⁩ on #CoastalGasLink  https://t.co/EB0YrKjQRd",1519338840443420672,CanadaAction
".@RBC to @MarkRuffalo: ‘Coastal GasLink is an example of a responsible project, and we are one of 26 banks who support it.’  https://t.co/oEr4ouWel8 in @RollingStone #coastalgaslink #cdnpoli #bcpoli https://t.co/0O3FNkA2KD",1519338116582154244,FNLNGAlliance
"#OTD 2018 #AvengersInfinityWar starring #RobertDowneyJr  #ChrisHemsworth Mark Ruffalo, #ChrisEvans #ScarlettJohansson, Benedict Cumberbatch, Don Cheadle, Tom Holland, Chadwick Boseman Directed by Anthony Russo, Joe Russo #superhero #fantasy #Action https://t.co/s2rpoJwPin https://t.co/hUDhSY7ZTf",1519335337155174401,lionsroar91406
@MarkRuffalo so when do you give up everything you have that was made from all the bad things you’re against? Hypocrite. https://t.co/wOG7Q2wrBk,1519335042148933634,epra72
"Avengers: Infinity War, directed by Anthony and Joe Russo and starring Robert Downey Jr., Chris Hemsworth, Mark Ruffalo, Chris Evans, Scarlett Johansson, Benedict Cumberbatch, Don Cheadle, Tom Holland, Chadwick Boseman and Josh Brolin, was released on this day in 2018 (USA) 🎬 https://t.co/J5iz9mwuZp",1519334766134403073,SciFi31
"Look, I’m just trying to live my life like whatever character Mark Ruffalo is playing in a rom-com",1519330781985976323,Mr_DrEsquire
"Paul Rudd says that the #AntMan actor team was the ""coolest group"" at #AvengersEndgame's funeral set, thanks to Michelle Pfeiffer:

""When our crew showed up... [Mark] Ruffalo and [Chris] Hemsworth go... 'Holy shit, it’s Michelle Pfeiffer...' Full quote: https://t.co/2VaqxPq2GD https://t.co/9HqdMCsCW2",1519325797659643906,MCU_Direct
getting birthday tweets with a mark ruffalo gif &gt;&gt;&gt;&gt;,1519325762389692418,iVanessa27
Mark Ruffalo Says The Quiet Part Out Loud https://t.co/CQ05xdTcMW via @chicksonright,1519325757721530370,rt119st
"But there is nothing greater than Todd's Los Angeles @dpshow @brooklynfritzy @PaulPabst @HiMyNameIsSeton @PrinceMarv13. Young Mark Ruffalo living in the city of angels, omg. Todd goes to the cowboy store, buys $250 worth of chaps, stirrups, and a hat b/c the retailer is cute.",1519322783108509696,pjkelsch
Hollywood Star and Environmental Whacktivist Mark Ruffalo Says Ukraine War 'a Gift' to Climate Change Advocates https://t.co/gwsobgRQ1H,1519318762859773959,WandaRufin
"The only frame that showed Mark Ruffalo's HULK indestructible💚🤩🔥
#10yearsofTheAvengers #Hulk #Avengers #MarvelStudios #Marvel #MoonKnight #MoonKnightEp5 #DoctorStrangeInTheMultiverseOfMadness #MultiverseOfMadness #RestoreTheSnyderVerse #Beast #KGF2 #DCvsKKR #Thalapathy67 https://t.co/lSbtQP7wB5",1519316870947430400,mymemesforu
"Proving any sacrifice -human sacrifice included -is acceptable in the name of their god ""climate change""

Hollywood Star and Environmental Whacktivist Mark Ruffalo Says Ukraine War 'a Gift' to Climate Change Advocates https://t.co/Wn31PnDHhM",1519315678284730369,NewfoundStudio
"Hollywood Celeb Mark Ruffalo Declares Ukraine War Greatest Thing to Happen to Joe Biden, Climate Activists https://t.co/Ti64AJwYKo https://t.co/RxWNbKic9A",1519313725001547776,LWCnewswire
Hollywood Star and Environmental Whacktivist Mark Ruffalo Says Ukraine War 'a Gift' to Climate Change Advocates https://t.co/G4rz4XNe1a,1519312800446787586,deeidamae
Mark Ruffalo: Ukraine war is 'gift' for President Biden's climate change agenda |  https://t.co/PbZLdPqKSJ,1519311713992118273,EnergyAbsurdity
Mark Ruffalo at the Avengers Infinity War premiere (2018) https://t.co/0ODWSWEV1h,1519311670765494273,hourlyruffalo
"This guy 🙄

https://t.co/2iCgXvam8c",1519311397569630209,KristenFaiola
Liked on YouTube: Mark Ruffalo On His Costume On Set https://t.co/bUqhPL9owF,1519311146574098432,DevilleRomano
Hollywood Star and Environmental Whacktivist Mark Ruffalo Says Ukraine War 'a Gift' to Climate Change Advocates https://t.co/B6YisaItY7,1519310397601366018,SweepingCarnage
Hollywood Star and Environmental Whacktivist Mark Ruffalo Says Ukraine War 'a Gift' to Climate Change Advocates https://t.co/3r9G51sBCC,1519304393572634625,FoosaBoi
Mark Ruffalo calls Ukraine war 'gift' for President Biden's climate change agenda https://t.co/qtMkS43Ov5,1519287937858482176,cantalini20
"""Stick around. Don’t lose your heart, just keep going, keep at it."" - Mark Ruffalo

BENEDIX KumunityGWednesday",1519287561948123137,aileenp83510192
Hollywood Star and Environmental Whacktivist Mark Ruffalo Says Ukraine War 'a Gift' to Climate Change Advocates https://t.co/UdpCY1Ss5g #ltCDATABradPittgt #ltCDATACelebritiesgt,1519286754892689410,venik44
Leonardo is my Nan. Like it's oxygen. Mark Ruffalo is hiding from the gaffer. https://t.co/jluRFst1i4,1519284130936147971,Poorboy_stories
"Mark Ruffalo, Other Left-Wing Celebs Defend Chris Pratt: He’s ‘Not Overtly Political’ https://t.co/Y9qL99FliD",1519283949251534851,ManuelL66056960
"Hollywood Star and Environmental Whacktivist Mark Ruffalo Says Ukraine War 'a Gift' to Climate Change Advocates
https://t.co/grsCFJsHSf",1519278724151189505,TownhallMedia
Hollywood Star and Environmental Whacktivist Mark Ruffalo Says Ukraine War 'a Gift' to Climate Change Advocates – RedState https://t.co/mUVyGjVYR6,1519278510384291840,SamanthaLives1
jennifer aniston and mark ruffalo at the premiere of rumor has it (2005) https://t.co/nTQLgPZPwj,1519273703741263872,elysianiston
We love Mark Ruffalo fan club https://t.co/CXko21TDob,1519268301725126658,camiafe
"I have a new dream script project that I would hope to achieve. But again this is a dream. Just imagine a full length feature film of Columbo. Directed by Spielberg, Starring Mark Ruffalo. Dream big people! #WritingCommunity",1519265250754936833,AuthorHepburn
"AVENGERS: INFINITY WAR (2018)

Première - 23/04/2018 
US release - 27/04/2018

REGIE - Anthony Russo, Joe Russo
SCREENPLAY - Christopher Markus, ...
CAST - Robert Downey Jr., Chris Hemsworth, Mark Ruffalo, Chris Evans, Scarlett Johansson

#InfinityWar #MarvelStudios #FilmPerDag https://t.co/cw8mnDNq3t",1519255030506926082,filmperdag
"New outtakes of Chris Evans, Chris Hemsworth, Mark Ruffalo and Robert Downey Jr.  #ChrisEvans #ChrisHemsworth #MarkRufalo #RobertDowneyJr ❤️❤️❤️ https://t.co/YkY42GZE0f",1519225405567381504,chrisevansmysun
"New outtakes of Chris Evans, Chris Hemsworth, Mark Ruffalo and Robert Downey Jr. @ChrisEvans 💙 @chrishemsworth @RobertDowneyJr @MarkRuffalo ❤️❤️❤️❤️ https://t.co/De5pCqLKsl",1519224847372533763,Trixysicu90
Mark Ruffalo calls Ukraine war 'gift' for President Biden's climate change agenda https://t.co/kL2ZyvaS3W #FoxNews,1519221086419927041,LovesTrump2020
"You're Annie, you like puzzles, and little monsters on your pencil, and some guy named Mark Ruffalo. You're a fierce competitor, and a sore loser. You expect everybody to be better than who they are, and you expect yourself to be better than everyone, which... is cool.",1519215532859297794,nadiaquotestm
"Released April 27, 2018, Avengers: Infinity War starred Robert Downey Jr, Chris Hemsworth, Mark Ruffalo, and Chris Evans, among many others.

It was directed by Anthony and Joe Russo.

There are close to 3,000 shots in this movie, with almost 2,900 of those being visual effects. https://t.co/lpzNa9OhCF",1519199956531306497,yogomimovies
"Released April 26, 2019, Avengers: Endgame starred Robert Downey Jr., Mark Ruffalo, Chris Evans, and Chris Hemsworth, among many others.

It was directed by Anthony and Joe Russo.

Shot back-to-back with Avengers: Infinity War (2018) over a period of 200 days.
- - -
#mcu #movies https://t.co/OKPPhFtdfd",1519197610741059585,yogomimovies
Also I had such a crush on mark ruffalo.,1519191401430364160,dancingdanylle
"Actor and environmental advocate, Mark Ruffalo, and Board Director of the Environmental Defense Action Fund, Kevin Johnson, urge Biden to prioritize clean energy independence #GoGreen #Globe #ClimateAction #ClimateEmergency #ClimateChange [Video]: Actor… https://t.co/hBLUCSNabP https://t.co/uCNM0YFXv5",1519181069097992193,LeeTyler
"""Stick around. Don’t lose your heart, just keep going, keep at it."" - Mark Ruffalo  #nevergiveup",1519171275515736065,iareebkhan
"#MarkRuffalo

Continue reading at https://t.co/IQbgPWejMh | 10z viral",1519170336914292737,lovehatemos
Casually crying over Mark Ruffalo🤷🏾‍♀️🥺,1519169765599817730,lovergirly183
"The most blasphemous words I have read today, because blasphemy is not defined by curse words, but by cursed word-speak: ""Mark Ruffalo calls Ukraine war 'gift' for President Biden's climate change agenda"" is the caption Fox introduces its interview, an interview I did not watch.",1519168812112883712,WeInDemocracy
self-conscious Mark Ruffalo ate Ronda Rowsey next to mom's ex boyfriend Trent's summer home in Laguna,1519165113432895489,celebheadlinesb
mark ruffalo is so sexy,1519164038369845248,absinthefather
"#HeliumHeelsHarris is doubly vaccinated and doubly boosted. 
She also has just one remaining staff member in her office.  Mark Ruffalo says he plans to stay the course.

https://t.co/pjIZ8RmHAD",1519155425496678400,chetbtester
Someone I was following on tik tok said drake was hotter than mark ruffalo and I unfollowed them so fast,1519153156504133635,463calvin
"For anyone still wondering if @MarkRuffalo is really as stupid as he appears. You can stop. He REALLY IS❗️

https://t.co/IRrPjYGvs3",1519147646975455232,chetbtester
isn't it mark ruffalo who played the marvel hero hulk? why is it edward norton who played hulk in the incredible hulk movie?! like i am literally confused right now omyghad HAHAHAHAHAHAHA,1519144652590710785,cybulatao
"Mark Ruffalo calls Ukraine war 'gift' for President Biden's climate change agenda

https://t.co/objWKtsDFx",1519142683062665216,Sammyfifield
Mark Ruffalo and Rami Malek at the Global Citizen 👏💯👏 https://t.co/RxI0hqgGFC,1519140620522168323,JamesHe7117
Mi tipo? Mark Ruffalo en 13 going on 30,1519140226240815106,Anasophh_
"Mark Ruffalo calls Ukraine war 'gift' for President Biden's climate change agenda

https://t.co/vd1rCrTkik",1519137688418459648,great_thunberg
"Effing MORON!

Mark Ruffalo calls Ukraine war 'gift' for President Biden's climate change agenda https://t.co/MFS1lwLcRA #FoxNews",1519134327099084802,MPL7166
"Wait till Putin POPS'A'NUKE...

CLIMATE CHANGE WILL BE THE LAST THING ON HIS MIND...

Mark Ruffalo calls Ukraine war 'gift' for President Biden's climate change agenda

https://t.co/iyCIiIj4Qe",1519131373847597057,Mark57by28
Ruffalo the stupid Buffalo calls Ukraine war a 'gift' to whom?? https://t.co/NEOXx1lOmR #FoxNews,1519130408226590720,Bob72270
Mark Ruffalo calls Ukraine war 'gift' for President Biden's climate change agenda https://t.co/WU5dNbf2E4 #FoxNews,1519127111809880065,stratosphere53
We all know The Incredible Hulk has one but @MarkRuffalo is one literally. https://t.co/li1lvrg4Ro,1519126056661364737,StymieSays
The modern Left/Democrats are pure evil...Mark Ruffalo calls Ukraine war 'gift' for President Biden's climate change agenda https://t.co/flfmAbhhCQ,1519120017056481285,TroyFauber
Mark Ruffalo calls Ukraine war 'gift' for President Biden's climate change agenda https://t.co/XOdOdmTp4J #FoxNews,1519119789276360704,LuzanoB
"Thousands of people being slaughtered and this guy calls it a gift.        
                                                        Mark Ruffalo calls Ukraine war 'gift' for President Biden's climate change agenda

https://t.co/vJI5ZOG5Zb",1519116281844097024,JonathanFlora
Mark Ruffalo calls Ukraine war 'gift' for President Biden's climate change agenda https://t.co/PSXF097Gp1,1519115975479730180,DeansherryS
Mark Ruffalo calls Ukraine war 'gift' for President Biden's climate change agenda https://t.co/KGURXsFDRn,1519115930659393536,KarlaCargill1
"Then why aren't you out there fighting with them on the ground, Mark?  Go for it.  Give 'em hell!

https://t.co/0y5gAUOLnt",1519115345872703488,Mugaliens
Mark Ruffalo calls Ukraine war 'gift' for President Biden's climate change agenda. This guy is a sick bastard. https://t.co/Hu6Sj3erNw,1519112885066207233,MobRules2020
Guess we're gonna have to #BoycottMarvel until they remove this bully and #warmonger. Hey @Marvel you don't wanna end up like Disney...do you?? 🤣https://t.co/01jHI3cFpy,1519111894392520706,Kiss_My_Mask
"Mark Ruffalo calls Ukraine war 'gift' for President Biden's climate change agenda. SICK BASTARD!

https://t.co/uFmf3Q7YwY",1519111292698742784,howie_isaacks
WHAT A SICK F! Mark Ruffalo calls Ukraine war 'gift' for President Biden's climate change agenda | Fox News ⁦@seanhannity⁩ ⁦@Varneyco⁩  https://t.co/vBIyJjUJ8A,1519110642711646209,magafuture
"Just proved he is insane
Mark Ruffalo calls Ukraine war 'gift' for President Biden's climate change agenda https://t.co/24vRnh9RHO #FoxNews",1519110480823865344,ButchMaddox_
"Mark Ruffalo is such a brave human being. He might be the only well known American Hollywood actor who public write against crimes of Israel and Jews against Palestinians. @MarkRuffalo you are not just cinematic hero, you are real life hero💜 https://t.co/SEJnFDHqIq",1519110371948257280,Kandahariii
"What a piece of garbage! Tell your crap to the families that have lost loved ones or been displaced by this war, you egotistical piece of shit!

Mark Ruffalo calls Ukraine war 'gift' for President Biden's climate change agenda https://t.co/8QEtR4eUoy #FoxNews",1519109774490718211,blorf7
where’s mark ruffalo when we need him https://t.co/XSyhVXDUzl,1519109722095316992,lwtrydberg
"Evil Thinking; Mark Ruffalo calls Ukraine war 'gift' for President Biden's climate change agenda

https://t.co/MqK2nC66HP",1519108959994527745,glorielle03
"Many people, those in this country included, have lost friends and family due to Purim’s aggression.  You celebrating that for any reason is asinine, disgusting and reveals much about your warped, extreme, callous and worthless soul.  #CrazyLiberal https://t.co/HcDSsseUsi",1519108742125699076,AnotherRespect1
Mark Ruffalo calls Ukraine war 'gift' for President Biden's climate change agenda https://t.co/JraaulOlJ8 #FoxNews,1519106084916629507,margie_teufel
"Mark Ruffalo calls Ukraine war 'gift' for President Biden's climate change agenda

https://t.co/Bz5dFL2csh
Just another rich girly man.  Moron at best.",1519102591979991040,joew268
"@MarkDice This really is disgusting. Sure, let's let the climate cult walk on the bodies of Ukranians to destroy the economy for a farcical dream. So out of touch with reality!!  Thought you'd make good use of it.

https://t.co/VyVNDWOEnP",1519101704570126336,RWFrazerjr
"This really is disgusting. Sure, let's let the climate cult walk on the bodies of Ukranians to destroy the economy for a farcical dream. So out of touch with reality!!

https://t.co/VyVNDWOEnP",1519101383315800065,RWFrazerjr
where's mark ruffalo when we need him 💔,1519100921363505153,lokiattme
