full_text,tweet_id,screen_name,user_ID
Air balled back to back transition threes https://t.co/VS0LXlRoPA,1514970652968726528,DabollToHeaven,1022608240255877123
Gonna guess McCann and Nimmo are not available today https://t.co/sVjBf9biLS,1514967882458976261,DabollToHeaven,1022608240255877123
Just ran a 4.20 to the train,1514813495698550799,DabollToHeaven,1022608240255877123
Chapman is not feeling the FF please get King up,1514808403826135051,DabollToHeaven,1022608240255877123
Somewhere A Rod is begging Stanton to bunt,1514806034379862018,DabollToHeaven,1022608240255877123
