full_text,tweet_id,screen_name,user_ID
Fire that camera man oh my god,1514423687063166979,pmort123,1045840883189534720
98 in on the hands after they got stepped on and he still gets it out. Vladdy Jr is insane https://t.co/7tcOWSY1g3,1514394092666503171,pmort123,1045840883189534720
Love to see this Gleyber,1514053882074312711,pmort123,1045840883189534720
Yeah the dead ball is definitely back lmao,1514022136402300931,pmort123,1045840883189534720
Who’s we https://t.co/21Sjzw5KOZ,1513978251135401984,pmort123,1045840883189534720
The most shocking thing here is realizing 2005 was SEVENTEEN years ago https://t.co/Sep5gyff2J,1513946251837988876,pmort123,1045840883189534720
