full_text,tweet_id,screen_name,user_ID
"If you like to watch it listen to some drama…

Go take yourself to Netflix and watch The ultimatum… bc BABYYYYYY!!!!

That’s enough drama for all the baby mamas 😫😭😅",1514446271888699393,KeeksKnows,1072264820009914368
"Bruhhhh J.Balvin rescheduling his tour… 😩🥲😭

I seriously cannot deal with this today!!!",1514004159430864898,KeeksKnows,1072264820009914368
Death on the Nile… must watch!!,1514001752168837123,KeeksKnows,1072264820009914368
I’m so glad I don’t stay at my old apartments. I really have nothing nice to say about them but that they gave us free catered food time from time.,1513951673718394881,KeeksKnows,1072264820009914368
"Benito made a new friend today and she’s only 9mo older than him.
They wore each other out lol.",1513718416858828802,KeeksKnows,1072264820009914368
"Don’t be used by someone that dumps you &amp; picks you back up when it’s convenient for them with their lies, gifts, sex &amp; narcissistic ways just to play with your heart. 

Let’s talk about finding your worth boo bc you’re worth way more then this.💖",1513607865415749637,KeeksKnows,1072264820009914368
