full_text,tweet_id,screen_name,user_ID
"Lmaooo Im dying laughing cuz I def said, “damn he living hard” to myself to an Uber Driver that pulled up before https://t.co/QVT9Q6jXir",1514859524863234051,ctv_mack,108622068
"Shiiiit, I had some great stories https://t.co/gNdIpc6tA5",1514851416661180420,ctv_mack,108622068
Its pretty good https://t.co/tAPzUFCyhA,1514792749337174017,ctv_mack,108622068
Tough way to live but I get it https://t.co/n4zwgmEAO0,1514769754510163984,ctv_mack,108622068
They going to catch yall for running with a rumor from a rando again aint they?,1514738560766988289,ctv_mack,108622068
Why die on this hill when you were clearly lying. Pride will kill you man smh https://t.co/OEuicewGrw,1514714291253002244,ctv_mack,108622068
