full_text,tweet_id,screen_name,user_ID
How can you hate this man as Superman? 😩 https://t.co/pGmLHlhPnO,1514674844851396608,TheRealTCU,1093549140280147968
The only code that matters. ❤️ https://t.co/1tkcLdhSoz,1514673752574935045,TheRealTCU,1093549140280147968
I need a lightsaber so I can fight these dumbass mfs trust,1514490231369650182,TheRealTCU,1093549140280147968
"A TikToker that started watching the MCU a month ago has been invited to the Doctor Strange 2 premiere...

I've been watching the MCU since 2008. Where's my invite?",1514360588188758016,TheRealTCU,1093549140280147968
