full_text,tweet_id,screen_name,user_ID
"The perfect specimen. Look at that fur, those ears, the nose, THE EYES, AAAAAAA https://t.co/iIV5ldNeNh",1514123557890142210,FranOpossum,109621114
"Frozen custard dairy bar!
Heck, I need to hit up a local one soon. https://t.co/1R7Ladzbvk",1514065237833568258,FranOpossum,109621114
"Time for opossum sleep. If you need some extra comfiness, just give me a hug. 🫂💜",1513842853595787267,FranOpossum,109621114
"What a great time in Super Animal Royale! @VirtueCatVT was a delight to have along and we had the silliest and craziest moments.
The rebellious Opossum Party was sent to @meowpenheimer, the evilest of felines scavenging around in Planet Crafter. https://t.co/9Uzrxhzl1v",1513743207963758594,FranOpossum,109621114
"It's always those darned shotguns!
After the break, it's more Season 3 shenanigans while getting our Easter Finest. 🐇 🥚 https://t.co/CQjRWqcPS2 https://t.co/gzT02FkLsJ",1513710921062961154,FranOpossum,109621114
"Going LIVE! 🔴

Two Odd Cats Tackle Season 3 of Super Animal Royale! https://t.co/hedmzQmDM0",1513654030962241540,FranOpossum,109621114
"Less than an hour until two odd-looking cats take on Season 3 of Super @AnimalRoyale!

@VirtueCatVT https://t.co/syLBK6cHRr",1513641678837628928,FranOpossum,109621114
"I will always stand for this is as an individual, lover, and entertainer. I want to provide comfort, because I didn't know that for so much of my life. https://t.co/5k2bv3lqiF",1513456977778720772,FranOpossum,109621114
"I'm cancelling stream tonight. My body is sick and aching. :(
Go watch Safire play Princess Farmer with Charlene if you want a recc!",1513273975308263435,FranOpossum,109621114
