full_text,tweet_id,screen_name,user_ID
"And even if he is, ours boys can do it and have done it. https://t.co/UHucg2BbKp",1514703967640457256,RitzBritz,112231238
Murray what happened!,1514453563237302276,RitzBritz,112231238
Slow it down Ingram,1514440046832615424,RitzBritz,112231238
Stop with the 3 attempt it's not working for the Spurs,1514439467762798595,RitzBritz,112231238
Another exciting game!,1514433841762504709,RitzBritz,112231238
What's the reason for the blackout? It makes no sense. I'm not effected but still.,1514346395313979392,RitzBritz,112231238
"Wow that's sad, it was the anniversary of KAT's mom's death yesterday.",1514345435191685122,RitzBritz,112231238
Yall Crack me up! https://t.co/C0xN2CdWc4,1514344477036453891,RitzBritz,112231238
Clippers got another chance no worries,1514099479586095114,RitzBritz,112231238
