full_text,tweet_id,screen_name,user_ID
"If your bid for Twitter falls through, I hear the Hair Club for Men is looking for fresh capital, @elonmusk? https://t.co/RnE4LkIssd",1514930943886340104,OuterBoroRoyal,1158395065405825025
"I feel like we’re not talking enough about how France could leave NATO, if long-standing member of the Putin Ethnonationalist Puppet Club, Marine Le Pen, wins the run off elections in about a week.",1514930257115156488,OuterBoroRoyal,1158395065405825025
"All of the right wing alternatives to Twitter have failed, because not even conservatives want to talk to other conservatives.",1514919780712685574,OuterBoroRoyal,1158395065405825025
Someone BLASTING Beenie Man outside my open window at 6:30 in the morning. #TGIF #Brooklyn 😩,1514915537557598208,OuterBoroRoyal,1158395065405825025
Chris Cornell’s “Billie Jean” https://t.co/9xHNszLs3C,1514740073216020484,OuterBoroRoyal,1158395065405825025
