full_text,tweet_id,screen_name,user_ID
Never going to the salon again https://t.co/W4sBNrRUDh,1514781966968647685,teagiselle,1216780417971499013
Taking my sister to her first Mets game on Sunday 🥺,1514755649518907398,teagiselle,1216780417971499013
That man is from Harlem I am NOT surprised please. Lmao,1514727295856041987,teagiselle,1216780417971499013
Soon as I get home I’m installing my Ac cuz nah,1514667132239421450,teagiselle,1216780417971499013
Way too early for this. We learned our lesson last year https://t.co/ygRmIKD1xK,1514648892343734283,teagiselle,1216780417971499013
Ima beat my sister ass for flying into NEWBURGH cuz wtf????,1514612703230193691,teagiselle,1216780417971499013
I don’t think y’all understand how happy I am baseball is back. This is really my escape,1514440852814417920,teagiselle,1216780417971499013
GONEEEEE BUT CAUGHT 😭 https://t.co/IyUbQKJnD2,1514433109416202245,teagiselle,1216780417971499013
