full_text,tweet_id,screen_name,user_ID
#TurboShot https://t.co/iFxgMN5msv,1514702289960906752,RealAAron1990,1254332078969311232
2 SICK shots last night to go to OT then the GW. @RocketLeague fuck it keep sending us champs in diamond LOL https://t.co/6J9iotTU9k,1514569715821252609,RealAAron1990,1254332078969311232
"#RocketLeague story of the day and why this game has the most trash player base of any game...

me and the cuzzo load into 3s with a rando. we give up 3 goals in a minute. rando quits after pushing the entire time. we stay. come back from 3-0 down a man. 2.5 mins into OT...",1514248169240023052,RealAAron1990,1254332078969311232
It ain't easy that's for sure lol #ELDENRING #plumpcommunity https://t.co/tr5IO9bV9z,1514213927235854337,RealAAron1990,1254332078969311232
"This is how some of yall defend will and Jada... 
""It wasnt a roast it was an awards show.""

Fair. Know what else it wasnt? A fuckin slap boxing match but here we are.

 No excuse. Jokes are jokes. Toughen up.",1514196030832660491,RealAAron1990,1254332078969311232
very short stream today but another big boi raid from my dude @nixirlttv and mad bitties and subs from the best @PlumpCommunity around! see yall with more #ELDENRING  tomorrow 630pm est! THANK YOU ALL!!!,1514023937876897793,RealAAron1990,1254332078969311232
