full_text,tweet_id,screen_name,user_ID
no way in hell i’m ever sleeping on the streets of chicago and i’m not even from there 😭 https://t.co/o4VmsGwoWt,1514809681729908737,Ieahmariah,1293201672
this doesn’t look like a good idea https://t.co/o4VmsGwoWt,1514808311903752192,Ieahmariah,1293201672
"the year one of my faves headline coachella, will be the year i attend.",1514805525183033353,Ieahmariah,1293201672
"she’s so gone, more than a band and somebody https://t.co/UmfM44vC7d",1514801983621775376,Ieahmariah,1293201672
"more than a band, she’s so gone and somebody are the top three best songs from lemonade mouth. tell me i’m wrong.",1514799785382871044,Ieahmariah,1293201672
oomf is so cute i want to hug them 🙄 can they stop being a leah anti please,1514796980198776833,Ieahmariah,1293201672
"if this flops, ur a loser https://t.co/KNU9fwgnGV",1514795279844741120,Ieahmariah,1293201672
"check out my new video &lt;3

WHY DON’T WE LET ME DOWN EASY REACTION
https://t.co/TfO6wMDNlQ",1514795014374625282,Ieahmariah,1293201672
what’s your dunkin/starbucks regular order?,1514793029638389766,Ieahmariah,1293201672
