full_text,tweet_id,screen_name,user_ID
Time to bust out my best suit. https://t.co/zHXQVDcDRC,1514083927564111872,JawnStreetPod,1351237386416640001
I get what Doc was trying to say in his press conference…. But theres about 30 different ways to say it so it doesn’t sound so cunty,1513503621891170308,JawnStreetPod,1351237386416640001
Jawn Street Minor Inconvenience Bracket https://t.co/IckHxjzRWI via @YouTube,1513186106317193221,JawnStreetPod,1351237386416640001
Check out my latest #podcast https://t.co/IRSqQWmdfD on #Podbean,1513185568636735489,JawnStreetPod,1351237386416640001
Augusta is eating people alive out here,1513175490944770057,JawnStreetPod,1351237386416640001
Jon Rahm leaking oil out the pits here on hole 1. Gonna be a slip and slide at Augusta today.,1513169286684381184,JawnStreetPod,1351237386416640001
