full_text,tweet_id,screen_name,user_ID
"First career homerun ✅
Hit it in the home opener ✅
Hit it against your hometown team ✅

#TimeToShine https://t.co/Zu5diqp2Zh",1514768380380676102,Maida904,15309596
Someone finally smoked out Bruce sherman! @JuJuGotti @billygil @__ChrisCote @LeBatardShow https://t.co/mMl2XdcuBo,1514722620033409024,Maida904,15309596
He is basically Davante Adams so https://t.co/ZJx7LLuntr,1514668478644563968,Maida904,15309596
Kinda crazy that the team which secured the 1 seed in the East is gonna have to be wait til 36 hours before Game 1 to even find out who they are playing.  NBA should fix the play-in schedule,1514626359636770828,Maida904,15309596
Fatley Beal https://t.co/fqd6Wu9ljU,1514625583405228040,Maida904,15309596
John Sterling - delivering since 1989 https://t.co/zZh3Gub1fS,1514435597108133892,Maida904,15309596
But not younger than Austin Hooper @MichaelRyanRuiz @LeBatardShow https://t.co/kKUNYidgBI,1514422488444424194,Maida904,15309596
