full_text,tweet_id,screen_name,user_ID
Some guy just walked up and handed me this at the Orange Outlets after the game 😏 #HOUvsLAA https://t.co/hVDKgjFcSt,1513307366707458049,n1texansfan,163351231
That’s the right call. #out #HOUvsLAA,1513262931168804867,n1texansfan,163351231
What was that Breggy???? #HOUvsLAA,1513255729804718081,n1texansfan,163351231
Urquidy throwing heat. #HOUvsLAA https://t.co/Hq30NMnsvM,1513251080347348992,n1texansfan,163351231
I’m on the first baseline. Anyone want me to go live for the game? #LAAvsHou,1513245559007506432,n1texansfan,163351231
