full_text,tweet_id,screen_name,user_ID
"Lots of fun on our trip to HCCC today. Thank you @WHSMolina for helping organize. The students learned how to break down and bread a chicken, watched the preparation and sampled a delicious sauce, toured the entire building, and were treated to an amazing lunch! #wearebarrons https://t.co/Gbo542lhov",1511841475105107969,WHSVersuk,1727182190
Very impressed with Hudson county community college’s culinary/hospitality program and facility. This is definitely an great option for our students. #wearebarrons https://t.co/fa0mzQvvJj,1511840371428495365,WHSVersuk,1727182190
"Cupcake Wars in Advanced Culinary 4 class. Congratulations to the winners, Tamara and Leo, who made a Maple bacon blueberry French toast cupcake. Sooo good 🤤. Great job to everyone. Stay tuned for our next competition…#wearebarrons https://t.co/stH1gjVNkW",1507465020287950854,WHSVersuk,1727182190
"More goat farm fun…
#wearebarrons https://t.co/D1WR0miCvk",1506348820568973318,WHSVersuk,1727182190
Every single student milked the goat! Even the ones that were nervous did great! 🐐 #wearebarrons https://t.co/uXtXd6cIfK,1506348243352961025,WHSVersuk,1727182190
