full_text,tweet_id,screen_name,user_ID
Oh no… this ain’t it man. https://t.co/qeDOz1A1gY,1514772481906597892,The_JasonM,178094501
"If ASAP really cheated on Rihanna…. Wow… just. Wow. 

The bag he was about to secure almost seemed impossible to fumble… but somehow he fought through it all and ruined everything… https://t.co/cN608VFFuu",1514758603340623879,The_JasonM,178094501
"We’ll all look back at this decision in horror… it’s when “Bunt-Gate” all began. 
#SFGiants https://t.co/QrowZLco68",1514098736925851648,The_JasonM,178094501
Flores is so freakin slow…,1514082024440537094,The_JasonM,178094501
"Estrada and Dubon wouldn’t be starters on any other team in the entire league except the #SFGiants and the Oakland A’s. 
#MLB",1513740939776303104,The_JasonM,178094501
Don’t even have to say from where… we saw the price and we all KNOW it was 5 Guys. https://t.co/wGRuaZ6QDI,1513694152818511875,The_JasonM,178094501
THIS. https://t.co/3WgwLCeS06,1513543029923074053,The_JasonM,178094501
