full_text,tweet_id,screen_name,user_ID
I am not well. 🥹 #coachk https://t.co/XLdhdR4Ro0,1514791253346451469,daniellewraith,18169559
not trying to start a fight but pie is superior to cake. #food,1514783791830556674,daniellewraith,18169559
Happy “draw me like one of your French girls” day. https://t.co/VozMrnroRt,1514716636606988302,daniellewraith,18169559
Can we all agree the @SFGiantsFans city connect jerseys are the worst? #sfgiants #afgameup,1514078947360706561,daniellewraith,18169559
what would you pick as your walk up song? #MLB #baseball,1513566852860981251,daniellewraith,18169559
Happy #NationalPetDay to our best girl https://t.co/Exkxgd88O5,1513552125434871808,daniellewraith,18169559
I just got my car washed… expect it to rain tomorrow.,1513352689375080452,daniellewraith,18169559
how many regrets will I have today? #ikea https://t.co/4O1OXI4qIu,1513240135327907841,daniellewraith,18169559
Who knew I would be so into #Severance 👀🤯,1513025042904276993,daniellewraith,18169559
