full_text,tweet_id,screen_name,user_ID
Knicks can’t allow this type of disrespect b. https://t.co/Lap449htu6,1506325988904472584,BlkStarMovement,18949796
Always thought it was to a “well”.,1506277596572667907,BlkStarMovement,18949796
Juu heard! https://t.co/5cfm0zCsuT,1498959883940552704,BlkStarMovement,18949796
I dont see eminem asking the nfl if its okay to kneel. Where did that even come from?,1493356757690851329,BlkStarMovement,18949796
Rip to the blackberry b #discontinued bbm was a dirty place.,1478414922447003649,BlkStarMovement,18949796
Exactly what’s been going on. https://t.co/giDIrGlEGd,1474568299388325889,BlkStarMovement,18949796
