full_text,tweet_id,screen_name,user_ID
An unclear feeling that's been nagging at you might finally be... More for Libra https://t.co/rjqVQVAgfm,1514574428037791746,hulkswag85,219561781
#TheUltimatum was messy af. The whole ending was trash! Madlyn pregnant by Colby?!,1514457759290380295,hulkswag85,219561781
This boy loves swim lessons and it brings me so much joy. 🥺,1514348687631212550,hulkswag85,219561781
I ask my mom where she wants to eat for her Bday and she says Red Lobster. https://t.co/b0hyvEEYVS,1514297056126545924,hulkswag85,219561781
Choosing a different companion can improve your energy flow. T... More for Libra https://t.co/rjqVQVAgfm,1514212038079254531,hulkswag85,219561781
