full_text,tweet_id,screen_name,user_ID
"Tonight @ 8pm EST 

https://t.co/GqLXwR6w2u https://t.co/110b7HWamq https://t.co/m5zvAWOwJu",1514722459358044161,lane_lane_lane,2248598367
thank you for being apart of tooth drama i think i feel (mostly) better https://t.co/q7r5GjFU3I,1514711616624988168,lane_lane_lane,2248598367
at a christian camp at age 11 they made all the kids wash all the adults feet “like jesus did”,1514683914903818249,lane_lane_lane,2248598367
getting emails from school about a group of rogue bicyclists who slap people upside the head,1514683441899573270,lane_lane_lane,2248598367
miss anna biller is tweeting,1514661501331816455,lane_lane_lane,2248598367
reminder! This has been moved to tonight!! It’s going to be “fun” https://t.co/110b7HWamq,1514649030034345995,lane_lane_lane,2248598367
advil pm and halo infinite all cloud boys tonight drain gang,1514467272496234496,lane_lane_lane,2248598367
