full_text,tweet_id,screen_name,user_ID
lmfao ight man. thats enough out of yall for today https://t.co/GE00OoCOLs,1514287527091326980,s_sankara24,231813773
LOL bulletin board material already? https://t.co/HArxJfSezn,1514073292717518849,s_sankara24,231813773
elle eaux elle. we'll come back to this in 2 weeks if even that. https://t.co/VENKOYWHJ9,1514053359350665217,s_sankara24,231813773
waited too long to watch rothaniel. that was so good.,1513028438914830338,s_sankara24,231813773
severance goated. what a finale.,1512284228548890627,s_sankara24,231813773
severance hourssss,1512266618750967813,s_sankara24,231813773
