full_text,tweet_id,screen_name,user_ID
I’m not 100% sure but it seems like @RapSheet does his @PatMcAfeeShow bits when his wife drives him to pick the kids up from school. Is that about right?,1514447898997628928,icaseysteinman,234133657
"Houston, we have a deal! https://t.co/fk9yffXE4a",1513375393297932288,icaseysteinman,234133657
"Is it possible that one of my Huskers, Beef Jurgens goes to my Jaguars? GBR #duuuval @CameronJurgens https://t.co/ht13sxE1Q8",1513248075229319173,icaseysteinman,234133657
"There were 32 people in the stands for the Purdue spring game. Huskers will have 50,032 in the stands. GBR 🌽 🎈 #BTN",1512853237757526023,icaseysteinman,234133657
Put your arm out and see what happens. 😃 #Malinois https://t.co/CJXEZq4ZhM,1511810779284230147,icaseysteinman,234133657
"Will Quay Walker be available to the Jaguars at 65? That would be a great value, if so.",1511104393935994884,icaseysteinman,234133657
Is that Swick in there with McAfee?! @PatMcAfeeShow https://t.co/NsgjDDNLCV,1510457697094754305,icaseysteinman,234133657
#193Republicans voted against a cap on insulin cost.,1509893049119395850,icaseysteinman,234133657
