full_text,tweet_id,screen_name,user_ID
Masters Sunday!! Who do you think will pull away with the Green Jacket??,1513191820875948041,GolfPineHills,2353742695
"Guardians, Ohio State, Browns and Cavs apparel now in stock! https://t.co/9vE360TJig",1506376147206037508,GolfPineHills,2353742695
Good Morning! We are happy the golf season is here https://t.co/tqcB3LvlrS,1506295807225511939,GolfPineHills,2353742695
We are hiring!!Grounds crew along with clubhouse positions.  Employment applications can be found here on our website. https://t.co/U7JorzxBVH,1504934578263367687,GolfPineHills,2353742695
We’d like to introduce you to the new course pup “Zuri” who is a German Shorthaired Pointer https://t.co/mEWqHSewgh,1504222140312215562,GolfPineHills,2353742695
New bar upgrade is now finished ! https://t.co/SBFTuiyYXQ,1504211963731226627,GolfPineHills,2353742695
Cannot ask for a better day of golf here in Hinckley https://t.co/Hs2gFcoMq5,1504142937369858051,GolfPineHills,2353742695
