full_text,tweet_id,screen_name,user_ID
New turf lookin good today in that sun!! https://t.co/i77HOIgaEa,1513653609329799178,JurgensPhoto,2391727808
Who wants to intern for the #BestInTheBusiness!? https://t.co/hthYB7Vx95,1512475991330938886,JurgensPhoto,2391727808
Absolutely great person if you've never had the pleasure of meeting her!   Definitely a @WVUWBB fan now.  Good luck @CoachDawnP!  Excited to see you excel in the Big 12!! https://t.co/WtlQefqx0N,1511555823612403717,JurgensPhoto,2391727808
He's not the best sports reporter in the business for nothin folks! https://t.co/MJNWvxo4iO,1511162266493894658,JurgensPhoto,2391727808
Great get here by @CollinAuthier and the @MMULancers!! https://t.co/yTHUqTx4f3,1511107545636737026,JurgensPhoto,2391727808
So this video is crazy... https://t.co/FZvJEeZl5A,1510314509092757511,JurgensPhoto,2391727808
Circus Days out Stan Houston! https://t.co/DfDZcaauC5,1510282189119832065,JurgensPhoto,2391727808
