full_text,tweet_id,screen_name,user_ID
My cheekbones? Fucking fabulous.,1514750308462829568,clothes_mindedx,257663169
This my fav line https://t.co/hIY9GkJ0tL,1514743583559008263,clothes_mindedx,257663169
Words stick. Watch what you say to me.,1514670221306572803,clothes_mindedx,257663169
You know you love when I switch it up 😌 https://t.co/Q8RZMnzJ6a,1514658425069838341,clothes_mindedx,257663169
11:11 I wish me and this bitch be together forever God please,1514623018932318211,clothes_mindedx,257663169
Totally forgot I have a dinner to attend after work + the Uptown Night Market.,1514621219856793603,clothes_mindedx,257663169
It’s gonna be a sexc summer in the city,1514615982303576078,clothes_mindedx,257663169
I’m a brand new bitch today. Y’all know God made this type of weather for me.,1514601749293633538,clothes_mindedx,257663169
