full_text,tweet_id,screen_name,user_ID
Who else a lil sick?,1514735666206228483,LordMora_,261375775
I’m tired of these new age athletes that can expect a new contract while disregarding their current one. https://t.co/t6cmFesBcZ,1514732848296693772,LordMora_,261375775
"What y’all most hater thought ? 

Me?
I’m ready for Tristan Thompson to get caught cheating again. 
I appreciate consistency",1514729640593604621,LordMora_,261375775
"Omfg Trade him to NY, Hornets don’t deserve this https://t.co/ps1zIL36P7",1514701109138501646,LordMora_,261375775
