full_text,tweet_id,screen_name,user_ID
I’m not here to stress ya life I’m not the detective type,1514784323127296003,JClark_1,282293607
Go put on some clothes you can roll with me,1514783866917056514,JClark_1,282293607
I how she got over that attitude I tried to send a DM to her best friend,1514783768971599881,JClark_1,282293607
Nun at the bar,1514768434847879174,JClark_1,282293607
Ion know bout that but they sholl be different from the people that raised you. My son get away with murder https://t.co/ehesheYx2o,1514762762794151961,JClark_1,282293607
