full_text,tweet_id,screen_name,user_ID
Everyone here talking about @elonmusk buying twitter.... like bro idgaf who buys it im still going to be broke after 😅😅🤣🤣,1514649429915152397,ThatKidMiguel22,2828754928
This call is basically my emotions every time i thought a chance with girls in HS and then reality kicked in 🤣🤣🤣 https://t.co/MuTo8C0bwO,1514627482388992007,ThatKidMiguel22,2828754928
This kid said get me to Double A this shit too easy https://t.co/GYgsMhYgi1,1514605253831770112,ThatKidMiguel22,2828754928
I hate it here.... https://t.co/u5m6rIen8g,1514432428508594180,ThatKidMiguel22,2828754928
Imma go change my underwear now....redsoxs lead 9-7 after 8 innings. Tigers left the bases loaded,1514344158298783751,ThatKidMiguel22,2828754928
Fuck....this is why you dont let up no matter what the score is....,1514343152676651015,ThatKidMiguel22,2828754928
Story with the RBI single !,1514311157254959104,ThatKidMiguel22,2828754928
Back to back to back doubles 6-1 redsoxs!! #dirtywater,1514310217030418441,ThatKidMiguel22,2828754928
