full_text,tweet_id,screen_name,user_ID
Nun but facts slime a mf https://t.co/cAtEBx14nD,1514756915280162822,LongLiveLeslie_,2876984245
Can’t be no nigga who let a female provide for me dat shit ain’t gone sit right wimmie ion see how boys comfortable with dat shit,1514755157745098754,LongLiveLeslie_,2876984245
Somebody please cut dis ho louie water off on snowfall,1514665679978475521,LongLiveLeslie_,2876984245
Sherman really thought he was on dis level to 😂🤣 https://t.co/zRldxpLx47,1514661187627200512,LongLiveLeslie_,2876984245
I fw ZO but melo more for LA he coming home wen bron retire,1514655503179296772,LongLiveLeslie_,2876984245
Tryna get around in this walking boot dry dab😒,1514636661208006656,LongLiveLeslie_,2876984245
