full_text,tweet_id,screen_name,user_ID
Took a home run away from Altuve. Changed a series. Horrible umpire. https://t.co/Gs3syTIGEK,1512731367297241088,Bballlawyer,296338695
Ryan Tepera after facing the #Astros #whiplash https://t.co/Mz77392nCn,1512290936482672641,Bballlawyer,296338695
This Tepera guy looks a lot like that loud-mouth punk from the White Sox last year. 🥴,1512289564970393605,Bballlawyer,296338695
Double play. #Framber #Astros,1512285945613139973,Bballlawyer,296338695
"Except all the excuses, storylines and narratives, and cheap talk, and hidden letters, and batters striking out… 🙄

2022 motto: 
Cole is nice, then roll the dice https://t.co/ertb6xcZGi",1512283474761240578,Bballlawyer,296338695
Losing to Framber? https://t.co/QrjjM3Zg4l,1512280159453384705,Bballlawyer,296338695
"Framber is dealing!
#LevelUp #ForTheH #Astros https://t.co/UOhQoogwAg",1512279986979356673,Bballlawyer,296338695
I’m not saying I can play a good LF in the majors… I’m just saying I would not be any worse than the Angels LFer tonight. https://t.co/XN52RQLeQh,1512278264982777857,Bballlawyer,296338695
