full_text,tweet_id,screen_name,user_ID
"I’ve enjoyed watching @gmfb for years, they may have reached the top of the mountain today!  

“That’s the United States...”- @KyleBrandt 

Hang it in the Louvre! @heykayadams @PSchrags #GMFB https://t.co/31A1zsnXvY",1514935497990316036,Danny_Favret,304077368
Rodney Mullen was one of my favorite skaters and now he’s one of my favorite philosophers. #TonyHawk,1514798428835876870,Danny_Favret,304077368
"Hunter Harvey could star in Joe Dirt 3, its magnificent! #Nationals @DavidSpade https://t.co/GuBhN4ShlS",1514764943702302720,Danny_Favret,304077368
