full_text,tweet_id,screen_name,user_ID
Kelvin Joesph and idiot and now we gotta have Anthony Brown as a starter…again,1514779112065277959,BIGWORRMM,325273248
At first I wasn’t tryna watch the Ultimatum…but Hannah got me watching it…this show wild as hell💀💀,1514436054002114565,BIGWORRMM,325273248
Facts!! You’ll be alright 😂😂😂 https://t.co/zBukrFfWMd,1514262949963210757,BIGWORRMM,325273248
Nail Tech by Harlow is 🔥🔥,1513995905506197504,BIGWORRMM,325273248
It’s 11am and y’all in the spaces wildn,1513544828646215681,BIGWORRMM,325273248
