full_text,tweet_id,screen_name,user_ID
They're all good boys. https://t.co/GSD8GURyDj,1514711044257718275,BrendanDzw,343007128
"YOU, THE COWARDS: deleting your mean tweets

ME, THE NOBLEMAN: https://t.co/u4Z0GrZvEI https://t.co/p3FOPSGyZa",1514697635785064458,BrendanDzw,343007128
Important reading for those not yet familiar with the Packers' latest addition: https://t.co/rdJpdBX43T,1514671315827007489,BrendanDzw,343007128
"Good for Sammy, that's a crisp $500K per game https://t.co/T6LByfUIdg",1514669009878327304,BrendanDzw,343007128
I have been owned. https://t.co/9X9nZj6UmB,1514667567796965388,BrendanDzw,343007128
I can't believe part of Packers Twitter is talking itself into Sammy Watkins.,1514645883547176968,BrendanDzw,343007128
Gute I am begging you to not do this. https://t.co/lTh5dZp2Gz,1514633506990837761,BrendanDzw,343007128
