full_text,tweet_id,screen_name,user_ID
Oh come on now 😭😭😭😭 https://t.co/rC4pk3U6iO,1514945897720958977,Dakane3,348591583
Bruh @Kaner33 nice round bub. Had no idea you made it to the Pre-Q at Valero. Hard work pays off! https://t.co/SCwK2amcgX,1514762304205766668,Dakane3,348591583
Kraft Mac and cheese is just one of those foods that always taste better if someone else makes it for you.,1514758897109803008,Dakane3,348591583
My favorite part is that he very clearly realizes how dumb of an idea this is with every pussyfoot toss of the match towards the hole but he keeps doing it anyway. 😂 this is classic thought process https://t.co/xDRF6hyrl1,1514753075159908363,Dakane3,348591583
Woof https://t.co/ya1QHeOJco,1514684090859012098,Dakane3,348591583
Yeah but he’s like 300 some odd pounds by now. https://t.co/hlQHoAxgFQ,1514454422155415556,Dakane3,348591583
Glad to see he’s on the mend https://t.co/5CqW9JSJWl,1514399510407127043,Dakane3,348591583
"I’ve never been tweeted at and told I’m a douche, ass, piece of shit, etc due to my performance at my job. It’s not the same blake. https://t.co/DTpAjoOyzv https://t.co/m4z5ojmx4y",1514398886886092802,Dakane3,348591583
