full_text,tweet_id,screen_name,user_ID
I am 100% that guy 😅😅😅 https://t.co/A9FquCgnsR,1514666516163096576,kaustic187,348904187
"23, in over 100 years and 220k games!! To anyone who thinks pulling him was the right call, I respectfully say, you’re trippin! https://t.co/nSHKBraOlW",1514324743817609216,kaustic187,348904187
I’m still pissed for Chicken Strip!! https://t.co/LYBIl6bRSy,1514323668788162569,kaustic187,348904187
And just like that. Motherfucker.,1514322642731339777,kaustic187,348904187
"If I were at the game, I’d be heckling the hell outta Doc. IDGAF about being fresh later.. this is history. WTF! #AlwaysLA",1514322075518865408,kaustic187,348904187
Freeman and going oppo is as good as PBnJ,1514321483337592833,kaustic187,348904187
