full_text,tweet_id,screen_name,user_ID
vm to all my reapers,1506315168665542670,GoCharli3,361067572
who are your favorite traders in the space? im tryna see sumn,1506313144670560256,GoCharli3,361067572
this is tuff #NOTTODAYCLUB https://t.co/nx236FfovD,1506312104584052739,GoCharli3,361067572
yall wylin for droppin Morbius spoilers on the tl,1506310542675300364,GoCharli3,361067572
Yea we are https://t.co/xqnMuaQhxn,1505276005413437447,GoCharli3,361067572
I want to give an invite to @NotTodayClub but can’t find anyone deserving 😈,1505275553640861698,GoCharli3,361067572
