full_text,tweet_id,screen_name,user_ID
"These cnote’s 💴 play in my mind, they’re on rewind",1514792675668504577,bizheff,376333795
Word to my favorite design my mama raised me to shine,1514792198901956616,bizheff,376333795
I’ve been picked out by god,1514792008761503755,bizheff,376333795
I think wolves pull the upset … https://t.co/EgerA13oDj,1514274658161410049,bizheff,376333795
How is Zion better than bam .. Zion hasn’t nvm https://t.co/CoUZOZvR2Z,1513943517990735884,bizheff,376333795
"Embiid, greak freak and Jokic can’t all make first team … https://t.co/Bd2S0TpBZ9",1513675396524527617,bizheff,376333795
That second verse is fucked up lol https://t.co/Az9yANbwzK,1513558961588424706,bizheff,376333795
Hell no .. can’t be goat or best pens with ghostwriter links https://t.co/qDDaVHBgnd,1513242706214019073,bizheff,376333795
