full_text,tweet_id,screen_name,user_ID
"I didn’t know Archie personally, but I always appreciated him for embracing @ATLUTD from the very beginning and never letting up. We rallied to “We Ready” in my high school locker room. I wouldn’t have imagined sharing the same supporter section with him a decade later. https://t.co/WmDgQTMiJc",1514345196133171215,AmigoTravis,403566802
"So if anyone wants to take advantage of this offer but doesn't want to keep the hat, holler at ya boy. https://t.co/aXiWSYBdMP",1513574929509277698,AmigoTravis,403566802
"This is probably the most re-told story every Masters Week, but it bears repeating that I could create a lot of new family memories for a few million dollars. I'd offer to bulldoze the house myself, too. https://t.co/Kd1JRdYiSy",1512443803155763204,AmigoTravis,403566802
I now have proof of @Whataburger in Kennesaw. https://t.co/xxw8eJF9J2,1511733344064741390,AmigoTravis,403566802
"Death, taxes, and proposals at Amen Corner during @TheMasters. https://t.co/RA8VqOND1M",1511059761193697291,AmigoTravis,403566802
This broke my heart. https://t.co/rXFaMWQfAj,1510396727274217472,AmigoTravis,403566802
Took my fiancé for her first Augusta National experience. @TheMasters truly is a tradition unlike any other. https://t.co/HZozYmFwpb,1510336908978700296,AmigoTravis,403566802
The Cobb County skyline is about to be changed forever. https://t.co/ULMAPcv1Sx,1509923718847414278,AmigoTravis,403566802
