full_text,tweet_id,screen_name,user_ID
It's going to get worse too! https://t.co/C1aT0hT7aZ,1509982572297736197,TonytheTigerfan,429471337
Not in the South anyway. Can't say that for California and New York. https://t.co/xAHpoWT9Dn,1509966911546740749,TonytheTigerfan,429471337
Pretty good I'd say it's the only way the Democrats can win. https://t.co/ainzFZSgvK,1509961393826582535,TonytheTigerfan,429471337
You remember when people could take a joke and laugh. I'd like to see Richard Pryor or Eddie Murphy get slapped and what they would do. I bet it wouldn't go down that. Be an awesome fight though!,1509959138222219274,TonytheTigerfan,429471337
The whole world has gone crazy. April fool's. Only the Democrats are really crazy and out of touch with reality.,1509920419893157919,TonytheTigerfan,429471337
"Had Will Smith been a white guy they would take the Oscar, pressed charges for assault and he will be blackballed in Hollywood.",1509566611333779458,TonytheTigerfan,429471337
When I get down I just watch the 6th game of the World Series again!!!,1508889120432664580,TonytheTigerfan,429471337
