full_text,tweet_id,screen_name,user_ID
Gonna watch this every day for the rest of my life https://t.co/BhFqPhy2f8,1514344940934946817,jake_stinchcomb,4875003166
St. Peter’s might just be those mfs @yungjoc650,1507529019121614858,jake_stinchcomb,4875003166
Don’t let Freddie and Matty Ice leaving Atlanta distract you from the fact that Trae Young still owns the city of New York. #IceTray,1506449928310046720,jake_stinchcomb,4875003166
Watching Falcons football will never be the same. Thank you for everything Matt. I hope you get what you deserve and more in Indy. @M_Ryan02 https://t.co/x2R6TU7pJ5,1506386137685889024,jake_stinchcomb,4875003166
"My brother n law is a hero, go check him out @bravesmoose https://t.co/QU9KodW5KR",1506376185080647685,jake_stinchcomb,4875003166
What does it mean 😫 https://t.co/Zm9S9JvleB,1505976953765076999,jake_stinchcomb,4875003166
"Okay, this one hurt. I’ll always love you. 🥺 @M_Ryan02",1505965545652469765,jake_stinchcomb,4875003166
Do we have a set date yet on when Jorge will be returning to Atlanta from Miami? @Braves,1505336765812465674,jake_stinchcomb,4875003166
