full_text,tweet_id,screen_name,user_ID
"""I will keep myself hearty for when freedom is"" https://t.co/KXE7zosJZV",1514616818509393923,jaw_studios,489113276
Connotation of batman would have you think he is https://t.co/LCoKCnimyI,1513876974095290377,jaw_studios,489113276
People in Texas are losing their druthers https://t.co/AJsurmZRQm,1512840520317509632,jaw_studios,489113276
That stupid dog and them kids that are https://t.co/qstkDarKHt,1512834909403959299,jaw_studios,489113276
"What in the fuck?
Texas, I'm trying to have faith in you, but this is atrocious.

https://t.co/xGtrIto7Fd",1512833216616488970,jaw_studios,489113276
"Oh mmmmm. Cool for them, just keen on the idea of drone delivery. https://t.co/waMYVLXzE5",1512297593698762753,jaw_studios,489113276
