full_text,tweet_id,screen_name,user_ID
All is calm as the sunsets -#lakelife https://t.co/CoLQQWdCep,1514770148942442500,pwatermeier,52276484
U.S. Extends Travel Mask Mandate by 15 Days https://t.co/XVheRZNio9,1514587881620267014,pwatermeier,52276484
Tuesday - fish fry - and sunsets #lakelife https://t.co/KyQe4Zsjhs,1514041461414715398,pwatermeier,52276484
After rain all day - too wet for lower deck - so propane fire -#lakelife https://t.co/5oGUtjb1uz,1513686807283740673,pwatermeier,52276484
Well damn look here … nothing to see just a couple of fine ars’s https://t.co/pfh7l5JIPB,1513270907007029250,pwatermeier,52276484
