full_text,tweet_id,screen_name,user_ID
"I just wanted to remind everyone

Mo Seider",1514768984129691656,Mackletrain,529766438
"POUR ME A MOTHER FUCKING CUP OF THAT MOOOOOOOOOOO SEIDER!!!!!

#lgrw https://t.co/XazcTIdt62",1514766756337762307,Mackletrain,529766438
That Mo didn't score there is a hate crime and I expect the Canes to be charged in federal court,1514764207081762862,Mackletrain,529766438
Two flagrant penalties there and I'm guessing they're calling neither of them?,1514760326197129243,Mackletrain,529766438
