full_text,tweet_id,screen_name,user_ID
"Bring these back, tbh #MLS #FIFA https://t.co/bwYfwhZC61",1514031310267944966,jcalebcook1,57661248
"Was coaching during the game.. 

I'm watching it back now...

What am I watching?! #ATLUTD https://t.co/AxbUEYCKfj",1513265481234407425,jcalebcook1,57661248
Some of THE WORST takes I've ever seen in this thread... https://t.co/hBpoAm4jJl,1511923472074690562,jcalebcook1,57661248
"Cheers, folks 🥃 #BeachTrip2022 https://t.co/BCTUnfySVE",1510641995429126151,jcalebcook1,57661248
