full_text,tweet_id,screen_name,user_ID
I need this 😭 https://t.co/STVeJREAXn,1514820928131280896,pristinedavina,623411172
Not me drunk on a Thursday,1514789866982162438,pristinedavina,623411172
I wanna hear one song without thinking of you https://t.co/evCPKwqb9v,1514747868401352706,pristinedavina,623411172
I’m so tired of trying to figure out what to eat every single day https://t.co/qEQ7kVoYiH,1514705042628136970,pristinedavina,623411172
Kehlani literally exposed his nasty ass months ago https://t.co/Av3CfZopCS,1514704168518311945,pristinedavina,623411172
well he was right about one thing https://t.co/kWS8u0d3oy,1514703852804747271,pristinedavina,623411172
