full_text,tweet_id,screen_name,user_ID
my toxic trait is that as soon as the sun comes out i'd risk it all to sit outside sipping margs and eating fish tacos,1514683690969882634,edmeejorge,624218018
get you someone that looks at you the way bishop looks at me https://t.co/e9II2GuJpn,1514639826758295555,edmeejorge,624218018
the universe said so https://t.co/onBmxnEhTo,1514631963516231683,edmeejorge,624218018
one like and i'll buy myself these for my bday https://t.co/psrgmWWnBg,1514332949566693382,edmeejorge,624218018
this really fucked me all the way up 🥲 https://t.co/xKyrFbFHVA,1514330617412005888,edmeejorge,624218018
