full_text,tweet_id,screen_name,user_ID
I quote one tweet an get auto blocked the fuck,1512812441868156932,steen_johnston,634980193
Twitter lame as hell on god https://t.co/AtrpIos6w0,1512812076875632645,steen_johnston,634980193
Adam a POS for that tweet,1512811257614766084,steen_johnston,634980193
My biggest thing with this tweet is why did you have to say he was struggling to catch on with Washington an Pittsburgh shits crazy https://t.co/bp6XU64bmZ,1512809288623964168,steen_johnston,634980193
100$ for not even a full tank of gas that shit is fuckin wild,1512772259781484546,steen_johnston,634980193
