full_text,tweet_id,screen_name,user_ID
"It always cracks me up when bitches tweet they ass or tits..the comment section u always have A) the perv whos prob like 15 n a virgin.. B) the old white married dude who thinks if he nice with his tweet he’ll get a DM
C) the angry mad whoever calling the @ a slut/whore…lol",1514737455508897794,ItalianNIrish,724059466123988993
Scherzer smoked the phils smh,1514734684923736073,ItalianNIrish,724059466123988993
Why are their so many bitches on this app thinkin they daenarys targaryen lol like nobody but bums want to hear how many dicks yall sucked 🤦‍♂️ n yall the same girls who be like “ouii he dm’d me he so ugly” like yeah u love the attention tho damnn lol,1514377078384336899,ItalianNIrish,724059466123988993
Philly gets absolutely no love n ill never understand why https://t.co/GRfdaup7ik,1513659629481476097,ItalianNIrish,724059466123988993
Is this like a trick question? Lol https://t.co/d7Q9RBw0G6,1512775071206674433,ItalianNIrish,724059466123988993
