full_text,tweet_id,screen_name,user_ID
Russian morality on full display: https://t.co/kkj3DkSNos,1514323042364649472,DakotaJames_LD,734930461080752128
"I’m just going to assume everyone in Seattle was in a grunge band called Earl Jam, or something.",1514052385986936836,DakotaJames_LD,734930461080752128
"I do my hair toss, Shrek my nails. 🎶 https://t.co/0zoBlgJaU5",1514040913156194304,DakotaJames_LD,734930461080752128
"Where’s Papa John? I could really use another sweaty, unhinged interview right now.",1513335877606391810,DakotaJames_LD,734930461080752128
Want to know how to lose fewer troops? Get them out of Ukraine. https://t.co/LnPiTN6ziy,1512126701756895232,DakotaJames_LD,734930461080752128
Plato’s arguments would’ve been at least 50% more effective had he written ‘LOL’ at the end of them. https://t.co/8OdwPfYoPK,1511813872730054656,DakotaJames_LD,734930461080752128
