full_text,tweet_id,screen_name,user_ID
"WAIT THIS IS SICK ACTUALLY

GOSH I LOVE KIRBY SO MUCH 😭😭

@JingusFlorpus GO CHECK THIS OUT RN https://t.co/MMQIi7H0op",1514464573142753285,DanGanGalaxy,821858266112258048
"Never thought I’d say this but…

Looks like I’m making a Roblox account 👀 https://t.co/7WpEoikahq",1514301591641333763,DanGanGalaxy,821858266112258048
One Piece Legos when? https://t.co/0MYUw8ihiR,1514159215178391552,DanGanGalaxy,821858266112258048
Shortstacks 👀,1514154447752110080,DanGanGalaxy,821858266112258048
