full_text,tweet_id,screen_name,user_ID
it feel like the weekend on a Tuesday I could move dates,1512795711653486594,spivey_logan,842004121
Jalen Brunson has arguably the most lethal pivot foot in the league right now 🤣,1511906268675547144,spivey_logan,842004121
this Twitter account is now a Dorian Finney-Smith fan page.. carry on,1509336770663624705,spivey_logan,842004121
Trae Young AKA the Knicks Killer 🤣,1506463513753141250,spivey_logan,842004121
Trade for @GardnerMinshew5 and see what the man’s got with some weapons and a newly assembled O-Line. He won’t cost much and if it doesn’t work out we can draft a QB next year with a much better group to choose from @Panthers,1505972192923770888,spivey_logan,842004121
