full_text,tweet_id,screen_name,user_ID
someone brought this back and whoever you are thank you https://t.co/RAb5Qf2Vb3,1514745573210877952,filmsactress,889690576437649408
dammit started thinking about this now i’m crying https://t.co/FPS96BRe0Z,1514745432311705611,filmsactress,889690576437649408
i really didnt know there are 39 barbie movies out and 2 in the works. i’ve only watched the og ones,1514564195005583363,filmsactress,889690576437649408
one of my favorite courtroom dramas https://t.co/MfHM3549pT,1514137134227091459,filmsactress,889690576437649408
just rewatched until they sail (1957) and remembered this photo exists https://t.co/EgB3Oczp19,1514078366453837825,filmsactress,889690576437649408
