full_text,tweet_id,screen_name,user_ID
Fedex delivered package to wrong address and refuses to answer any calls to retrieve package. @FedExHelp @FedEx @FedExForum,1514679923239174150,DaTruthofnola,902243293328801793
Say his name NBA! JAXSON HAYES #nola @adaniels33 @tro504 @WillGuillory @PelicansNBA @ProPelsTalk @ThePels12 #pelicansgametime #pelicansvsgrizzlies @KendrickPerkins https://t.co/Fky12GxUYC,1512930461944799236,DaTruthofnola,902243293328801793
"ESPN2 are jerks, imo but they’re under contract to keep LeBron n da lakers in da news or get fired, imo.They’re talking about someone n a team that’s not in the playin or playoffs then on to the eastern conference. #nola @NBAPR @ProPelsTalk @adaniels33 @tro504 @WillGuillory #imo https://t.co/zCH7VioEyX",1512075750630834187,DaTruthofnola,902243293328801793
"ESPN OF LA is full of shit concerning Anthony street clothes Davis injury is the reason why the lakers had a piss poor year, imo. So all the injuries with the Pelicans were lies? Now answer that question. @adaniels33 @tro504 @PelicansNBA @WillGuillory @ProPelsTalk @QBee22 #imo",1511786819100291082,DaTruthofnola,902243293328801793
"What is wrong with Ingram? He’s passing up his shots, not being aggressive and turning over the ball. Someone please wake him up! #nola #pelicansnba @tro504 @adaniels33 @ProPelsTalk @WillGuillory @ThePels12 @QBee22",1510819375573520385,DaTruthofnola,902243293328801793
"What consequences should the Lakers organization face from the NBA LEAGUE OFFICE FOR TURNING OFF THE LIGHTS ON THE PELICANS WHILE THEY PRACTICED. They reached a new classless low,imo. #nola @NBAPR @ThePels12 @tro504 @WillGuillory @PelicansNBA @ProPelsTalk #imo @adaniels33 https://t.co/AprecB9XTQ https://t.co/Oy82QSALKU",1510766632955691009,DaTruthofnola,902243293328801793
"LeBron to ref. what I do ref.? What I do ref? Well you tried to push CJ into next week,imo 😂😂😂#nola #imo #pelsvslakers #pelicansnba @KendrickPerkins @ProPelsTalk @ThePels12 @adaniels33 @tro504 @QBee22 https://t.co/PYJ6JQuQgS",1510377339766591495,DaTruthofnola,902243293328801793
