full_text,tweet_id,screen_name,user_ID
"Why is it always this one scene?

Because it homages AC#1?

I'm so tired, man. https://t.co/ookw78IFSc",1514908684559654918,Unphiltereddd,945015341893132288
The things people will do for a little twitter clout. https://t.co/oIxEF9q25h,1514907724579966978,Unphiltereddd,945015341893132288
"WE ARE LIVE! #4Nerds @2279acs_ @Nickatina_show @Zeeverfett 

https://t.co/nITlJJ48Ue",1514749223505326080,Unphiltereddd,945015341893132288
"If you're a fan of Keaton's Batman, I'm sure this will make you smile. https://t.co/VecTDSNiUA",1514742442779545601,Unphiltereddd,945015341893132288
Brainiac or Parasite. Stat. Superman deserves it. https://t.co/cnZ4sLu04n,1514689084475674624,Unphiltereddd,945015341893132288
