full_text,tweet_id,screen_name,user_ID
"this looks so, SO weird and incredible let's goooooo https://t.co/07m7RJG8Jn",1514644106013818903,adamncheek,972586719039164417
.@Josh6williams is going #NASCAR Cup racing for the first time this weekend on the dirt at Bristol…so here’s me asking the @TeamBJMcLeod driver about his @childrensatvcu sponsorship a couple weeks back at Richmond! Meant to tweet this and it seemed like perfect timing. 👇 🔊 https://t.co/pQzr5B7WNi,1514338399368404993,adamncheek,972586719039164417
"We haven't had a perfect game in a decade.

You don't do this, unless Kershaw himself insisted he be removed.

Unreal. https://t.co/0cZ2RSCxqv",1514329536132964363,adamncheek,972586719039164417
"Dave Stieb is a name I vaguely knew via various cards I have from the era, but never knew his backstory. He has such a great arc in this series -- a sort of character study in the best way.

Love everything @jon_bois and Alex make and this was no exception. Can't wait to rewatch. https://t.co/YUpu88vSV0",1514314514761764866,adamncheek,972586719039164417
"yoink

had to preorder the steelbook. loved the alternate cover art. #SpiderManNoWayHome https://t.co/WOCgZ99dG7",1514046833500246021,adamncheek,972586719039164417
WHO DID THIS TO CANTERBURY GLASS ON @LETTERBOXD LMAO https://t.co/8ASTI8G9qw,1513966718892322825,adamncheek,972586719039164417
