full_text,tweet_id,screen_name,user_ID
"You’ll hear all kinds of trash about how Ron DeSantis &amp; the Florida GOP are “literally trying to kill women” or whatever slander they come up with, but doing all you can to prevent the slaughter of innocent children is always the right thing to do. Thank you, @GovRonDeSantis. https://t.co/jze5Z0qHNt",1514790596291952641,jbwester,97819221
"My wife just told our daughter, ""Do what is right. Always.""

Apparently you CAN teach deontological ethics to a four-year-old.",1514596957238566913,jbwester,97819221
Could not be more pumped to watch this guy wear the uniform for one more season. #GoHeels https://t.co/k2mTCCDRQN,1514411038116098055,jbwester,97819221
I let my kids talk me into this because we are on vacation. Thoughts and prayers requested. https://t.co/QF92nvIgbd,1514368790158532615,jbwester,97819221
"I'm biased, but I think this is the most helpful book I've ever read teaching Christians to ""trust in the Lord."" I did some editing for @ErikReed on this project, but I've returned to its central themes constantly over the last year. https://t.co/ksgQJNMrXy",1513926838426521602,jbwester,97819221
