full_text,tweet_id,screen_name,user_ID
2k need to fix these glitchy builds its dukb how im maxed on defense badges but these dudes can screen they life away and its alll irrelevant. No screens in park at all imo,1514823190366797825,OfficialJanklow,985605229856153601
For a spring game jesus……. The jags cant even pull 16k 🤣🤣🤣 https://t.co/GoFqtCc8ev,1514774346383855629,OfficialJanklow,985605229856153601
Do you remember when you joined Twitter? I do! #MyTwitterAnniversary https://t.co/IGnqAJF7Mm,1514774127168483343,OfficialJanklow,985605229856153601
Futurama returning next year with complete original cast is awesome. And its cartoon so you cant really go Wong.,1514611727274455057,OfficialJanklow,985605229856153601
Just got a job offer from one of my old teachers…. Should i take it? 😂,1514600209287835656,OfficialJanklow,985605229856153601
$ogjanklow #bitcoinbella @CashApp please and thank you!!!!!! https://t.co/IUWcwcq30g,1514313533604958224,OfficialJanklow,985605229856153601
