full_text,tweet_id,screen_name,Tweet_user_ID,original_user_ID
"@DannyEdoBrien It is, I think especially with internet or online community research. Even after anonymising names/places - technically it’s still searchable? It’s really tricky",1554536944931160064,Kayla_cooley,45381030,592743735
Really looking forward to getting stuck into this book later on today https://t.co/iey9hdoRrr,1554503516747694085,SprtBookReviews,976167248871280640,592743735
"“These comments, which he took to be suggestions that he lose games”

Uh…how else is someone supposed to interpret a directive to prioritize the draft? https://t.co/p3frBhLedj",1554501656837951488,minakimes,95975081,592743735
"Who would have guessed…

That all the Scots needed to turbocharge their movement for independence

…was Liz Truss?

https://t.co/H2vavrSKGh",1554477277999763458,MarinaPurkiss,58436094,592743735
Take a bow @squires_david 👏 https://t.co/qrmE9EWwsm,1554464558651170819,robyniocowen,65876348,592743735
No 1 PL full back ever.. No matter what they say! https://t.co/izFMy9O7nC,1554464206182817793,kdkilbane77,998389111,592743735
@DannyEdoBrien I've been saying it all along,1554443524468269059,CianReinhardt,182408967,592743735
"TLH Deep Dive: Thomas Ahern

An in-depth look at Munster's 22-year-old second row, his development, his biggest strengths, what he offers teams, and where he can go.

Get access for just €2.

Link: https://t.co/iqfDKubFA2 https://t.co/veX5fq7sX6",1554358639300845569,TheLooseH,2973315633,592743735
"Once again, Hockey Twitter is supreme https://t.co/9VQO6xdXwp",1554298236814475266,animalsofhockey,1525301758821650432,592743735
Step 1:  look at this https://t.co/bwCm0UYkG5 https://t.co/PEiiMZDamh,1554282544085884930,bunsenbernerbmd,917201597247012864,592743735
@DannyEdoBrien @AcademicChatter GIFs are ALWAYS appreciated 😂 thanks Danny 🙏,1554185807069585420,Kayla_cooley,45381030,592743735
I'd like to think we all can agree that this concept really should be immune to the general poison that our country's party politics have become: https://t.co/wqcFQxnF4h,1554184521146408965,Dejan_Kovacevic,51674513,592743735
“The Argonath” by Ted Nasmith https://t.co/bMMAKptyhN,1554170738554421250,mellon_heads,1347550397506969608,592743735
"It's time to vote for Thomond Park. 

#SUAF https://t.co/dgYkfHsy2B https://t.co/NqlQLsj8ec",1554149695135571968,threeredkings,3621188476,592743735
"""Stand on this stage, say the right words with the right emphasis at the right time. You can change people's minds just with words in this place.""

""It's like your police box. Small wooden box with all that power inside!""

""Oh... Oh, Martha Jones, I like you."" https://t.co/khHdXKcHn8",1554145688279293953,BadWolfArchives,883016728426536960,592743735
@KehlanK putting in huge work for @TreatyUnitedFC over the last few weeks. Some cracking footage captured 🔥🙌🙌 https://t.co/PPmYI3r9k5,1554139604936278017,marc_ludden,2405683901,592743735
"@DannyEdoBrien Translates to ""mess of a club""",1554111687489425408,cjsportsblog,1314636492996829184,592743735
"This moment between Bill Russell, Magic Johnson and Larry Bird will warm your heart 🥺 

(via @NBA) https://t.co/BChzCowOXT",1553932204924977157,ESPNNBA,74518740,592743735
https://t.co/WzHlmTiRRK,1553843598701084674,trebor6550,843391134361686016,592743735
Can’t believe we have this river on our doorstep #thatslimerickcitaayy https://t.co/PnB3gcGIqg,1553837396638269440,chrisPinpoint,2537773101,592743735
Hard to begrudge this England team but I’ll find a way,1553811907135606785,GavanCasey,270173270,592743735
"I’ll always remember Bill Russell as the greatest team captain of all time. That goes for any sport, any era, any nation on Earth. Imagine winning 11 championships in 13 seasons… and going 10-0 in playoff Game 7’s… and, and, and… https://t.co/o8xbxinSVR",1553797759416745984,SamWalkers,86343120,592743735
@DannyEdoBrien Was sure that was the villain from Who Framed Roger Rabbit https://t.co/A0DpT4YgGG,1553795959796236291,Overthehillprop,245051998,592743735
https://t.co/lmX9jr8T3z,1553747856149856257,BatteryVoltas,1307357944225427457,592743735
"How is it that Eoghan, Eoin and Owen are the same name but have such distinctly different vibes?",1553746191288074241,hughanseo,1093987260129792001,592743735
"A lively crowd have turned up this morning for the final day for the #CommonwealthGames #Rugby7s 

England vs Wales up next in what is sure to be a very lively encounter 🏉 https://t.co/HZzDbfpQho",1553684073314504704,MichaelLavery98,1118174688725929984,592743735
"This is one of my favourite scenes ever ❤️ 

 https://t.co/9MgItEYKSg",1553678967630172161,BadWolfArchives,883016728426536960,592743735
"This week on TRK Premium, I'll be doing the Green Eye and Wally Ratings from the perspective of the Springboks

Get access to all of that right here

https://t.co/sKp9tqAOV1

#RSAvNZL https://t.co/oYrwF9L9Qx",1553667925357346817,threeredkings,3621188476,592743735
"GAA is an amateur sport. The players make huge sacrifices for no salary. If they want to play for a team where they live rather where they grew up, fair fucks.

Shane Walsh owes no one anything.",1553661762100240386,katieharr1988,2905133196,592743735
"The Cattigans are a lovely family who have suffered the devastating loss of their wonderful daughter, Siobhan. There needs to be a fully independent inquiry into the distressing issues raised in this piece. https://t.co/Xk9RvvuHVw",1553656557128359936,TEnglishSport,164633666,592743735
"@realBrookNash Follow your passion.

How about, get good at something and make that your passion?

BTW, my passions are music, travel, and wine. They’ve only cost me money so far…",1553495503186415621,StroteBook,1329126044436140038,592743735
Definitely one of the party guests from the film Get Out https://t.co/Tya8lLIJhG,1553450388279513090,SaHreports,2469679688,592743735
"Fossa are playing the Junior championship in Kerry tomorrow. Can you imagine the managers pre match pep talk. 
""Paudie Clifford centre forward, David Clifford full forward, the rest of ye....... spread out""",1553442968475926528,jackosham,220108608,592743735
"@DannyEdoBrien The race for content at any cost. No time for script development or prep. 20yrs ago I had 3 or 4 months prep, now 4 weeks.",1553387586655232002,MarketaDee,60042783,592743735
Never trust a man who casually dresses like he is going to help the nazis steal the ark of the covenant. https://t.co/GNZyYZ1din,1553387117459521538,TechnicallyRon,108140114,592743735
"Benni McCarthy joining the Man United coaching staff for some reason, so as good a time as any to recall one of the great braces in Champions League history 

Come for the goals, stay for the inexplicably mammoth size of those Porto nets, Pro Evo-esque

https://t.co/VOyGc7hdEN",1553343890513690624,RonanReigns,415097130,592743735
@DannyEdoBrien 100%,1553340677425078273,ThatChristinaG,725350782497906688,592743735
I'm just SO EXCITED TO SEE HIM AGAIN AHH https://t.co/LJ2TvFiNoh,1553330521974878209,BadWolfArchives,883016728426536960,592743735
This is cool @marksandspencer https://t.co/Y1r9s7Bkyx,1553314805762646016,tomcdav,371575492,592743735
Top flight hockey is always tough and you have to ride the roller coaster and this group did that in abundance finishing strong today with a great 2-1 win. @hookhockey @irishhockey @UnipharLCM https://t.co/EmaeYx11WZ,1553314351410561025,davepeha,328758326,592743735
"PATREON EXCLUSIVE :: Rebuilding The Big Red Machine Part 2 - TIghtheads

The second of a 7 part long-form series looking at Munster's new season. 

Join now for just €2 a month or €20 a year.

https://t.co/2rHXdXDZZM

#SUAF #BITW https://t.co/5zX7UuCCK6",1553299377246060544,threeredkings,3621188476,592743735
"The piece by UCC's Geoffrey Roberts that Sabina Higgins cited in her letter is.. mad. He argues that for the sake of a supposed peace Ukraine should surrender,  disarm and concede territory to Russia entirely. Vintage westsplaining.  https://t.co/Vu4wsiLQm7",1553298154048684032,gavinsblog,15908631,592743735
"The Penney Galway Races section is like an art installation, at the intersection of jeans and sheux https://t.co/Kw83BR1wWJ",1553294451132534787,________simon,2670746029,592743735
"Eddie Munson finally got his chance to play guitar with Metallica

 https://t.co/NjIlmAksSg",1553163108427988992,barstoolsports,22637974,592743735
This is my feel good content. 🤘 https://t.co/vro9Fry6D5,1553159625079504896,ThatChristinaG,725350782497906688,592743735
Emmanuel smoked him. https://t.co/H0GJhBnlFP,1553151800714432513,platini954,19155825,592743735
"Playing my Venca Spotify playlist so when I tell you my vibe is unmatched right now, believe it.",1553118138299990016,ThatChristinaG,725350782497906688,592743735
When Micko got a visit from his lifelong friends SAM &amp; Jack #ThisIsKerry 💚💛 https://t.co/cFUkI4Mtre,1553114418308943873,Kerry_Official,143058273,592743735
We got the job done today. We made the final. Now for the next step 🥇 https://t.co/Tutydmdn65,1553083367805128704,McClenaghanRhys,406521748,592743735
"Let my games begin 

#CommonwealthGames2022 https://t.co/VKjXAjhzZc",1553083344484696065,cjsportsblog,1314636492996829184,592743735
Sure where else would you be on a Friday evening? @TreatyUnitedFC v Usher Celtic k/o 7:45pm in the FAI Cup https://t.co/bXStEkj0Eb,1553072861899886592,KehlanK,195702517,592743735
New wig https://t.co/mwBiXrVlTt,1553055762464874496,andijarvis,94417274,592743735
"Exclamation marks are invalid characters when entering information in AIB, they're gonna lose all us millennials!!!",1553046777133244417,aoifelongeng,270104615,592743735
"We are delighted to announce that our UECL Third Round game against Viking will take place at The Showgrounds on Thursday August 11th at 7pm

The club have worked tirelessly overnight to secure the game here in front of our home supporters

We cannot wait https://t.co/0162nU7JaB",1553029434260717570,sligorovers,33887249,592743735
"This is like getting an advent calendar for August, but it's rugby. 🎄 https://t.co/dkoRNL6EYt",1553009392810876928,RugbyKino,79178509,592743735
"Only a month until the big European leagues begin again. So, over that month I will be doing a different thread on every team in the Prem, ProD2, URC, and Top14 - which is 59 teams (if my maths is right). 

Probably it'll be a player to watch but I might pick out a tactical trend",1553008665287868416,SamLStandsUp,2393434111,592743735
"I recommend, Mrs. Higgins, not weighing in on something you obviously know nothing about. As we in Ukraine will not tell your country what to do in your relations with England and Northern Ireland.  https://t.co/wwW2MJ4tlG",1553004867660152832,KatyaYushchenko,2657033400,592743735
"Some personal news - Today is my last day with the @Limerick_Leader and @LimkLeaderSport teams. 

I am so grateful for the brilliant five years together. 

Looking forward to the next chapter with the @Limerick_ie Marketing and Communications team from next week.",1553002652052598790,DonnOSullivan,22687635,592743735
@DannyEdoBrien … 20 minute reds twice as often is probably equating to just as much time with 14 players on the pitch.,1552941080458444802,TheKiwiRedDevil,322849857,592743735
@gargantuancows @DannyEdoBrien @ek_rugby 1 (20 minute) red card in Super Rugby  every 4.1 matches this year. 1 full RC every 9 matches in URC suggests incentives differ.,1552904243056726021,TheKiwiRedDevil,322849857,592743735
⁦@3Legs4Wheels⁩  I think I found the knock off rich energy in the states. https://t.co/sxChRdEIym,1552836195058683906,focusfinder,1051300735948939265,592743735
"I tried posting to TikTok 3 times a day for a month! Here’s what happened!

I got burnt out.",1552813701865951233,jsstansel,176562564,592743735
So much respect for these 28 football clubs who say no to gambling sponsorship and campaign against it 👏👏 https://t.co/9BvwbodOwK,1552748652623446016,the_bigstep,1115645797255659520,592743735
"Any Charlton fans who want to have ‘engagement’ with an unregulated, volatile and easily manipulated product you now have your chance https://t.co/f5fvAoXPma",1552738538600407041,KieranMaguire,133646751,592743735
This just happened #bitored https://t.co/wYnAQaUecz,1552717934694486018,simon_06,44977813,592743735
Shouldn't Kyler be directing this energy at the people who put the independent study clause in his contract and not NFL Twitter?,1552713788272492549,bylindsayhjones,250271653,592743735
@TwitterSports https://t.co/UhtnMOf6JG,1552700789172453379,ek_rugby,1171366709216894977,592743735
"You’re a cynical coach in need of a big win. Your opposition has gone for a 6-2 split on the bench. A scrum half and a utility back to cover 10-15. No specialist replacement.
If you get the “job” done in the opening ten minutes, they’ll play most of the match without a proper 10. https://t.co/BGdfPXBPgl",1552675941620514817,danielmoonbags,174813388,592743735
"Part 2 of The Amazing Dog Nose!
A new study has found a pathway that links smell and sight.
It’s Amazing!
#TheSciencePaws #Dogs https://t.co/oIPk91meS9",1552674787750662144,bunsenbernerbmd,917201597247012864,592743735
"Bohemians COO @dlLambo joins us to talk about the announcement that the planned completion of the redeveloped Dalymount has been put back to 2026. Why does he believe this will ultimately work out better for fans of both Bohs and Shels?

https://t.co/2CtFEYWB7g https://t.co/14UhhCoQSv",1552671437885956097,SecondCaptains,1243943036,592743735
"Good people of Rugby Twitter, please listen to Sam. https://t.co/fkpipoeaYm",1552669824089726978,TightFive_Rugby,1437731496186552322,592743735
"Jon Stewart generally stays in the background and lets vets and advocates speak but this morning he is clearly fed up that the Senate failed to pass the burn pits bill. His message to GOP senators who voted against this “get this done, he tells me.” ⁦@NewsNation⁩ https://t.co/fBCKpY2nbV",1552664536708268032,KellieMeyerNews,1286925638,592743735
"When you follow these horses in a car round the track you appreciate what these jockeys do! 😮 thanks @Galway_Races that was a thrill

#raceday #GiddyforGalway https://t.co/frLyxgEo7M",1552661757444952065,Raceday_RTV,1397221637687320584,592743735
"""Every night, Doctor, when it gets dark, and the stars come out... I'll look up at the sky, and think of you.""

Bernard Cribbins (1928-2022) ❤️❤️ https://t.co/8JwzRZOeDh",1552632499884392454,bbcdoctorwho,237670274,592743735
"Seb, it’s been an honour to call you a competitor and an ever greater honour to call you my friend. Leaving this sport better than you found it is always the goal. I have no doubt that whatever comes next for you will be exciting, meaningful, and rewarding. Love you, man. https://t.co/eHVmOpov2m",1552622805556101120,LewisHamilton,213969309,592743735
"Thanks, I hate it. https://t.co/nGnyskPB9v",1552620887333036033,rugby_ap,1278080835866984450,592743735
😭😭😭 RIP Bernard. https://t.co/SnwgAW8xuS,1552620052767178752,ThatChristinaG,725350782497906688,592743735
"Guy next to me on plane: “Why are you wearing a mask? You don’t need to anymore.”

Me: “It helps me mind my own business.”",1552612988967862272,RedactedJohn,804023967170359296,592743735
"I'm not the best at articulating my sadness with words, so I thought i'd try and put it all into a piece of art paying tribute to Doctor Who's best Grandad :) #DoctorWho https://t.co/0rkX6cPKbO",1552608314462175234,shay_0505,974032142232686592,592743735
"RTing for the daytime crew ...
#DUCKTAIL https://t.co/f5DRxtWhtW",1552607315056119818,L2actual,916058857809604608,592743735
Thank god. The one month of the year that URC isn’t Best League is finally over. Here we go again! https://t.co/Zay83usqNu,1552597663224418304,rugby_ap,1278080835866984450,592743735
https://t.co/FO9Lb4JgRT,1552594751400148993,hourly_shitpost,1370394029310017537,592743735
"Thread: Clearly, the 20 minute red card is objectively stupid. Virtually every other organisation agrees on that. Sanzaar seem determined to make sensational tits of themselves for absolutely no reason.

1)",1552585047659757568,SamLStandsUp,2393434111,592743735
When I think of Bernard Cribbins I think of this scene https://t.co/xxlXpYQ08q,1552579916767666177,scottygb,15721456,592743735
"IRFU to offer professional contracts to Ireland women’s 15s players for the first time 

https://t.co/hiQe0DT8w6

Great news this morning, looking forward to the official announcement.. 🏉🇮🇪✨",1552567761947205632,louiselawless91,928236578358681600,592743735
"Heartbroken to hear about the passing of Bernard Cribbins.

This man was such a special, unique, beloved talent in the world. He will be remembered by many generations, forever.

My thoughts are with his family and friends. RIP to a wonderful man. https://t.co/N8O6lR75Dy",1552566796263346176,BadWolfArchives,883016728426536960,592743735
"“As a group we firmly believe the integrity of international matches is very important and that wherever possible matches must be a contest of 15 versus 15.”

Big spectacle over safety vibes here from Sanzaar on 20-minute red cards.",1552561774184087558,bencoles_,44675242,592743735
In bits this morning at how IKEA coffee comes packed 😂 I feel like Pablo Escobar ☕️ https://t.co/VnwQArniQ2,1552553990394728449,SeanDefoe,26560987,592743735
"I mean, of course test rugby sides wouldn't be as cynical as this. I'm just talking hypothetically. https://t.co/hZiBExvPiI",1552512225948172290,threeredkings,3621188476,592743735
"Ciara: Russ can you handle dinner for us tonight?

Russ: Cooks meal for 12 people. https://t.co/mY8ZvO8oB5",1552410628555476993,ZK_FFB,2629656991,592743735
i hate it when he does this https://t.co/wfu0o8a71K,1552387738992873474,MrMichaelSpicer,93222172,592743735
"@DannyEdoBrien Hell yeah, and I've got an Ivey one on the way 🔥🔥",1552353794578681859,cjsportsblog,1314636492996829184,592743735
What’s that? Pricing psychology not being built on actual science. Buy my course at £2997 and I’ll explain why that’s rubbish! https://t.co/HVIH9RRKA0,1552333464858501121,andijarvis,94417274,592743735
"The only way, the truth: 1.5 speed https://t.co/83DkOCgMA0",1552331775996620801,minakimes,95975081,592743735
"NEW VIDEO: Two years ago, nobody would have believed it but them: Chile are going to the Rugby World Cup. So, how did they disarm the USA, and what can we expect from the competition's glorious first new qualifier in twelve years?
https://t.co/udXxcunmJd https://t.co/ZO34ovNoW9",1552329775880044545,SquidgeRugby,956620307602857986,592743735
"@mrconde @SportsOrla This is Kopenhahen welcoming home Jonas Vingegaard, winner of Tour de France 2022. Impressive @DannyEdoBrien",1552293382587809795,IntentionalAca,17365671,592743735
"A little *harmless* fun for everyone on the timeline.

Rank international teams on how likely they are to win RWC 2023 in your opinion. 

For me:
1. France 🇫🇷 
2. South Africa 🇿🇦 
3. Ireland 🇮🇪 
4. England 🏴󠁧󠁢󠁥󠁮󠁧󠁿 
5. New Zealand 🇳🇿 
6. Australia 🇦🇺 
7. Wales 🏴󠁧󠁢󠁷󠁬󠁳󠁿",1552280538181943298,BenNurse8,1370059552960417797,592743735
"The last time this team was written off? They brought back a trophy 🏆 

This time? We’re bringing back a second star ⭐️ ⭐️ #SempreMilan https://t.co/tK3KL26SZR",1552245107738411008,MilanClubDublin,785207760917041152,592743735
"When the fridge door opens..... 😴 😋

#dogsoftwitter #dogs #Dog #smileforbert ♥ https://t.co/EdS0kXrtxX",1552231076998832128,BearBertthe,1226551564694933505,592743735
Razor just inviting the RFU to drive a dump truck full of money up to his driveway.,1552185831187574786,JamieWall2,223280961,592743735
