full_text,tweet_id,screen_name,Tweet_user_ID,original_user_ID
SS deleted texts DHS deleted texts did DoD also delete texts? Remember when Trump put loyalists in positions of power in these depts? This was why he did it.,1554584225994637313,MerrittKelly1,2922798301,620611977
I called milk 'cereal water' one time and my best friend has never let me forget it.,1554584173016276992,Andraste,12669,620611977
But their texts. All their texts.,1554583552649461760,jeffjarvis,11435642,620611977
What a day. I need wine.,1554582261202386950,FeralCherylZ,2654802672,620611977
Remember when I said “YouTube Should Give Us Emojis to show how we feel instead of Dislikes”? https://t.co/oN8RD8YaLD,1554579146440904705,robertoblake,19003754,620611977
God bless those of you wearing masks,1554572292302073856,Ohthatflo,14058831,620611977
Holy shit SFO has changed since I last flew three years ago,1554569481367670785,Ohthatflo,14058831,620611977
“A clergy source” stahhhhhp 😂😂😂 https://t.co/vrlhTDtVvv,1554562157735395330,GinaMuscato,278636534,620611977
"Yankees still have moves to make. Gleyber is out of the line up, and teams are asking about him per @JackCurryYES they also need to figure out they will lineup the bullpen. Less than two hours. What’s going to happen? #RepBX",1554559447418241028,JulianGuilarte1,2391600667,620611977
"Teammates. 👀

This combo is gonna be so fun to watch! 🇩🇴 https://t.co/OpqYKXw8yI",1554558992806023168,MLB,18479513,620611977
@Yankees best of luck in LA Joey,1554557872062734336,NYYSandy,1521997869221244928,620611977
The New York Yankees today announced that they have acquired minor league right-handed pitcher Clayton Beeter from the Los Angeles Dodgers in exchange for outfielder Joey Gallo.,1554557677409169410,Yankees,40927173,620611977
I officially just announced on Facebook that we are moving to Finland. Todd says we can officially talk about it even though I have been for months over here on twitter. You folks are special over here.,1554557483967868929,BombCandice,1331634633771872259,620611977
“Silence is golden”. https://t.co/HuS5q84EKH,1554553527262842880,MRogersWrites,728747519090495488,620611977
One of my favorites 😌 a classic if you will. https://t.co/yMbYVjmb83,1554552881893609472,OGPantherLilly,1598782375,620611977
Luke Voit is going to the Nationals instead of Erik Homser.,1554551596658446336,JulianGuilarte1,2391600667,620611977
"Aaron Judge and Austin Riley were as scorching as the July weather. 🔥

They are your @chevrolet Players of the Month! https://t.co/kb6hu0rssF",1554551437333512192,MLB,18479513,620611977
off to LA we go 💙🤍 https://t.co/emhgjfKlAz,1554543234990366721,NYYSandy,1521997869221244928,620611977
"Yankees outfielder Joey Gallo has reportedly been traded to the Los Angeles Dodgers. He is one of just eight active MLB players with multiple 40+ HR seasons.

@Dodgers | #Dodgers https://t.co/fweJcPpZsK",1554541642174054402,baseball_ref,68449573,620611977
"Yankees trade Joey Gallo to Dodgers for pitching prospect Clayton Beeter.

➡️ https://t.co/H6ZKomh3bI https://t.co/zX1nSlcfJJ",1554541430802087936,MLByahoosports,455007363,620611977
"This sounds like the fun, sci-fi romp I could use as brain bleach for my life. https://t.co/3vpCckvrrD",1554540776763412487,MRogersWrites,728747519090495488,620611977
San Diego's new closer has arrived. https://t.co/Nrnqd4VLL7,1554539558515113986,MLB,18479513,620611977
@MLB @JonHeyman @SorareMLB It's a shame Gallo and Yankees didn't work I'm rooting for you @JoeyGallo24 wish you nothing but the best man.,1554537959206035461,NickClark_TWD,923435522378420226,620611977
"San Diego will be paying down a significant portion of the $44 million or so remaining on Eric Hosmer’s contract, per sources. https://t.co/FiYi04roqi",1554537752619786253,JeffPassan,33857883,620611977
Joey Gallo to LA... wish him the best 🤌,1554535655795032064,jdun1031,843633216527523840,620611977
"Dropped off my ballot for the Dem #FloridaPrimary. In the gubernatorial primary, I voted for the candidate who I think can get the most votes among ALL Floridians to beat DeSantis, that means the candidate who I think Independents and not crazy Republicans will vote for. https://t.co/iN9ablVMRa",1554535357189955591,SandaBlueDeux,631149574,620611977
"With Eric Hosmer out of the Juan Soto trade after rejecting a deal to Washington, the Boston Red Sox swooped in and will acquire him from San Diego, sources tell ESPN. The finances are unclear: Padres could pick up a chunk of money -- or could send along a prospect with Hosmer.",1554535057896914946,JeffPassan,33857883,620611977
"New yard tree, accomplished https://t.co/zs64d9rfzI",1554534448015687680,AshleyEsqueda,129911948,620611977
The Yankees will face Joey Gallo in the World Series and that’s so obvious https://t.co/xhbpZXehY4,1554532782898118658,TalkinYanks,887792363052998656,620611977
Breaking MLB: Joey Gallo has been traded to the Dodgers.,1554531734603108353,Grunttalksmlb,1236212324911976449,620611977
@RaxKingIsDead rare live performance https://t.co/4NxR28iTqY,1554527825171845120,biboofficial,2765849243,620611977
And they won't tell you it's locked until you go through a maze of their bad interface to click on it and then find out it's locked or subscription based.,1554525748861345792,BombCandice,1331634633771872259,620611977
"Prime is the most ridiculous . They have a ton of Nordic shows and movies. All good shit I have been looking for. But they trick you. Even though Prime is a premium, they give you one season of something and then hide the other seasons behind a subscrip for other channels.",1554525601096011776,BombCandice,1331634633771872259,620611977
just unlisted pretty much all of my old content and i feel so free…things are gonna be changing round here 🫶🏼,1554519310223036416,thebook_pusher,175527388,620611977
"@Grunttalksmlb Yes, SD",1554516049017851905,jjpani2,210627734,620611977
"...Jake Gyllenhaal is the Swayze part in the ""ROADHOUSE"" remake?",1554511491524706312,the_moviebob,264050862,620611977
https://t.co/ERB8VE1q8j,1554506216734334977,Bodegacats_,2783025822,620611977
I would quite literally die without Dr Pepper and that is not an exaggeration,1554501376142544897,lily_marston,39644856,620611977
The Padres are the smelling salts of ballclubs,1554498978116509697,lindseyadler,356752859,620611977
https://t.co/j1aaehmzf6,1554497967968493570,yeaitsyourmom,979473312022581248,620611977
https://t.co/bLgBrAYvWY,1554497702737715200,majorityfm,208361818,620611977
"Seeing this interview with Joey Gallo… idk if I wanna give him a hug or a smack. 

So you’re just gonna blame the fans &amp; take no accountability for your lack of production? Hmmmmm….",1554495705498017792,GinaMuscato,278636534,620611977
gm. How’s the tide today? 🌊👀🫢,1554485820454686721,ijustine,7846,620611977
big fan of the iOS 16 lock screen https://t.co/xSoFJBXOeD,1554481988681306112,itsbinkybee,60309819,620611977
"few things embody raw feminine power like lisa bonet being with two god-tier men at different times in her life (including one over a decade her junior!), and then bringing them together as dear friends with no envy or malice. like wow. actual queen shit https://t.co/DKd1XTAOch",1554470247129927682,Chelsea_Fagan,263948521,620611977
"Two reminders on Juan Soto:

- No player, age 23 or younger, has EVER been traded midseason the year he was an All-Star

- No player has ever made multiple All-Star teams AND changed teams ALL before turning 24 (h/t @EliasSports)

Both of these would apply to Soto.",1554465495654535171,SlangsOnSports,1636364526,620611977
Yahoo News syndication of far-right news sources really whitewashes that coverage when just the headline shows up on social.,1554461563683217409,dkiesow,4753961,620611977
I wonder what it’s like to travel on an airplane without a camera bag.,1554419489651003393,beckiandchris,365771752,620611977
@Grunttalksmlb Padres,1554419121009434624,MHovey_Sarasota,143066552,620611977
Dark Brandon meme hits the mainstream. Biden starts climbing in the polls.,1554389664961859584,BeauTFC,1056759055795081218,620611977
"@BDaveWalters I didn't know how to express in words how this came across, so I just remade it to how it came across https://t.co/4rrlQ2pVA0",1554369779745579009,Erijah,343597584,620611977
@JTEmoviethinks https://t.co/rp7NmkpBy8,1554349901735006208,Lons,6516132,620611977
"Nobody asked for hot dog or hamburger-flavored candy corn. Yet here we are. 🤮 

I love candy corn &amp; they’re just hell bent on ruining it. https://t.co/d6TeNKXY9O",1554344119320731650,GinaMuscato,278636534,620611977
This can’t be real. 🤡 https://t.co/BTqOMQYrmO,1554321127832428546,JennySLo,46669875,620611977
"@charles_leroy I know some people do hydroponic indoors up here, but between kids and clutter and dog I've never tried 😄",1554320250178457600,yeaitsyourmom,979473312022581248,620611977
"@charles_leroy No, but wouldn't that be cool!! They're Saskatoon berries, the bushes take a couple years to really bear fruit. Not many fruits will grow in Alaska!",1554319343059472384,yeaitsyourmom,979473312022581248,620611977
@lily_marston @PapaJohns 😵‍💫😵‍💫,1554317564414607360,readingonfilm,883050533963014144,620611977
https://t.co/li88kPMLMQ,1554317218267033600,lily_marston,39644856,620611977
@lily_marston @PapaJohns is that what i think it is on top….,1554316412222459906,readingonfilm,883050533963014144,620611977
looooong day that was ended with the cheesiest of pizzas and now I will be melting into my bed good night https://t.co/HljE617dJi,1554316031618781185,lily_marston,39644856,620611977
"""The GIRL in his Shadow""  Good  news it's #1 of more! https://t.co/vSvahVfNav",1554315061069582336,MargaretSGilman,1618550048,620611977
"I was gonna turn in early but then this happened 

#NW https://t.co/MQ8cIVXwN8",1554312544860475392,JennySLo,46669875,620611977
"@Grunttalksmlb SD has the favorable prospects that Nats would want followed by STL, then LA.",1554308599089975298,HdubbsH,1019000457581252609,620611977
@Grunttalksmlb @JulianGuilarte1 SD,1554307749961506816,dkass,21772507,620611977
@Grunttalksmlb @JulianGuilarte1 If he gets traded anywhere it’ll be the padres,1554307419974488065,Hockey_Is_All,1188146246709465088,620611977
I'd like to hear Max's thoughts on this https://t.co/1n5Il1reDf,1554304985998929920,BDaveWalters,62228907,620611977
@Grunttalksmlb Yes. Padres. You heard it here first.,1554298573910691840,charlycapriles,625663266,620611977
"The Marlins come to LA later this month for a series. 

What are the chances Mattingly will still be mgr? Because I wanna see him. #alltimefavoriteplayer",1554294606681874432,GinaMuscato,278636534,620611977
Win 70 was a special one with my mom💙 https://t.co/j2Rp2rEqUZ,1554291464682831877,marioagomez_1,1156951515871006723,620611977
70 wins for the New York Yankees,1554288229163180033,jdun1031,843633216527523840,620611977
Here’s some Pancake if you need it https://t.co/9pGLPMn1f7,1554270420093779969,deapoirierbooks,797497258988158978,620611977
Late to the game… Did Aaron Judge really hit another HR? Lol 😂 #43 https://t.co/YmF6t6blGE,1554254622281252864,GinaMuscato,278636534,620611977
"I might as well tweet this every game:

👨‍⚖️",1554252744453722113,CC_Sabathia,19238073,620611977
Heh https://t.co/AWdMgreQ1W,1554252117338095618,idolknights,89459933,620611977
PEOPLE IN CAN'T TELL YOU HOW EXCITING THIS IS FOR ME https://t.co/VsmqqeouWV,1554249805089501184,yeaitsyourmom,979473312022581248,620611977
Nobody beats the Rizz 🤌,1554246900504748033,jdun1031,843633216527523840,620611977
@MacFarlaneNews She’s goddamn right he does.,1554236226177273859,JoJoFromJerz,818893114979061761,620611977
Someone is tired https://t.co/KVXWUgPytu,1554218624298139650,deapoirierbooks,797497258988158978,620611977
How it’s going … https://t.co/Eki9fS7FnR,1554210853490237449,idolknights,89459933,620611977
"FLASH:

Minutes after Guy Reffitt was sentenced to 7 years in Capitol riot case... his daughter calls for ""life in prison"" for Donald Trump https://t.co/01pw2uBsP8",1554204595651596295,MacFarlaneNews,20280088,620611977
I honestly never had a Choco Taco. Were they worth it?,1554202452039270401,FeralCherylZ,2654802672,620611977
This day is going way too fast,1554201153927352322,beckiandchris,365771752,620611977
Why does hose water on a hot day smell so good,1554193844555501569,JessicaLBurbank,923211867799072768,620611977
"My 13-year-old nephew -- who I taught how to say “Yankees” when he was tiny -- told me recently he’s now a Mariners fan. I am not ok.

Felt like I got stabbed thru the heart😭",1554183296623341569,GinaMuscato,278636534,620611977
It's wild to think that you'd go from this to this in just 10 years time. https://t.co/Dn9GeS0myn,1554182366532227072,scottjohnson,761290,620611977
when the person who loves planning everything down to the last detail meets the person who loves just showing up and having everything planned for them?? sheer social heroin,1554169878902444035,Chelsea_Fagan,263948521,620611977
"Happy Birthday, Jason. Love and respect always. https://t.co/WvUouVIk6I",1554161175335690240,LennyKravitz,23006794,620611977
turning into the mustard guy https://t.co/bawcF7MTjJ,1554154357150560258,biboofficial,2765849243,620611977
"Scott Effross trade: 👍 or 👎? 

I’m not familiar, but seems like a good pickup based on what I’ve heard! 👍 #yankees",1554150765131747328,GinaMuscato,278636534,620611977
These guys went off in July. 💪 https://t.co/Sb60NLfu3U,1554145810643931137,MLB,18479513,620611977
"BREAKING:

Yankees are acquiring righty reliever Scott Effross from the Cubs.",1554145340898660359,NYYSandy,1521997869221244928,620611977
Why do the companies that use this type of packaging hate their customers so much? https://t.co/3vwUJvzrAJ,1554139215847383046,JenFarleyDC,64441184,620611977
https://t.co/KbpxPP7itS,1554135253563981830,majorityfm,208361818,620611977
someone has drawn attention to the fact that we're even wearing the same watch!! my grandmother did not leave us her best jewelry for this!!!,1554112228827299840,Chelsea_Fagan,263948521,620611977
@BriannaWu thank you!!,1554112048790994944,Chelsea_Fagan,263948521,620611977
@Chelsea_Fagan You look gorgeous!,1554111459197698048,BriannaWu,17264476,620611977
"got new professional headshots and only just now realized that with the pink shirt, white jeans, and dark belt, it's giving 'had to do it to em' https://t.co/WxHPcjOcIx",1554110069347868672,Chelsea_Fagan,263948521,620611977
This comment on one of my Reddit posts is driving me crazy for some reason. https://t.co/zwGZb5KWi3,1554105882589335552,scottjohnson,761290,620611977
"Good morning y’all, and Aloha from Hawaii.",1554095131594067969,levarburton,18396070,620611977
Gimme all the coffee ☕️☕️☕️,1554071682700247050,jdun1031,843633216527523840,620611977
