full_text,tweet_id,screen_name,user_ID
I get to watch something amazing in real time. My friend just asked me if I’ve ever heard of this band she just just discovered called Never Shout Never.,1554581565639909388,_othercaleb,1115386842407407616
"@juicysnailjuice trying to get like that. i spend most of the time kinda disgusted with myself, fuck it we ball",1554565524079759360,_othercaleb,1115386842407407616
i need a joint and like 16 shots of patron,1554565152758009857,_othercaleb,1115386842407407616
y’all fw jorts?,1554564713366839298,_othercaleb,1115386842407407616
what is it like to like yourself or like even tolerate who you are does anybody have any insight,1554564508399669250,_othercaleb,1115386842407407616
https://t.co/JZdZFu4cKa,1554563651612319746,_othercaleb,1115386842407407616
the thought of wrapping my car around a telephone pole https://t.co/Eq9zkvsR8i,1554563338364911619,_othercaleb,1115386842407407616
"it’s me, i’m the funny friend https://t.co/OKQDhyQDgA",1554520949084536832,_othercaleb,1115386842407407616
the end of the fucking world https://t.co/8mpTnIxluz,1554473385308069889,_othercaleb,1115386842407407616
bangs to this day https://t.co/BrQob1lMTq,1554471161588744197,_othercaleb,1115386842407407616
good morning https://t.co/9ZJrL8OiFN,1554448122285379586,_othercaleb,1115386842407407616
I’m not sorry for the person I’ll become when blink-182 announces literally anything with Tom Delonge,1554430960036454400,_othercaleb,1115386842407407616
look if u can’t take me at my sally u don’t deserve me at my noho hank,1554364452212019201,_othercaleb,1115386842407407616
a Seinfeld fan could easily overpower an Office fan,1553507515572305920,_othercaleb,1115386842407407616
missing this show’s insanity https://t.co/bqsUlFHjeV,1553107094739591169,_othercaleb,1115386842407407616
@woodyallenhater also mama is a close second i believe,1552903731037061126,_othercaleb,1115386842407407616
@woodyallenhater i think my favorite is sleep,1552903455412568064,_othercaleb,1115386842407407616
@woodyallenhater what is your favorite mcr song oliver,1552903004076081153,_othercaleb,1115386842407407616
i’m so macho man randy savage,1552865277901242369,_othercaleb,1115386842407407616
@juicysnailjuice https://t.co/BKFEkQsXQ7,1552852146214813696,_othercaleb,1115386842407407616
Italy HC 🤝🏻 New York HC. 🇮🇹🇮🇹🇮🇹 https://t.co/CPdecj8msR,1552473348650795009,_othercaleb,1115386842407407616
OH FUCK https://t.co/xg0wOdz5hY,1552323855510867968,_othercaleb,1115386842407407616
pov: im showing you knocked loose https://t.co/Q8zsPFVTLL,1552320512780603392,_othercaleb,1115386842407407616
@brendan905 valid actually,1552194159703998465,_othercaleb,1115386842407407616
@deadgrrls wendigoon my king,1552125398837862401,_othercaleb,1115386842407407616
"all i care about is my family, friends, my girlfriend, and kitties",1552063825532162048,_othercaleb,1115386842407407616
"7 weeks after bringing Kuma home, I took these photos thinking that they would be the last I’d ever take of him. I’ve never posted these because they break my heart to look at. https://t.co/kTkrybWHkN",1552061881312915456,_othercaleb,1115386842407407616
literally has no clue he became a fucking celebrity today https://t.co/ixjKaXqmhc,1552061863000625152,_othercaleb,1115386842407407616
@basedbeansuser @idososfzdmerda https://t.co/cQOoQvjnIt,1551654032179093506,_othercaleb,1115386842407407616
Wait for it.. 😊 https://t.co/EYBC0RwMB3,1551304265267912706,_othercaleb,1115386842407407616
Gumby and his band perform “A Gentleman Caller” by Cursive https://t.co/uweQ6SipcI,1551286228917559300,_othercaleb,1115386842407407616
This bellwether of an album turns 21 today. (7/24/01) https://t.co/Anq8MyIRSg,1551274974991753216,_othercaleb,1115386842407407616
this thread man… https://t.co/VGMViAUqKJ,1550939899305594880,_othercaleb,1115386842407407616
I can't wait to get married and not invite ppl who thought they were coming,1550938078843486209,_othercaleb,1115386842407407616
oliver why did you like this do you hate me? https://t.co/iYE7d4BFqJ,1550571215466766336,_othercaleb,1115386842407407616
played golf for the first time today and jenna’s stepdad told me I had a nice swing I’m in,1550550772437458946,_othercaleb,1115386842407407616
Nope was…. meh,1550529826561351680,_othercaleb,1115386842407407616
@juicysnailjuice @k8h4nk1ns https://t.co/8lP1K1Q6O6,1550143760926998528,_othercaleb,1115386842407407616
i’m fuckin flying rn dude,1549515404703399938,_othercaleb,1115386842407407616
I SEE MY FUCKING GIRLFRIEND TODAY,1549382099479760896,_othercaleb,1115386842407407616
rip lil edie ik kittie heaven is bumpin’ rn,1549200862307835904,_othercaleb,1115386842407407616
breaking news: nft bros do not understand how currency works https://t.co/lMpZA9qIoY,1549198838715531266,_othercaleb,1115386842407407616
whoever hit my cat and drove off I hope you rot in hell and angry lil demons fuck your eye holes for all eternity. scum bag,1549197440447823873,_othercaleb,1115386842407407616
@woodyallenhater this is directed at you https://t.co/VnLPv2p4Xj,1548883919751331842,_othercaleb,1115386842407407616
i really wanna see bullet train,1548883173580410880,_othercaleb,1115386842407407616
When My vape died at the bar last night I tried to grab a poIice officers gun,1548880215325265920,_othercaleb,1115386842407407616
https://t.co/wX8M3Tsm1M,1548832350943039489,_othercaleb,1115386842407407616
turnstile tiny desk concert for the little dopamine bumps,1548740039324180480,_othercaleb,1115386842407407616
"twitterers friends and folks, send me music to listen to",1548710301742284801,_othercaleb,1115386842407407616
MY GOAT https://t.co/6JfRKH96UX,1548708111434878976,_othercaleb,1115386842407407616
stop putting fall out boy on emo playlists https://t.co/diuW2LlmR4,1548705063102779392,_othercaleb,1115386842407407616
putting my whole paramussy into ALL I WANTED WAS YOOOOUUUUAHHHHH,1548700078432522240,_othercaleb,1115386842407407616
i see my girlfriend in 2 days and that’s super neato,1548698218615259141,_othercaleb,1115386842407407616
36 oz of coffee in an hour,1548698003304841216,_othercaleb,1115386842407407616
Jupiter is now my favorite planet. Earth can kick rocks in hell. https://t.co/lXfRYUWfKr,1548469528010469377,_othercaleb,1115386842407407616
https://t.co/GjbSuAtVjr,1548176561743880193,_othercaleb,1115386842407407616
everybody’s doing the whole elitist thing by making fun of kourtney kardashian for wearing a battle jacket with punk bands and stuff on it SHES MARRIED TO TRAVIS BARKER STFU PLEASE STOP IT IT DOESNT MATTER ANYWAY,1548103447538388993,_othercaleb,1115386842407407616
"how the fuck some of yaII be finding
a new Iove of your life every 3
months",1548095602130530305,_othercaleb,1115386842407407616
it’s hard being the only sexy person in your area,1548094871625289730,_othercaleb,1115386842407407616
"Smoked a bong killed a cat, had my nuts attacked by rats",1546809020278775808,_othercaleb,1115386842407407616
@woodyallenhater big fan of juno,1546723125123055616,_othercaleb,1115386842407407616
we do https://t.co/I1Jq4iAIYa,1546597792239570956,_othercaleb,1115386842407407616
"mark hoppus, i love you &lt;3 https://t.co/CJm1ZWFmhW",1546399925797355527,_othercaleb,1115386842407407616
people who eat loud as fuck need to be locked away,1546320655670542336,_othercaleb,1115386842407407616
@woodyallenhater oh my dear oliver you will soon be sick of it,1546301953185030145,_othercaleb,1115386842407407616
knee tattoo this week?,1546301336920137728,_othercaleb,1115386842407407616
new music coming october or sooner 🫶,1546300559497564160,_othercaleb,1115386842407407616
"The cat is out of the bag. @RATMofficial invited me to shoot their first show back after 11 years. This completes my ~30 year character arc/I've beat the final boss/etc. 

Dreams come true if you chip away at them. https://t.co/qdhlvMJjG5",1546288412663103488,_othercaleb,1115386842407407616
@woodyallenhater https://t.co/v20i68ryo4,1546288360012107777,_othercaleb,1115386842407407616
@woodyallenhater get out,1546287393912885251,_othercaleb,1115386842407407616
congrats if ur built for open relationships because personally i would kill myself,1546285562310565893,_othercaleb,1115386842407407616
you can recognize men’s struggles while also understanding your inherent privilege fellas it’s not that hard to do,1546163915058470912,_othercaleb,1115386842407407616
despising this tweet 🤝 despising the misogynistic comments https://t.co/vf0K3CBapW,1546163667129040897,_othercaleb,1115386842407407616
I feel like myself when I’m running my head to the ground,1546074079907782658,_othercaleb,1115386842407407616
astrology friends what is the general consensus on capricorns,1545910456434450433,_othercaleb,1115386842407407616
15 year old caleb was bonkers https://t.co/Ocx4MDRKG3,1545909606228033536,_othercaleb,1115386842407407616
"@juicysnailjuice at least 10 years, around a year ago he just kinda stopped showing up",1545908173609091073,_othercaleb,1115386842407407616
"@woodyallenhater i take a flight at least once a week, yk i got it like that. yk me yk how i live",1545907925188739083,_othercaleb,1115386842407407616
"@juicysnailjuice never talked to him, he would just chill in the hallway sometimes. never felt threatened or anything",1545907763678699520,_othercaleb,1115386842407407616
flying alone for the first time in 10 days and very anxious abt it,1545907495561986049,_othercaleb,1115386842407407616
neck deep put their whole pop punkussy into in bloom idc if it’s their most popular song that shit bangs and will forever bang it’s perfect,1545905290591309825,_othercaleb,1115386842407407616
take me back to warped tour,1545903763294232577,_othercaleb,1115386842407407616
"@juicysnailjuice he was super tall, top hat, super chill",1545903316659478529,_othercaleb,1115386842407407616
@juicysnailjuice used to have an abe lincoln mf chilling in my grandma’s hallway,1545903226519683072,_othercaleb,1115386842407407616
@woodyallenhater you’re so real,1545902910227218433,_othercaleb,1115386842407407616
@woodyallenhater and cheatercheaterbestfriendeater,1545902736037842946,_othercaleb,1115386842407407616
@woodyallenhater OLIVER YOURE SO AWESOME,1545902474279751681,_othercaleb,1115386842407407616
@woodyallenhater IM LISTENING TO TROUBLE AND IT MADE ME REALIZE THAT IT NEVER GOES AWAY,1545902153742573568,_othercaleb,1115386842407407616
@woodyallenhater YOU GET IT OH GOD YOU GET IT,1545901861617782789,_othercaleb,1115386842407407616
@woodyallenhater YES OLIVER THANK GOD,1545901799852359683,_othercaleb,1115386842407407616
anybody else here have a never shout never phase?,1545901684156768256,_othercaleb,1115386842407407616
i’m gonna get a polaroid for school and take pictures of all the lovely people in my life and keep the pictures forever because it feels needed,1545895475861143552,_othercaleb,1115386842407407616
i need a skate part with only fleetwood mac as the soundtrack,1545894373757427712,_othercaleb,1115386842407407616
GOD HAVE MERCY ON MY PEOPLE https://t.co/yijDQb7bHB,1545892357559795715,_othercaleb,1115386842407407616
since y’all are so into playlists rn https://t.co/IypHpLCrjD,1545892009566666752,_othercaleb,1115386842407407616
@juicysnailjuice @TorseyK link in bio 🤪,1545881899884847110,_othercaleb,1115386842407407616
i feel comfortable in my own skin for the first time in my life. i’m actually living just thought i’d share,1545877143200071681,_othercaleb,1115386842407407616
"nicotine, skate parts, pop punk, online shopping, miller high life, writing 🧘‍♂️ comfort",1545876946319560708,_othercaleb,1115386842407407616
https://t.co/vRTGrUzUGZ,1545641735136624642,_othercaleb,1115386842407407616
generic pop punk bangs,1545581271778267137,_othercaleb,1115386842407407616
