full_text,tweet_id,screen_name,user_ID
Celtics Trade Buzz Mounts Amid Latest Kevin Durant Twist https://t.co/9Y00yZ770r,1554608945796456448,salmabe71077836,1169447187941666816
Remains found in Clear Creek County identified as missing woman https://t.co/2lEF39aeJO,1554607718375346178,salmabe71077836,1169447187941666816
Meghan Markle’s Father Faces Restraining Order After Disturbing Allegations https://t.co/jE8WPuHqSy,1554604975388508160,salmabe71077836,1169447187941666816
Comanchero bikie boss Mark Buddle taken into police custody after extradition to Australia https://t.co/OzrUqo1iXs,1554601459202899974,salmabe71077836,1169447187941666816
Falcons Lose Veteran DT to Season-Ending Injury https://t.co/jWn27fks4R,1554600497553743874,salmabe71077836,1169447187941666816
The Untold Truth Of Hunter Biden https://t.co/4dXDdH2fFO,1554593614159806465,salmabe71077836,1169447187941666816
Doc Rivers Responds to Sixers Tampering Allegations https://t.co/dv3iDnFlAZ,1554592677739597828,salmabe71077836,1169447187941666816
Growing numbers of consumers turn back on major supermarket chains https://t.co/yjT61D6FAA,1554588284516552710,salmabe71077836,1169447187941666816
Patriots Sign DB Jalen Elliott https://t.co/IYV6HKatAT,1554583182409883648,salmabe71077836,1169447187941666816
"Famous People Born Today, August 3 https://t.co/SnJ6XHnZ14",1554582030813483008,salmabe71077836,1169447187941666816
"Eating ultra-processed foods could be associated with cognitive decline, study suggests https://t.co/kTIMyWcCNe",1554578602557116416,salmabe71077836,1169447187941666816
Arsenal All or Nothing: Mikel Arteta and Co get a first glimpse of new series at red carpet event https://t.co/O6O9MHhDKN,1554575766737879045,salmabe71077836,1169447187941666816
VPR Star Is Safe After Accident Leaves Her Trapped https://t.co/cBMMy19Z3N,1554575401632014340,salmabe71077836,1169447187941666816
"Will Sarah Paulson Return to ‘American Horror Story,’ ‘Crime Story’? https://t.co/vaME0Zt9xM",1554572673749057536,salmabe71077836,1169447187941666816
"Steelers Could Sign ‘Electrifying Returner,’ Says Insider https://t.co/JTje4Yx0da",1554567433163350016,salmabe71077836,1169447187941666816
Phil Foden set to sign new long-term contract at Manchester City until 2028 https://t.co/yJloADQieK,1554564220078915586,salmabe71077836,1169447187941666816
Warriors Steve Kerr Sends Message to Rest of League https://t.co/wq5Cf4aKeL,1554559639399825409,salmabe71077836,1169447187941666816
"70-year-old woman brutally beaten, kicked in head by 4 attackers in San Francisco housing complex https://t.co/16PGpDJ2wd",1554552696996212736,salmabe71077836,1169447187941666816
Hendrick Motorsports Shares Reason for Kyle Larson Crash https://t.co/TWRgr5Dafl,1554551710680596482,salmabe71077836,1169447187941666816
Josh Hawley asks FTC to probe Amazon One Medical deal https://t.co/uydRCGFJgG,1554549987043938309,salmabe71077836,1169447187941666816
Grieving father erupts at Parkland school shooter’s trial https://t.co/Dr6VmfnZUq,1554547185559261185,salmabe71077836,1169447187941666816
Rams’ Bobby Wagner Fires Off Warning To Russell Wilson https://t.co/24rneork8z,1554543584984064000,salmabe71077836,1169447187941666816
"On Seeking “Justice”, Uncle Shivpal Yadav’s Jibe At Akhilesh Yadav https://t.co/htrcBwA4PV",1554538983958487041,salmabe71077836,1169447187941666816
A fresh development in the bullying incident involving Kim Garam https://t.co/MJDEnhdSSU,1554536247837827074,salmabe71077836,1169447187941666816
Nets Linked to Adding ‘Best Fit’ Dwight Howard in Offseason Deal https://t.co/gjZtyocBvp,1554535672765202433,salmabe71077836,1169447187941666816
‘RHOBH’ Star Sheree Zampino on Why Kyle Needs to “Sit Down” https://t.co/z0nG0wquKY,1554533521233936384,salmabe71077836,1169447187941666816
"Colts Sign Center Alec Mollete, Place Two Players on IR https://t.co/2njEOIRftA",1554527992860254212,salmabe71077836,1169447187941666816
Biden’s doctor says he now has a ‘loose cough’ but insists he is ‘feeling fine’ https://t.co/fW1IWlk2le,1554527668959428611,salmabe71077836,1169447187941666816
Amit Shah To Bengal BJP Leader: “Citizenship Amendment Act After…” https://t.co/N1E9r9AuyH,1554525027306971136,salmabe71077836,1169447187941666816
Who Is She? Drama Karen Amanda Marie Keshner of Home Depot https://t.co/gELw2MDmcL,1554521306476994560,salmabe71077836,1169447187941666816
Cowboys Urged to Sign Former All-Pro Veteran Immediately https://t.co/oIjhbwCrKz,1554520136979185665,salmabe71077836,1169447187941666816
Lenny is Trying to “Financially Strangle” Me https://t.co/EKtqOw5m5u,1554518551805018112,salmabe71077836,1169447187941666816
US prosecutors target Michael Avenatti’s $4.5 milllion jet for civil forfeiture https://t.co/gLM2Ifp4VA,1554512921803345921,salmabe71077836,1169447187941666816
Malcolm Rodriguez Wowing Lions With Early Camp Work https://t.co/D5c6IWDlZN,1554512114550800384,salmabe71077836,1169447187941666816
Africa lays out goals ahead of UN climate summit https://t.co/9Jm1cOZa6Z,1554506887319748608,salmabe71077836,1169447187941666816
What Happens If You Freeze Bubbles? https://t.co/TfthlIbbQj,1554504219046170626,salmabe71077836,1169447187941666816
Bucs’ Tristan Wirfs Carted Off at Practice https://t.co/RhiAHPls3b,1554503693898317826,salmabe71077836,1169447187941666816
Horrifying video shows 70-year-old Asian woman beaten and stomped in her apartment https://t.co/Nt0skQSykF,1554500770518777857,salmabe71077836,1169447187941666816
A mix historic charm and modern comforts at the Coppersmith Inn Bed and Breakfast. https://t.co/9sXbeCeZzA,1554498128484700166,salmabe71077836,1169447187941666816
"Miami Heat Linked to 7x All-Star Big Man in Free Agency, per NBA Executive https://t.co/qJf8DdpDoL",1554495431039746050,salmabe71077836,1169447187941666816
"5 Surprising Side Effects of Eating Rice Cakes, Say Dietitians — Eat This Not That https://t.co/URe017FQXI",1554495125518180359,salmabe71077836,1169447187941666816
“Hermes is the only one my eyes are seeing”– Toyin Lawani explains why she wants him to win BBNaija season 7 https://t.co/lLc69xtfGK,1554488690566627331,salmabe71077836,1169447187941666816
‘The Voice’s’ Adam Levine Strips Down on Instagram https://t.co/4zbp6iEI1i,1554487691839930372,salmabe71077836,1169447187941666816
Teenage pro-life activist allegedly punched in the face while knocking on doors in Kansas https://t.co/mg8KuBZleM,1554485896786984961,salmabe71077836,1169447187941666816
I Tried the ‘Thor’ Workout Chris Hemsworth Did To Get Fit for His New Movie — Eat This Not That https://t.co/T4WxiGxBZy,1554483145029959684,salmabe71077836,1169447187941666816
"Stocks fall on Wall Street amid earnings, US-China tensions https://t.co/UVK4CqHdiW",1554480347987017729,salmabe71077836,1169447187941666816
Alim McNeill Using Practice With Frank Ragnow to Improve https://t.co/bFEtkznqs6,1554479773161857025,salmabe71077836,1169447187941666816
"Inside The Story Behind Shambhala, The Spiritual Buddhist Kingdom That Was Never Discovered https://t.co/jTfLmcN5uZ",1554477039167721474,salmabe71077836,1169447187941666816
Patrick Mahomes Provides Update After Injury Scare at Camp https://t.co/JyJVoNVIw3,1554471471770226690,salmabe71077836,1169447187941666816
"Kate Middleton dazzles in £2,260 Alexander McQueen white suit for Commonwealth Games debut https://t.co/LgytHjWPkT",1554470426037960706,salmabe71077836,1169447187941666816
Inside Pope Pius XII’s Decree Against Communism https://t.co/FROuoLU6IT,1554467554931900416,salmabe71077836,1169447187941666816
Frank Grillo On Morgan Freeman And Juliette Binoche In Paradise Highway https://t.co/j1P6RpKFnr,1554464556151357442,salmabe71077836,1169447187941666816
Jared Goff’s Teammate Provides Telling Update on Lions QB https://t.co/gm2JOAqAUF,1554463676505026560,salmabe71077836,1169447187941666816
Cowboys Rumors: Dallas Address Possible Receiver Signing https://t.co/kFW7SV77Pe,1554455745650892800,salmabe71077836,1169447187941666816
The Tragic History Of Anti-Mormonism https://t.co/i8cD86WiL9,1554454434838679552,salmabe71077836,1169447187941666816
Biden announces White House monkeypox response team with 3 states declaring emergencies https://t.co/GKo7NUcqQr,1554451501430542336,salmabe71077836,1169447187941666816
"PICTURED: Soldier, 20, who died while training in heatwave after Army refused to cancel exercise https://t.co/2BAoWpRmZS",1554448239746813953,salmabe71077836,1169447187941666816
Patriots News: Jake Bailey Gets 4-Year Contract Extension https://t.co/V1iXppKRCN,1554447973047799809,salmabe71077836,1169447187941666816
5 Worst Breakfast Habits Slowing Your Metabolism — Eat This Not That https://t.co/oXSbTD4y9Y,1554445284360523783,salmabe71077836,1169447187941666816
"Uber gains momentum in 2nd quarter, investors look past loss https://t.co/GZtutQtfIH",1554441775925846016,salmabe71077836,1169447187941666816
‘Bachelorette’ Suitor Praised for Public Apology to Gabby Windey https://t.co/Aim3xRc7r0,1554439867668512768,salmabe71077836,1169447187941666816
“The man owns and runs a university for goodness sake”-Reno Omokri reacts to Yusuf Datti’s admission of being inactive on social Media https://t.co/5jD4EP8O3B,1554438851355185153,salmabe71077836,1169447187941666816
"McDonald’s breakfast fine: Passenger from Bali to Australia fined $1,874 after 2 undeclared McMuffins found in luggage https://t.co/XBV3kUwjPo",1554436112927662085,salmabe71077836,1169447187941666816
Rand Paul vows to get answers on COVID-19 origins in gain-of-function hearing https://t.co/W8rNfF5Dm6,1554433427436363778,salmabe71077836,1169447187941666816
DWTS Runner-Up Ripped by Former Cast Member’s Daughter https://t.co/Q1SlaOzEsM,1554431648703315970,salmabe71077836,1169447187941666816
"What time will Thirteen Lives air on Prime Video? Release date, plot and more details about Viggo Mortensen’s survival film https://t.co/h8OwHE4dy3",1554429507385409537,salmabe71077836,1169447187941666816
There Are No Benefits to a Pelosi Visit to Taiwan https://t.co/rEG5x7GLvr,1554426049613762563,salmabe71077836,1169447187941666816
Vanderpump Rules’ Jax Taylor Exlains Why His Son Cruz is Working https://t.co/3sraU16a1f,1554423791438159873,salmabe71077836,1169447187941666816
“Justin left me after I gave him all styles and cooked for him”– Korra Obidi vows not to get married again https://t.co/idSizq2ry8,1554422825032814592,salmabe71077836,1169447187941666816
Biden admin convenes legal experts on protecting women’s reproductive health after Supreme Court ruling https://t.co/0DnY4uvfGk,1554420094507163649,salmabe71077836,1169447187941666816
"Mayor ‘beyond disgusted’, families distraught after graves torn up by ‘scumbags’ doing burnouts https://t.co/6faH1siWkL",1554417221736321025,salmabe71077836,1169447187941666816
John Harbaugh Shades Browns After Deshaun Watson Suspension https://t.co/54lsQaS5aL,1554415667297796098,salmabe71077836,1169447187941666816
Is Marie Harf Pregnant In 2022 or Is It Just Weight Gain? https://t.co/iTkgFzaL8C,1554414418372562944,salmabe71077836,1169447187941666816
“I Will Snatch Groovy From Beauty” – Chomzy Tell Chi Chi https://t.co/fYsSQNyMwQ,1554408511358095362,salmabe71077836,1169447187941666816
"Insider Says Jets, Bears Trade for Teven Jenkins: ‘Makes Sense’ https://t.co/VWj68M2jaP",1554407062725185542,salmabe71077836,1169447187941666816
Veteran burn pit bill headed for another vote in the Senate amid partisan turmoil https://t.co/dquCtGbBk7,1554405614931124224,salmabe71077836,1169447187941666816
Auckland rates: ‘Just shocked’ – dramatic increases start landing in inboxes https://t.co/Zn0WODqrHJ,1554402819742081024,salmabe71077836,1169447187941666816
Is Shemar Moore Married To Shawna Gordon? Wife And Net Worth 2022: https://t.co/dcnC6mTx3A,1554399932311916544,salmabe71077836,1169447187941666816
Brian Scalabrine Drops Truth Bomb on Marcus Smart https://t.co/SLdLdHMagd,1554399245284827137,salmabe71077836,1169447187941666816
BP earnings triple as energy firm profits from rising prices https://t.co/9yOeR736Lv,1554395876700848129,salmabe71077836,1169447187941666816
Cute Abiola storms studio on behalf of Portable FC as fans of Wizkid FC &amp; 30BG clash over Carter Efe’s Machala song [Video] https://t.co/1xYhaCKMwQ,1554393052604768257,salmabe71077836,1169447187941666816
Durant’s Friend Mike James Snubs Warriors Steph Curry https://t.co/EFSrSPRCX0,1554390663667634176,salmabe71077836,1169447187941666816
"Bipartisan group of senators introduces bill for federal protection of abortion rights, contraception access https://t.co/oHX0ExdWNi",1554390074737004544,salmabe71077836,1169447187941666816
"Scottish government ‘demanded mentions of Brexit, Elizabeth II be removed from Jubilee book’  https://t.co/vH5bloaNwW",1554387412540956673,salmabe71077836,1169447187941666816
The Flash fans get emotional as series ends with season 9 https://t.co/Iy99MBPgtj,1554384505544224768,salmabe71077836,1169447187941666816
"Celtics Face Big Jayson Tatum Concerns in Potential Kevin Durant Trade, Says Insider https://t.co/2BEEyZ3s6g",1554382495281561601,salmabe71077836,1169447187941666816
Three Britons accused of being mercenaries in Ukraine will stand trial in Russia-backed court https://t.co/GIKfNeNKVZ,1554381722422214656,salmabe71077836,1169447187941666816
Who Is Nichelle Nichols’ Son: Kyle Johnson? Here’s What We Know About￼ https://t.co/X3kZhur2HW,1554378941061890049,salmabe71077836,1169447187941666816
Proof That Tom Hardy Is A Feminist https://t.co/VgiFGx4mhX,1554376328157315079,salmabe71077836,1169447187941666816
"Potential Cowboys Starter to Undergo Surgery, Injury Timetable Revealed https://t.co/GHw6BLwI0M",1554374570869751808,salmabe71077836,1169447187941666816
Simu Liu &amp; Girlfriend Jade Bender Join Tons of Other Stars at ‘Bullet Train’ Premiere in L.A. https://t.co/NESev1jmNx,1554373338310508547,salmabe71077836,1169447187941666816
Doctor Who: What Bernard Cribbins’ Wilfred Mott Meant to the Show and Fans https://t.co/CBFdCTVJaU,1554370663250628608,salmabe71077836,1169447187941666816
Beyoncé to remove offensive word from new song https://t.co/6OTqsrROdd,1554367973602869248,salmabe71077836,1169447187941666816
Packers Trade Proposal Sends Promising LB to AFC Rebuilder https://t.co/Ns6qQ1beJm,1554366435874447360,salmabe71077836,1169447187941666816
"“For What You Did to Her Mother, This Girl Will Show You Pepper” – Yul Edochie Comes under Fire after Boasting about His Daughter’s Beauty https://t.co/fkxiVPdz6K",1554364617660432384,salmabe71077836,1169447187941666816
How to cook eggs in the microwave: Home cook shares ‘stove-free’ hack https://t.co/mncaVsXlTe,1554361953748910080,salmabe71077836,1169447187941666816
Grenade Attack On Police Post In Jammu And Kashmir’s Ramban https://t.co/kjBwBPGemp,1554359081137209344,salmabe71077836,1169447187941666816
Bulls Rookie Justin Lewis ‘Not Ready’ For Major Role https://t.co/T4rAUkc6My,1554358244709203968,salmabe71077836,1169447187941666816
Who Are Daryll Neita Parents? Ethnicity and Nationality Exposed https://t.co/F38rI9DqQo,1554355860779974656,salmabe71077836,1169447187941666816
"Pelosi arrives in Malaysia, tensions rise over Taiwan visit https://t.co/lP4j9i57Wp",1554353104379854850,salmabe71077836,1169447187941666816
