full_text,tweet_id,screen_name,user_ID
"Empathy in UX is essential. It is a bridge into our user’s minds and our greatest asset as UX  professionals. 

#uiuxdesign https://t.co/Xir0HCZAc9",1554519915788386306,finchUIUX,1305808467584667648
"Here are 7 tips to keep your website ahead &amp;
increase the traffic in this competition 🤩 

#uxdesign https://t.co/5o2XhO01qy",1554150145364840448,finchUIUX,1305808467584667648
"Fun post on how we designers are happy to use bold fonts more than italic fonts 😁 

#designs #fun https://t.co/Fo7USiDRQY",1553817788254502912,finchUIUX,1305808467584667648
"Though we have experienced very few such clients, sometimes they come up with a request to put comic san font 😁 

#ux #designer https://t.co/Ad5CJatHoJ",1553447843008057349,finchUIUX,1305808467584667648
👀Cheatsheet for font sizes while working 👨‍💻 👉🏻figma https://t.co/EhO1AiMO8y,1553070434211471361,finchUIUX,1305808467584667648
"👉Few Web design tips💡 for how to maintain an outstanding site💎

#uxdesign https://t.co/p5I1YkpNns",1552700636600352771,finchUIUX,1305808467584667648
6 Websites for Free 3d Icons. https://t.co/FrcLnAbxHL,1552330488458739712,finchUIUX,1305808467584667648
Critical features of prototyping and how it is helpful in the designing process https://t.co/PUiQph9nKn,1551960716294455296,finchUIUX,1305808467584667648
Monday Motivational message to boost you all to start the day :) https://t.co/yrnJ3dziju,1551613316891566081,finchUIUX,1305808467584667648
Quote by famous designer - Paul rand https://t.co/3Xx23nDuuv,1551266004944261121,finchUIUX,1305808467584667648
"We are self-learner designers, still learning each day.
What about you? 

#uxdesign #designers #Inspiration #uxui #Webdesigner #designinspiration #startups https://t.co/qA4o7zPIvh",1550873464910774273,finchUIUX,1305808467584667648
"Been there and felt it many times when a new client is not clear about what they want in their design and want all elements to work together :)

#app #ui #ux #uxdesign #uidesign #website #application #design #webdesigner #uxui #websitedesign #dribbble #fundesign #artist https://t.co/51zsMTJCfd",1550717355096940544,finchUIUX,1305808467584667648
"Buzzlet - The right talking tablet for your child. by FinchUX 

https://t.co/hHemU3sENm",1550060829202010113,finchUIUX,1305808467584667648
"We believe in giving quality work consistently.
Have you come across such clients who ask for
designing work cheaper?

#uxdesign #uxui #designers #webdesign https://t.co/uK3suoYMSt",1549786293453963265,finchUIUX,1305808467584667648
"Few tips to improve your UI/UX mobile app design. we at FinchUX try to give 
our best for client's apps 

#app #ui #ux #uxdesign #uidesign #website #application #userexperience #userinterface  #designers https://t.co/UFlpesCZaS",1549416383255121920,finchUIUX,1305808467584667648
"All that we can think about as a designer :) 

#ux #uxdesign #uxui #designers #webdesigner #startup https://t.co/KNLXXlJuqf",1549091750475468800,finchUIUX,1305808467584667648
Any given day of designers always working on deadlines. What do you think? https://t.co/jEu2h5PCsr,1548804923688730627,finchUIUX,1305808467584667648
"The cycle of design is simple: observe, conceptualize, create, and refine.",1548472706324017152,finchUIUX,1305808467584667648
"Designing is like putting together a puzzle. The more pieces you have, the easier it is to solve.",1548427274508070913,finchUIUX,1305808467584667648
"Designers always stay unique in all aspects of their life

#app #ui #ux #uxdesign #uidesign #website #application #userexperience #fun #designers https://t.co/xzu99b8siY",1548397102975164416,finchUIUX,1305808467584667648
"Designing is a process, and every step matters. #finchux",1548382033327505415,finchUIUX,1305808467584667648
Designing is the act of putting your ideas into reality.,1548336729752449029,finchUIUX,1305808467584667648
The best designers are the ones who never quit. #design,1548110171179585542,finchUIUX,1305808467584667648
The difference between designing and creating a design is that a good design results from hard work.,1548064867524890625,finchUIUX,1305808467584667648
"Good  UX is imp for any business. UX IS THE PROCESS DESIGN TEAMS USE TO CREATE PRODUCTS THAT PROVIDE MEANINGFUL AND RELEVANT EXPERIENCE TO USERS

#app #ui #ux #uxdesign #uidesign #website #application #design #webdesigner #uxui https://t.co/8wX6LKvkOG",1548019887473246209,finchUIUX,1305808467584667648
Design is a funny word. Some see art. Others see function. We see both.,1548019569201057792,finchUIUX,1305808467584667648
Designing is the silent killer of time.,1547974281979539456,finchUIUX,1305808467584667648
"Looking for UX/UI Designer. Did you know you might be spending  $1,25,000 a year?

Worried ???
We got you covered our designing services start from $499/month.
Check our link in bio or  DM us 

#ui #ux #uxdesign #design #webdesigner #uxui #startups #startupus #startupbusiness https://t.co/PqbRpwMpRx",1547667258490572800,finchUIUX,1305808467584667648
"Design is part science, part magic, and all art.",1547657231629398024,finchUIUX,1305808467584667648
Design is the art of finding the solution to a problem.,1547611928788275201,finchUIUX,1305808467584667648
There is no greater calling than that of design.,1547385418735394817,finchUIUX,1305808467584667648
The greatest joy in life is doing what people say you cannot do.,1547340163554152448,finchUIUX,1305808467584667648
The best designs are created when you are passionate about creating them.,1547294988781981697,finchUIUX,1305808467584667648
"Design is where Science and art break even.

#uxdesign #uxdesigner #uxigers #uxu #uxdesignmastery #uxui #uxdesigners #uxd #uxdesigning  #UxHR #designers #webdesign #art #sciencetwitter https://t.co/z4GTTOZ1fw",1547264667671830529,finchUIUX,1305808467584667648
"Don't be scared of failure. Try, fail, try again, fail better. #finchux",1547249936932241408,finchUIUX,1305808467584667648
"Design is everywhere you look, you just have to learn how to see it.",1547023103351558145,finchUIUX,1305808467584667648
Design is important- but it shouldn't just be for design's sake. It should improve your life in some way.,1546977723674988545,finchUIUX,1305808467584667648
The best designs are invisible,1546932522436726786,finchUIUX,1305808467584667648
"8 Social media tools that are commonly used by every content creator.Official accounts of these tools 

@canva, @prezicom , @grammarly                
@crello , @typeform , @capcutapp
@hashtagifyapp
#app #ui #ux #uxdesign #uidesign #website #application #userexperience #figma https://t.co/N1RlQ0bUbl",1546917389173923842,finchUIUX,1305808467584667648
You can't design your way out of a problem unless you face the problem.,1546887429650616320,finchUIUX,1305808467584667648
"Literally, we Designers don't qualify for all people 😁

#app #ui #ux #uxdesign #uidesign #website #application #userexperience #userinterface  #design #webdesigner #uxui #websitedesign  #dribbble #ios #android #art #artist #apple #iosdevloper https://t.co/OldYNaCiTo",1546555115724853248,finchUIUX,1305808467584667648
Design is the space between the lines.,1546524825144918017,finchUIUX,1305808467584667648
"Quote by famous designer paul rand 

#app #ui #ux #uxdesign #uidesign #website #application #userexperience #userinterface  #design #webdesigner #uxui #websitedesign  #dribbble #uxinspiration #fundesign #uiinspiration #ios #android #art #artist #apple #designer https://t.co/QYdPI7r830",1546305784954474496,finchUIUX,1305808467584667648
"Design is a response to necessity. It must be useful, first of all. – Charles Eames",1546162389007081473,finchUIUX,1305808467584667648
"Usability testing is an essential and valuable step in ensuring a successful launch of a new website or feature!

#app #ui #ux #uxdesign #uidesign #website #application #userexperience #userinterface #design #uxui  #dribbble #uxinspiration #fundesign #uiinspiration #ios #designer https://t.co/GC6XQdx0dm",1545937107507625984,finchUIUX,1305808467584667648
"Design is the blueprint to success, and success is the blueprint to happiness.",1545935870171254786,finchUIUX,1305808467584667648
Make the first move and design the rest of your life.,1545890647676264450,finchUIUX,1305808467584667648
The most powerful way to express yourself is through design. #finchux,1545845240694808580,finchUIUX,1305808467584667648
"Many types of buildings, but only one thing they all have in common- design",1545800118225539078,finchUIUX,1305808467584667648
The best designs come from a team that knows its users the best.,1545573605488091137,finchUIUX,1305808467584667648
"Great UI is like a great joke, you have to be willing to break some rules to get the laugh. #uxdesign",1545528152323129344,finchUIUX,1305808467584667648
Design is more than just about the pixels. It's about the people it affects.,1545483197982642176,finchUIUX,1305808467584667648
"We don't design user interfaces, We design better user experiences.",1545437555407167498,finchUIUX,1305808467584667648
"Some of the most used Figma plugins of 2022 
which one are you using most?

#app #ui #ux #uxdesign #uidesign #website #application #userexperience #userinterface  #design #webdesigner #uxui #dribbble #uxinspiration #fundesign #uiinspiration #ios #android #art #artist #figma https://t.co/5XhHp1mY6J",1545430075780243457,finchUIUX,1305808467584667648
The difference between UX and UI is like the difference between fine art and graffiti. #finchux,1545211201155743745,finchUIUX,1305808467584667648
"Always be yourself, unless you can be a unicorn. Then always be a unicorn.",1545165874218278918,finchUIUX,1305808467584667648
The first step in any design process is understanding your audience.,1545120633226498049,finchUIUX,1305808467584667648
"Readability refers to how easy it is to read and understand a text, depending on its unique features. a good example is  given here of the readability test

#app #ui #ux #uxdesign #uidesign #website  #userexperience #userinterface  #design #webdesigner #uxui #dribbble https://t.co/f2J6nJWHaB",1545097946009669633,finchUIUX,1305808467584667648
Good design makes life better.,1545075205420339201,finchUIUX,1305808467584667648
"We don't just design websites and apps, we create meaningful user experiences.",1544848675247112194,finchUIUX,1305808467584667648
"Creativity is a gift, which must be given to the world.",1544803400663142401,finchUIUX,1305808467584667648
We design the way you design your business.,1544758144030867456,finchUIUX,1305808467584667648
"Usability testing is an essential and valuable step in ensuring a successful launch of a new website or feature!

#uxdesigner  #uidesigner #webdesign 
#uiux #userexperience #design  
#dribbble #appdesign #uitrends #uxui #designer #interface 
#dailyui #graphicdesign https://t.co/msRzEpWi7c",1544743097996828672,finchUIUX,1305808467584667648
The elegant design is the outcome of a graceful problem-solving process.,1544712930394079240,finchUIUX,1305808467584667648
Good design leads to greater revenues for websites #uxdesign,1544486384307691520,finchUIUX,1305808467584667648
You will never succeed if you never attempt.,1544440987690336259,finchUIUX,1305808467584667648
The best user experience is one that does not impede your ability to use the product.,1544395770513727489,finchUIUX,1305808467584667648
"Can’t argue on this :) what do you think? 

#app #ui #ux #uxdesign #uidesign #website #application #userexperience #userinterface  #design #uxui #websitedesign  #dribbble #uxinspiration #fundesign #uiinspiration #ios #android #art #artist https://t.co/omuYawlgxa",1544350608634875904,finchUIUX,1305808467584667648
"A UX designer is like an architect, except they design information.",1544350570655502337,finchUIUX,1305808467584667648
"We all have a vision of the perfect world, but the real problem is in the details.",1544123963919433730,finchUIUX,1305808467584667648
Design is the art of making change possible.,1544078599338315778,finchUIUX,1305808467584667648
"Good designers don't design like they see, they design like they think.",1544033370899992576,finchUIUX,1305808467584667648
"Monday Motivation by steve jobs - let’s go invent tomorrow
instead of worrying about what happened yesterday 
#app #ui #ux #uxdesign #uidesign  #application #userexperience  #design #webdesigner #uxui #websitedesign  #dribbble #uxinspiration # #uiinspiration #ios #android https://t.co/J1LxVkWmAp",1544033350771527680,finchUIUX,1305808467584667648
Design is a process that involves deep focus and the integration of ideas. #finchux,1543988428953587714,finchUIUX,1305808467584667648
"Launching a startup can be risky. But, you'll never know until you try. An MVP allows testing your idea with minimum risks.

Kindly comment your views on it 
#startup #contentmarketing #freelancers  #kickstarter #startupstory #startupbusiness #startups #uiux https://t.co/CWag3lxT45",1543776640341360644,finchUIUX,1305808467584667648
A good design is an investment in efficiency.,1543733579594833926,finchUIUX,1305808467584667648
"Good design makes products so intuitive, that it disappears into the background of your life.",1543716225913610240,finchUIUX,1305808467584667648
Designing is the best way to put your own signature on the world.,1543670975442608134,finchUIUX,1305808467584667648
It takes a lot of research and effort to design a product. It takes a lot of guts and perseverance to market a product.,1543625678570020865,finchUIUX,1305808467584667648
Design is the invisible fabric of the universe- #finchux,1543399240818642944,finchUIUX,1305808467584667648
Life is too short to have a boring design. We design to make sure your life is fun.,1543353824320036864,finchUIUX,1305808467584667648
"Some of our fav tools while working around as UX Designer 

Our fav tools official twitter accounts 
@SlackHQ 
@figma 
@Atlassian (forJira &amp; Confluence ) 
@MiroHQ 
@Grammarly

#app #ui #ux #uxdesign #uidesign #userexperience #designers  #webdesign #startups https://t.co/YN9pU4hO1o",1543338822431277056,finchUIUX,1305808467584667648
"""The heart of the business is not economics, but design"" - Ray Eames",1543308684033462274,finchUIUX,1305808467584667648
"If you're thinking about designing something, it's never too early to start.",1543263266280972290,finchUIUX,1305808467584667648
This post was more like the technical or “the metric” part of why your reels go viral #uiuxdesign #instagramtips #instagramgrowthhacks #instagramgrowthexpert #instagramgrowthservice #igstrategy #socialmediamarketingstrategy https://t.co/cNwBIIvjBm,1542918124307361792,finchUIUX,1305808467584667648
Great designs rarely happen from simply sitting down at the desk.,1542900952360951808,finchUIUX,1305808467584667648
"Every day is the first page of the book of your life, don't like how it looks so far? Flip the page.",1542674398481637377,finchUIUX,1305808467584667648
Beauty is in the details- finchux #design,1542629189106520064,finchUIUX,1305808467584667648
The best way to learn is to do.,1542583913758990337,finchUIUX,1305808467584667648
"In UX, we must conduct data research if we want to understand reality.

https://t.co/EkAziPxDaC 

#tipoftheday #finchux #UIUX https://t.co/RHHxBqTQQz",1542571355433881600,finchUIUX,1305808467584667648
"Design is more than just aesthetics. It's about how something looks, feels and behaves.",1542538949570301955,finchUIUX,1305808467584667648
"""Design is a plan for arranging elements in such a way as best to accomplish a particular purpose."" - Paul Rand",1542312076940644354,finchUIUX,1305808467584667648
"Don't worry about mistakes, worry about the chances you miss when you don't take any - #finchux",1542266711973548032,finchUIUX,1305808467584667648
"When in doubt, design it out #uxdesign",1542221433199271936,finchUIUX,1305808467584667648
"Let's start the guess game! Comment your answer!
 
https://t.co/EkAziPxDaC 

#funtime #guessthefonts #finchux #UIUX https://t.co/DZWcp5SCwB",1542204732286021632,finchUIUX,1305808467584667648
Design is how we communicate with people through the things we make. #finchux,1542176473565614080,finchUIUX,1305808467584667648
Great design is a gateway to great ideas.,1541949726421139458,finchUIUX,1305808467584667648
"Just like the beauty of a flower, a good design should be appreciated.",1541904304881147906,finchUIUX,1305808467584667648
"Startups are a journey, not a destination.",1541859038106996738,finchUIUX,1305808467584667648
"Being a designer is a lot like being a musician. You have to be dedicated to your craft, and you have to practice every day.",1541814142797025281,finchUIUX,1305808467584667648
