full_text,tweet_id,screen_name,user_ID
Agile World in top 70 podcasts you should listen to in 2022 Agile World Broadcast Network show Agile World on Apple Podcasts has been honoured today https://t.co/v71iVu4OVe #AgileWorld #AgileTalkShow #Agile https://t.co/kmMxCdRR7u #agileworld https://t.co/BKsIdu5bNG,1546781462049030147,AgileWorldNews,1369977999802695680
"The #Leadership of #Feedback by Oana Juncu Agile Human Systems by  Oana Juncu

While Feedback is overrated term today, it is still a powerful posture to https://t.co/v71iVu4OVe #AgileWorld #AgileTalkShow #Agile https://t.co/y9dZ6958xR https://t.co/e8ePxAXJWc",1546721092118650880,AgileWorldNews,1369977999802695680
"Agile World #Deutsch #Holakratie &amp; #OKRs kombinieren mit Andreas Hertel Viele Unternehmen stellen sich gerade die Frage, wie sie mehr https://t.co/v71iVu4OVe #AgileWorld #AgileTalkShow #Agile https://t.co/MRvOoZHmJB #agileworld https://t.co/AvO9ii1sos",1546660667834466306,AgileWorldNews,1369977999802695680
"Nasreen Elizabeth Hypn #Breathing Nazreen Elizabeth shares her journey towards Hypno Breathing, how it can help you and how she left a omfy https://t.co/v71iVu4OVe #AgileWorld #AgileTalkShow #Agile https://t.co/0iwCo1TtUS #agileworld https://t.co/qhzNC5AjBh",1546600265528352776,AgileWorldNews,1369977999802695680
"Potenciando Agilidad y Talento, Temporada 1, Episodio 4 

Potenciando Agilidad y Talento. Gestión del Talento y Agilidad son 2 temas que se https://t.co/v71iVu4OVe #AgileWorld #AgileTalkShow #Agile https://t.co/9SjrOpxq7B #agileworld https://t.co/Gy7fADRZZM",1546539872617365507,AgileWorldNews,1369977999802695680
Agile World #Wellness Season Two Agile World is excited to share our first commissioned series for Agile World Wellness. After a fantastic https://t.co/v71iVu4OVe #AgileWorld #AgileTalkShow #Agile https://t.co/0IXlDOn1kK #agileworld https://t.co/DVSGCVQydK,1546479475084460033,AgileWorldNews,1369977999802695680
"Agile World Coffee Chat talking about Understanding your #Customer Join Cynthia, #Sabrina and Bel while they discuss topics you should be having https://t.co/v71iVu4OVe #AgileWorld #AgileTalkShow #Agile https://t.co/Jz7j7vckvC #agileworld https://t.co/sn1V2RrRLl",1546419073436762113,AgileWorldNews,1369977999802695680
"Von Position zu Ambition – Wandel von Führung in der agilen Welt 🚀 Hast Du Dir schon mal die Fragen gestellt, wie es ist, wenn eine https://t.co/v71iVu4OVe #AgileWorld #AgileTalkShow #Agile https://t.co/DhIkdk3ADR #agileworld https://t.co/5RkUl1dI6X",1546358684820946947,AgileWorldNews,1369977999802695680
"Agile World Indie with #Nagini S5 E15 Agile World Indie with Nagini Agile Coaching and Emotional Intelligence, Agile evangelist and a project https://t.co/v71iVu4OVe #AgileWorld #AgileTalkShow #Agile https://t.co/ybJA66ZUSt #agileworld https://t.co/eZgqqy29dq",1546298295747764227,AgileWorldNews,1369977999802695680
"Agile World #English talk show #Announcement Agile World English show has a new co-hosts joining them, Julija Sipicina-Buhgolca

Julija will bring https://t.co/v71iVu4OVe #AgileWorld #AgileTalkShow #Agile https://t.co/0KXQyVJ1VF #agileworld https://t.co/Mg0sOurqYH",1546237886282055680,AgileWorldNews,1369977999802695680
Agile World #English Show with Michael Küsters Today our Agile World co-hosts Sabrina C E Bruce and Karl A L Smith talk with Michael Küsters about https://t.co/v71iVu4OVe #AgileWorld #AgileTalkShow #Agile https://t.co/xSbIGkq3UY #agileworld https://t.co/XMxdSp4kkV,1546177488849616897,AgileWorldNews,1369977999802695680
"Agile an Unexpected Journey A Compendium of Agile Biographies Agile an Unexpected Journey: A Compendium of Agile Biographies
This idea for this https://t.co/v71iVu4OVe #AgileWorld #AgileTalkShow #Agile https://t.co/h9rhZtCmTi #mba #dippc https://t.co/IMrxYmpP8M",1546117096282755072,AgileWorldNews,1369977999802695680
Agile Sales with Joe Budzinski on Agile World Our Agile World hosts Sabrina C E Bruce and Karl A L Smith discusses how sales teams at the enterprise https://t.co/v71iVu4OVe #AgileWorld #AgileTalkShow #Agile https://t.co/cdX1TxxAsU #agilesales https://t.co/EZQ9d1h0Sc,1546056697801838594,AgileWorldNews,1369977999802695680
"Devenir un leadership agile avec Jan Hugues Congia Agile Human Systems by  Oana Juncu

After 20 of the Agile Manifesto, what becomes of the Agile https://t.co/v71iVu4OVe #AgileWorld #AgileTalkShow #Agile https://t.co/wHCqN8XiRh #français https://t.co/h6Zkh8gkXr",1545996308082827266,AgileWorldNews,1369977999802695680
Navegando no Mar da Agilidade Neste Episodio o trazemos o CFO da multinacional ZEISS Vision Care para contar como a sua experiência no uso de métodos https://t.co/v71iVu4OVe #AgileWorld #AgileTalkShow #Agile https://t.co/b3ioupicmW #okr https://t.co/jmp9DB49TJ,1545935887795617792,AgileWorldNews,1369977999802695680
"Allan Torres Agile World #Português Nesse episódio atravessarmos virtualmente o Continente para falarmos com Allan Torres, Diretor do Portfólio https://t.co/v71iVu4OVe #AgileWorld #AgileTalkShow #Agile https://t.co/ZGiNGqMvxX #agileworld https://t.co/Zky2ZqXIGl",1545875493144199169,AgileWorldNews,1369977999802695680
"Visual Scribe at Work If “A picture is worth 1,000 words”, why do we spend so much time writing transcriptions and taking notes? Come join https://t.co/v71iVu4OVe #AgileWorld #AgileTalkShow #Agile https://t.co/AkePBR52UQ #agileworld https://t.co/FIWB6SWvWZ",1545815089017659393,AgileWorldNews,1369977999802695680
"Karl Smith no1 on #Agile by Thinkers360 Thinkers360 describe their technology as more than just a list, Thinkers360 live leaderboards are based on our https://t.co/v71iVu4OVe #AgileWorld #AgileTalkShow #Agile https://t.co/5wrgln8QJl https://t.co/QKwdqWeXjw",1545754694550683651,AgileWorldNews,1369977999802695680
"Agile World Français entrevue avec Francis Laleman Connaissez-vous le rapport entre une cour de récréation et l’agilité?
Pour Francis https://t.co/v71iVu4OVe #AgileWorld #AgileTalkShow #Agile https://t.co/XDok2R7OY6 #agileworld https://t.co/A193ghd7CU",1545694293913903104,AgileWorldNews,1369977999802695680
"Agile World Deutsch Miriam (Eure Hosts, Teil 2) Moin moin und herzlich Willkommen bei Agile World Deutsch!

In unserer “Eure Host”-Reihe https://t.co/v71iVu4OVe #AgileWorld #AgileTalkShow #Agile https://t.co/TtSntNH7B9 #agileworld https://t.co/0KUTEwu7Yk",1545633924327657473,AgileWorldNews,1369977999802695680
"Podcasters orientados a valor  – S05 E11 

Nesse primeiro episódio do Agile World Português conversamos com 3 dos principais podcaster https://t.co/v71iVu4OVe #AgileWorld #AgileTalkShow #Agile https://t.co/bWiXw9OIq2 #agileworld https://t.co/9lhQRJiFcT",1545573522088595456,AgileWorldNews,1369977999802695680
