full_text,tweet_id,screen_name,user_ID
"Pope Francis's apology to Indigenous residential school survivors in Canada was ""very carefully worded"" so the Catholic Church itself could avoid responsibility for the horrific abuses carried out at the institutions, says @Pam_Palmater. https://t.co/1r9Utvjulh",1552444449380499456,bluecorncomics,15142242
"Religious communities, bishops and popes were complicit in a system that dispossessed Indigenous peoples and oppressed their children at Native residential schools. #TheConversation #ResidentialSchools #Genocide #PopeFrancis #PopeInCanada https://t.co/29EU1kMRAr",1552402934637346816,bluecorncomics,15142242
"The war on public education is very real. If you vote for a Republican, realize this is the stance you are voting for. Even if the Republican you vote for says something different, this is where the party wants them to go. The goal is dismantling public Ed. https://t.co/UcUWuzkLh9",1552386383213318144,bluecorncomics,15142242
"In Pope Francis' apology, Lower Kootenay Band Chief Jason Louie said, the Pope left out a critical type of abuse that children endured: sexual.
https://t.co/SFe9T9jdgQ",1552328729023590401,bluecorncomics,15142242
150 years and still dealing with the same 💩. An all-new season of FX’s Reservation Dogs premieres 8/3. Only on Hulu. #ReservationDogs https://t.co/4r3AKncMeu,1552224306884595715,bluecorncomics,15142242
"ICT Founder Tim Giago was a force of nature in Indigenous journalism. I admired his bravery to tell the truth, no matter what. And also his talent for starting newspapers. https://t.co/2m9alV372t",1552215995678203906,bluecorncomics,15142242
In Alberta it seems everybody gets Headdresses whether they deserve it or not! https://t.co/PetUaStefG,1552172370072182785,bluecorncomics,15142242
