full_text,tweet_id,screen_name,user_ID
Fave Bro? Best Advice? Frankie Jonas Spills All the Jonas Brothers Secrets https://t.co/TnOWAIrx07,1554498002865233921,kissfmlou,161794940
Are You a Fan of Expiration Dating? Here’s the Latest Trend https://t.co/9wBuXzDJPv,1554491744389144578,kissfmlou,161794940
"According to a Survey, This Is the One Food You Need at Every Party https://t.co/QWwrnBOi1Y",1554480680238780422,kissfmlou,161794940
"Ryan's Quote of the Day - August 2, 2022 https://t.co/AQfmYaBScB",1554470157216538626,kissfmlou,161794940
Luke Bryan Shares Importance of Virtual ‘American Idol’ Auditions https://t.co/qLr6SCqsBK,1554136815229075456,kissfmlou,161794940
"Modern Woman Monday - August 1, 2022 https://t.co/3ciLNHTXJ6",1554122137258049541,kissfmlou,161794940
Zachary Levi Recalls Mental Health Breakdown That Led Him to Self-Love https://t.co/xkptUyRa3c,1554120630890528770,kissfmlou,161794940
"Doing This While Driving Hurts Our Brains, But We all Still Do It https://t.co/2l24aWOOnP",1554115795134955521,kissfmlou,161794940
"Ryan's Quote of the Day - August 1, 2022 https://t.co/ubGtkN2Sel",1554108061320728576,kissfmlou,161794940
Hershey Warns Of Possible Halloween Candy Shortage https://t.co/FVxtJHt04O,1554101616474820611,kissfmlou,161794940
IHOP Created A Choco Pancake In Honor Of The Choco Taco https://t.co/M8q0c4g1RP,1554024553554345984,kissfmlou,161794940
ICYMI: Watch Lizzo Shock Peloton Riders By Crashing Themed Class https://t.co/y3AhtBhCoI,1553105850281123842,kissfmlou,161794940
Andy Grammer and Fitz and the Tantrums Kick-Off Co-Headline Tour https://t.co/bIJAe8GpfL,1553102679269859328,kissfmlou,161794940
Do You Want the Old Instagram Back? So Do These Celebs https://t.co/mBFI6jWIYf,1553057261001621507,kissfmlou,161794940
"Lili Reinhart Talks Emotional End to 'Riverdale,' New Netflix Movie &amp; More https://t.co/wuLWWnUkjG",1553044490595844097,kissfmlou,161794940
Everything to Know About the Monkeypox Scare https://t.co/FPvoY7GdNE,1553031913639755776,kissfmlou,161794940
This Is the Correct Amount of Sunscreen You Need to Wear to Be Protected https://t.co/BPAwO1eMAa,1553019879619702784,kissfmlou,161794940
Shawn Mendes Officially Cancels Tour To Prioritize Mental Health https://t.co/dfYJNxknlw,1552745665586929675,kissfmlou,161794940
Glossier Will Now Be Sold At Sephora https://t.co/9PKDeO0aaO,1552739379801718789,kissfmlou,161794940
How to Do the 369 Manifestation Method That’s Going Viral on TikTok https://t.co/boBf9hAVha,1552689712292306947,kissfmlou,161794940
Beyoncé’s New Album Is Going to Help You ‘Release the Wiggle’ https://t.co/K1u26oF9q7,1552679597304586243,kissfmlou,161794940
This Is the Best Time to Go to an Amusement Park to Beat the Crowds https://t.co/2ncR8MOWSB,1552673434819239936,kissfmlou,161794940
"Ryan's Quote of the Day - July 28, 2022 https://t.co/ON4IlzrjOf",1552652841919008772,kissfmlou,161794940
'Sunroof' Singer Nicky Youre on Quitting His Job to Make Music https://t.co/KQ7JfGAKaB,1552354020731363328,kissfmlou,161794940
Need to Ask Someone for a Favor? This Trick Will Help https://t.co/eisk3UaNaY,1552322561010270210,kissfmlou,161794940
"Ryan's Quote of the Day - July 27, 2022 https://t.co/FgrPdgLiaz",1552319414854467584,kissfmlou,161794940
This Celeb Is Using DMs to Date and It Might Surprise You! https://t.co/nSgFKeUNFC,1551965474111594501,kissfmlou,161794940
Tanya Rad Is Trying to Sleep Like J.Lo to Avoid Wrinkles https://t.co/XauafEhvRP,1551962309886631936,kissfmlou,161794940
"If You Don't Have AC, Here's How You Can Stay Cool at Home https://t.co/obvOHkzePA",1551946558966571010,kissfmlou,161794940
"Ryan's Quote of the Day - July 26, 2022 https://t.co/qYxgiIjXMC",1551930839914659846,kissfmlou,161794940
"Modern Woman Monday - July 25, 2022 https://t.co/qlux62Zuo7",1551801777967726593,kissfmlou,161794940
Miles Teller's Wife Made Him Shave His Mustache After Filming Top Gun https://t.co/FuZBSYaZ9u,1551679132878127110,kissfmlou,161794940
Nina Dobrev Trolls Boyfriend Shaun White With TikTok Trend https://t.co/o8M51UGjDA,1551665019435237382,kissfmlou,161794940
These Are the Top Scents That Men &amp; Women Are Attracted to https://t.co/lQmb4jYBVw,1551592357111398401,kissfmlou,161794940
Staff Member Recalls When a Stranger Was Secretly Living Their House https://t.co/kv5m5YZYfA,1551587741258874880,kissfmlou,161794940
"Ryan's Quote of the Day - July 25, 2022 https://t.co/sjBETBiiAk",1551573486925225986,kissfmlou,161794940
Should Sisanie Put Together a Girl Group? https://t.co/EYbYS9za9u,1550609299537383425,kissfmlou,161794940
Wise words from #BreneBrown #QOTD https://t.co/D1yUb69DyW,1550514905824067592,kissfmlou,161794940
"If You're on Dating Apps, Avoid These 3 Overused Phrases In Your Bio https://t.co/dNPxtgg1Fs",1550485089682874368,kissfmlou,161794940
"Hear from those working towards a quality education for all students. Listen to Season 2 of award-winning podcast, Force Multiplier w/ @salesforceorg &amp; tell us how YOU are inspiring change using hashtag #ActionMeetsImpact https://t.co/TGfgiyPNoo https://t.co/Fs1FHg6mQk",1550166015228710915,kissfmlou,161794940
Study Shows Men Get Hungrier When They’re Hot https://t.co/0ycqCGWzHy,1550148545835143175,kissfmlou,161794940
@raimeetravels Shares Her Best Summer Travel Tips https://t.co/IqbYTAeS2F,1550142114813644800,kissfmlou,161794940
This Is the Age When We Reach Peak Attractiveness https://t.co/YWk6S3HV5f,1550127977479819266,kissfmlou,161794940
"Ryan's Quote of the Day - July 21, 2022 https://t.co/EM90D4Pf12",1550120116636880898,kissfmlou,161794940
"Meghan Trainor Shares the Emotional Therapy Story Behind “Bad For Me"" https://t.co/nJsCbeENAm",1549800473947000840,kissfmlou,161794940
"If You’re Feeling Stressed, Doing This for 10 Seconds Will Help Instantly https://t.co/UwqcgybyZq",1549784747026644993,kissfmlou,161794940
"Ryan's Quote of the Day - July 20, 2022 https://t.co/NFsVLgbQLV",1549758424686149633,kissfmlou,161794940
You Can Now Take A College Course On Harry Styles https://t.co/pvZMqaCKzu,1549599179781148673,kissfmlou,161794940
It's a good one today 💬 #QOTD https://t.co/lrFHxuN2pF,1549448331792875520,kissfmlou,161794940
Would You Fall for These Pick-Up Lines? https://t.co/VGkVmGZvMs,1549430881844084736,kissfmlou,161794940
Kevin Hart Shares Which 'Hart to Heart' Guests Get Most 'Turnt Up' https://t.co/lB2dVIZWlu,1549424605097594886,kissfmlou,161794940
Ranking My Favorite Songs Off Of Lizzo's New Album 'Special' https://t.co/Bn5lBf4Su6,1549416708821192704,kissfmlou,161794940
3 Reasons to Never Have a Coffee Date for a First Date https://t.co/57NnF74iH5,1549404117470269450,kissfmlou,161794940
"Ryan's Quote of the Day - July 19, 2022 https://t.co/AiNnfR4MUI",1549396292618670081,kissfmlou,161794940
Shake Shack Has A BOGO Deal On Milkshakes This Summer https://t.co/gAezXfPEj3,1549051780515995649,kissfmlou,161794940
Jesse Palmer Shares If There Will Be Two Bachelors Next https://t.co/EIeyqVveNB,1549042641924284417,kissfmlou,161794940
This Is the Best Place to Sit During a Meeting With Your Boss https://t.co/Nikwc1iA3z,1549032941333913603,kissfmlou,161794940
"Ryan's Quote of the Day - July 18, 2022 https://t.co/qTqAgg35Vx",1549028188172566529,kissfmlou,161794940
Lizzo Shares Story Behind Fun New Anthem 'Everybody's Gay' https://t.co/TXn8UcLciz,1547968145255571456,kissfmlou,161794940
Martha Stewart Shares How to Host a Stress-Free Dinner Party https://t.co/iUMM1mgKMo,1547963201739902978,kissfmlou,161794940
This Is How Often You Should Actually Wash Your Jeans https://t.co/irYonH5puK,1547956874300911621,kissfmlou,161794940
"Ryan's Quote of the Day - July 15, 2022 https://t.co/Vu2aTB5Upz",1547945976345743364,kissfmlou,161794940
Joe Jonas &amp; Sophie Turner Welcome Their Second Baby https://t.co/RQXhzQGo0I,1547675364884770819,kissfmlou,161794940
Lizzo to Take Over During 'American Top 40' This Weekend https://t.co/unOqhC4NL9,1547609425657020417,kissfmlou,161794940
This Dishwasher Hack Will Get You Shiny Silverware Every Time https://t.co/kuRiojdfdD,1547604584910049281,kissfmlou,161794940
The Bachelorette’s Rachel &amp; Gabby Share If They’ll Want a Double Wedding https://t.co/kQbFvdJT6J,1547600083574595584,kissfmlou,161794940
"Ryan's Quote of the Day - July 14, 2022 https://t.co/KamsUzTSqR",1547584780581056517,kissfmlou,161794940
Disney Channel Introduces Its First Trans Character On “Raven's Home” https://t.co/YT1vdVuvey,1547576327951134721,kissfmlou,161794940
Disneyland App Introduces Car Finder Feature https://t.co/25BhAnaHGz,1547485016069922823,kissfmlou,161794940
"Ryan Tedder: Miley Texts, Taylor Swift Sends Voice Memos &amp; More Details https://t.co/GvFgaThKVu",1547253881553522693,kissfmlou,161794940
Ryan Tedder Recalls How Tom Cruise Approved of 'Top Gun' Track https://t.co/bqjCCFFD92,1547252219979997184,kissfmlou,161794940
"Sabrina Carpenter Reflects on Recording ‘Honest,’ Personal New Album https://t.co/rygtdgfKCw",1547239583322181634,kissfmlou,161794940
Tanya Rad Tried TikTok’s Viral ‘Internal Shower’ Cleansing Drink https://t.co/ChHCc3TWgf,1547228968033599490,kissfmlou,161794940
"Ryan's Quote of the Day - July 13, 2022 https://t.co/0mjI0yVOMh",1547222302873493505,kissfmlou,161794940
What Do You Do If Your Friend Is a ‘Dating Chameleon’? https://t.co/Gj47quxXul,1546904637978120193,kissfmlou,161794940
Someone Stole Seacrest’s Flip Flops at the Beach https://t.co/0KDqowli1s,1546885974361362432,kissfmlou,161794940
"Sisanie’s Husband Joined a Band! Plus, Is Tanya Moving In With Her BF? https://t.co/AJM9zaMfZC",1546884049855209476,kissfmlou,161794940
Eating This Food Helps Avoid Getting Sunburned https://t.co/uW6ZiVVMtO,1546866968757764099,kissfmlou,161794940
"Ryan's Quote of the Day - July 12, 2022 https://t.co/Jh6HtCz7QK",1546862145551454208,kissfmlou,161794940
"Modern Woman Monday - July 11, 2022 https://t.co/EjX3YsuEgJ",1546700032258310150,kissfmlou,161794940
Start the week off right 😘 #QOTD https://t.co/FQxxLjgeOm,1546596385331486723,kissfmlou,161794940
A New Study Shows Which U.S. Cities Single People Should Move To For Love https://t.co/ITM38smt2U,1546556966402678784,kissfmlou,161794940
Meet the Man Who Just Walked Around the World https://t.co/8OniKMLGQR,1546522315248246784,kissfmlou,161794940
Sis Wants to Get Baby Siveya an Agent: What She Learned From the Meeting https://t.co/dbsZfMfOSU,1546512901573414912,kissfmlou,161794940
This Is the Best Place to Store Luggage In a Hotel Room https://t.co/jQ54sLdWPM,1546502159499497479,kissfmlou,161794940
"Ryan's Quote of the Day - July 11, 2022 https://t.co/iOf9j9fA0j",1546500281097142273,kissfmlou,161794940
Shawn Mendes Postpones Tour To Take Care Of His Mental Health https://t.co/PXFPTqKNCZ,1545680820085596160,kissfmlou,161794940
Tanya Hilariously Admits to Sending Song Lyrics to Guys While Dating https://t.co/0jrA08S6hv,1545435453205233664,kissfmlou,161794940
"If You're on Dating Apps, Here's Why You Should Never Send iPhone Pics https://t.co/I7sNetiWcm",1545410240539250692,kissfmlou,161794940
Em Beihold to Guest Host 'American Top 40' https://t.co/Ve6MwjnHAP,1545082928123838465,kissfmlou,161794940
The Most Romantic Day of the Year Is Coming: What It Means For Your Sign https://t.co/MnVjBSPjYj,1545081316554727424,kissfmlou,161794940
Kelly Ripa Admits First Year of Marriage is Toughest: ‘Horrible Mistake’ https://t.co/dWFlmoo0q3,1545076594804506624,kissfmlou,161794940
"Ryan's Quote of the Day - July 7, 2022 https://t.co/Jt4nqJCyR3",1545049858788052995,kissfmlou,161794940
Did Tanya Rad Manifest Her Boyfriend Via This Workbook? https://t.co/D2MprLSPKI,1544724136081199104,kissfmlou,161794940
Summer = watermelon szn 😎 Head to Ryan's blog on our website to learn how to pick the perfect one! 🍉 https://t.co/tunz5npGVq,1544718079837573122,kissfmlou,161794940
Tanya Rad Hilariously Recalls a 'Team Ranya' Dating Era Dream https://t.co/x4EAGCZgRi,1544692558328205312,kissfmlou,161794940
Here's How to Tell If a Watermelon Is Perfectly Ripe https://t.co/RiDl7WB03x,1544684735938658304,kissfmlou,161794940
"Today's #StupidInternetQuestion... If you could move to any other country, which country would it be? #TheJubalShow #Moving https://t.co/80iMYrFCH3",1544381791947165702,kissfmlou,161794940
Watch Ryan Seacrest &amp; Tanya Rad’s Boyfriend Settle Their Height Debate https://t.co/0xAzQdhyBy,1544360826005487618,kissfmlou,161794940
'The Summer I Turned Pretty' Is the Latest Must-Watch Show https://t.co/UGTAyb4De3,1544327616466927617,kissfmlou,161794940
