full_text,tweet_id,screen_name,user_ID
Read our blog to find out what netting is the right one for your project and how much you need! #netting https://t.co/BN09YY2fDM,1554493484756869126,HuckSport,263673094
🏴󠁧󠁢󠁥󠁮󠁧󠁿The Lionesses did it for England! #itscominghome https://t.co/KutKmYwIzf https://t.co/BBlxvR3IS1,1554131096522088453,HuckSport,263673094
This long volleyball net is perfect for training and is the same size as tournament regulation nets! 🏐 #volleyball https://t.co/cnDQqifGdx https://t.co/PvuFTCvNwf,1553713097453588480,HuckSport,263673094
At Huck Net UK we include safety rope around the borders of our nets as standard to ensure they provide the strength and durability needed when working at height. 🏗#safetynetting https://t.co/DuOTij9HBj https://t.co/nzRAkXdoHc,1553350210415431680,HuckSport,263673094
⚽Find all the latest football transfer updates and pre-season news at BBC news with live updates as they happen!  https://t.co/KutKmYwIzf https://t.co/RdVyfU2dsV,1553002410695659521,HuckSport,263673094
🎾This polyethylene tennis net is manufactured using 3mm knotted tennis netting with no rows of double mesh for optimum visibility. https://t.co/JRL4vLDdAI #tennis https://t.co/WODIrAHkKF,1552681552181616640,HuckSport,263673094
"The mini soccer single colour football goal net is the perfect net for clubs and training grounds thanks to its strength, durability and great value.https://t.co/voiis46E4P 🥅 https://t.co/Niumv6lagB",1552263548818149382,HuckSport,263673094
"🐜Keeping your home bug-free is important, and one way to do that is by installing DIY insect nets for windows, read our blog to find out how! #pestcontrol https://t.co/CbTqsp7Kyd",1551956767755616256,HuckSport,263673094
Unique - Huck football goal nets are hand-made in the UK using our globally recognised knotless netting. 🥅 #goal  https://t.co/pWsB6lLljM https://t.co/fowsZ1sQCd,1551594385112010754,HuckSport,263673094
Secure scaffolding and ledges with our brick guard rail nets. They are extremely safe and easy to install onto scaffolding.https://t.co/cDp4jheCcq #scaffoldsafety #safetynet https://t.co/NYkX7X5qSk,1551176128584351745,HuckSport,263673094
What can Manchester United fans expect from new signing Lisandro Martinez? #manu ⚽ https://t.co/RUoHMlkCAY,1550812987346264069,HuckSport,263673094
"Welded mesh fencing is used for bird proofing in both the home and for businesses. It is an effective way of protecting buildings and gardens against pigeons and gulls, available in a range of sizes! https://t.co/ODNJAHK6v2🐦 https://t.co/3YJqpHurng",1550467963240824832,HuckSport,263673094
🎾This polyethylene tennis net is manufactured using 3mm knotted tennis netting with no rows of double mesh for optimum visibility. https://t.co/JRL4vLDdAI #tennis https://t.co/LDMDpepKpp,1550144835801186306,HuckSport,263673094
Our Beach Volleyball Set with Net and Posts has everything you need to have a brilliant game at the beach and all comes in a handy storage bag! https://t.co/tNDn1g4XoS https://t.co/xW6nh2JBv3,1549726580657819649,HuckSport,263673094
"🏌♂Cameron Smith stuns St Andrews by snatching the 150th Open by one stroke from Cameron Young, as overnight leader Rory McIlroy finishes third! #golf https://t.co/dDfhesp9np",1549420054454112256,HuckSport,263673094
"Fall arrest safety nets are often needed in unique sizes and shapes. Huck  produce bespoke orders which include scaffold netting debris overlay, and F/R treated safety nets.   https://t.co/ZFDnur4ICw #safetynet #fallarrest https://t.co/VLoxAmDMAk",1549057691217059840,HuckSport,263673094
"Huck offer a complete range of tennis nets, tennis posts and windbreaks. Including 'The Worlds Finest Tennis Nets' as used at the Wimbledon championships 🎾 https://t.co/x9x3WjiKk6 #tennisnets https://t.co/5zcEJ5zrTt",1548638917104177155,HuckSport,263673094
⚽Questions might remain about the standard of Major League Soccer but Gareth Bale could become an iconic figure at LAFC according to their passionate fans. #footballnews https://t.co/KutKmYOjqN https://t.co/PXxezQw6pm,1548276269229387778,HuckSport,263673094
This long volleyball net is perfect for training and is the same size as tournament regulation nets! 🏐 #volleyball https://t.co/cnDQqhY4OX https://t.co/yhtKb0GHJC,1547930996531556357,HuckSport,263673094
🏡Solar panel bird proofing is an effective bird deterrent method to keep birds such as pigeons from getting underneath solar panels and an essential for houses or businesses with solar panels #birdproofing #solarpanels https://t.co/k2hA5s0GT2,1547608115943579655,HuckSport,263673094
"Huck Nets are known for producing custom netting for use in construction, sports and industrial projects. All of our netting can be purchased online using our netting calculator and orders are sent using a 24-hour delivery service. https://t.co/qPi2wfQAEO #netting https://t.co/iEmojGiecC",1547190661778210817,HuckSport,263673094
"🎾This year marked Sue Barker's last wimbledon, take a look at the tribute made to her for her time supporting and presenting the tournament! #wimbledon https://t.co/QDdy9KRWR8",1546883362719145985,HuckSport,263673094
🏆Can England go all the way? Read pundits predictions for the Euros 2022! #Euros2022 https://t.co/KutKmYwIzf https://t.co/CrGwjzYz9o,1546520955513704449,HuckSport,263673094
Unique - Huck football goal nets are hand-made in the UK using our globally recognised knotless netting. 🥅 #goal  https://t.co/pWsB6lLljM https://t.co/ppnFXBtacO,1546102444593217540,HuckSport,263673094
Our timber bollards are the ideal product to install around the borders of playgrounds. https://t.co/O7YmdDnDG0 #bollards 🌳 https://t.co/N5gaTotOrk,1545740055624417281,HuckSport,263673094
This long volleyball net is perfect for training and is the same size as tournament regulation nets. 🏐 #volleyball https://t.co/cnDQqifGdx https://t.co/kq61VOYe40,1545393779405979649,HuckSport,263673094
It's not too late to grab your tickets for Jurassic Fields 2022 at https://t.co/ms13KHCgx8 We look forward to seeing you there this weekend!🤩 https://t.co/u8EsDSatOi,1545071406299447296,HuckSport,263673094
At Huck Net UK we include safety rope around the borders of our nets as standard to ensure they provide the strength and durability needed when working at height. 🏗#safetynetting https://t.co/DuOTij9HBj https://t.co/FbrMjZpXE9,1544653647891636224,HuckSport,263673094
"All our solutions come with an optional support package to ensure they remain robust &amp; relevant, catering for unforeseen problems such as application updates, user errors &amp; changes to data formats. https://t.co/ffzuByWg1g #msexcel #excelsupport https://t.co/r87t0YKocM",1544584448871636992,HuckSport,263673094
Cameron Norrie maintains the British challenge in the Wimbledon singles by beating American Tommy Paul to reach his first Grand Slam quarter-final where he is facing David Goffin. #wimbledon 🎾 https://t.co/BMlLWvRfVs,1544346622326439937,HuckSport,263673094
🎾Practise more with our junior size tennis nets. Perfect for honing those skills and can be used on any type of court surface. The net is made from high strength weather resistant polypropylene! #tennisjunior https://t.co/YUT28AOOTB https://t.co/UnhUP5r0kO,1543984264819122179,HuckSport,263673094
This long volleyball net is perfect for training and is the same size as tournament regulation nets! 🏐 #volleyball https://t.co/cnDQqifGdx https://t.co/Cp7o8DZWCJ,1543565750614499329,HuckSport,263673094
"The mini soccer single colour football goal net is the perfect net for clubs and training grounds thanks to its strength, durability and great value.https://t.co/voiis46E4P 🥅 https://t.co/qDAvNZr0Qx",1543203599311949824,HuckSport,263673094
"Huck Nets are known for producing custom netting for use in construction, sports and industrial projects. All of our netting can be purchased online using our netting calculator and orders are sent using a 24-hour delivery service. https://t.co/qPi2wfR8um #netting https://t.co/Lz7Dfs3It3",1542858573306544129,HuckSport,263673094
🏡Solar panel bird proofing is an effective bird deterrent method to keep birds such as pigeons from getting underneath solar panels and an essential for houses or businesses with solar panels #birdproofing #solarpanels https://t.co/k2hA5rJ61u,1542534682604085254,HuckSport,263673094
"Are we nearing the end of an era in tennis? With injury concerns over many of tennis' big names going in to Wimbledon, are the young players ready to make a major breakthrough? #wimbledon #GOAT 🎾https://t.co/MzDYrNR45D https://t.co/2p8KA3OQen",1542115673689800711,HuckSport,263673094
"Safety netting is often the first installation of a construction project. At Huck Nets UK we manufacture a wide range of market-leading knotless safety netting, we can also produce bespoke safety net systems to suit your project!  🏗 #safetynets https://t.co/92J4JTVJhY",1541809909175656448,HuckSport,263673094
Contact already made with Christian Eriksen as Erik ten Hag plans to make changes at Old Trafford. #footballtransfers⚽ Check out our world class football nets at https://t.co/KutKmYwIzf https://t.co/CiqTCsgFDI,1541447519850348544,HuckSport,263673094
"🏸Here at Huck Nets UK we make badminton nets to a world class standard. Our badminton nets are suitable for use as badminton tournament nets and come in a range of mesh sizes and net sizes, and many are in stock for next day delivery! #badminton https://t.co/k1a8Plt9hw",1541028508394299393,HuckSport,263673094
"At Huck Nets UK our football nets are made from superior strength, impact resistant knotless netting, both
weatherproof and UV resistant for durability! #footballnet🥅 https://t.co/KutKmYwIzf",1540666120402870272,HuckSport,263673094
"Established in 1996, Huck Nets UK is the largest manufacturer of made to order and bespoke netting in the UK. Blending traditional and modern techniques, our world-renowned knotless netting can be made to any shape and size https://t.co/qPi2wfQAEO #fallarrestnet https://t.co/YkBXUr9oEa",1540321102853021705,HuckSport,263673094
🏆Matteo Berrettini proves his Wimbledon potential by beating Filip Krajinovic to claim the Queen's title for a second year in a row! #queens #wimbledon 🎾 Huck produces the 'World's Finest Tennis Nets' https://t.co/MzDYrNR45D https://t.co/37xzsU94OL,1540254660858191872,HuckSport,263673094
"Our Tennis Court Surround Nets and indoor panelling are manufactured from breathable polyethylene and therefore do not damage fencing. Add your club's branding and logo, the netting is perfect for advertising! #tennisclub 🎾 https://t.co/3O7rFER7nj",1539997966597033984,HuckSport,263673094
Solar panel bird proofing is an effective bird deterrent method to keep birds such as pigeons from getting underneath solar panels and an essential for houses or businesses with solar panels https://t.co/k2hA5rJ61u... https://t.co/RsvfZu4sc5,1539579719921844225,HuckSport,263673094
"Huck offer a complete range of tennis nets, tennis posts and windbreaks. Including 'The Worlds Finest Tennis Nets' as used at the Wimbledon championships 🎾 https://t.co/x9x3Wjji9E #tennisnets https://t.co/Y94J4ZHvKG",1538910805147910145,HuckSport,263673094
"Huck Nets was set up in Bridport in 1996 and are the UK's leading netting manufacturer with over 50,000 square feet of manufacturing space.  https://t.co/t8MkDbg4xO  #cricketnets #golfnets #birdprotectionnets https://t.co/vHgTQiTsan",1538493307533381633,HuckSport,263673094
"Dan Evans wins Nottingham Open, he will now face Matteo Berrettini who beat Andy Murray in the final of Sunday's Stuttgart Open! 🎾 #tennistournaments https://t.co/LTMh2If2TG",1538129404961996800,HuckSport,263673094
Our Rainbow Fun Play Course 2010 Climbing Play-Adventure Tunnel is great climbing fun for both younger and older children!  🌈 #playareaequipment https://t.co/InBEogS4KH https://t.co/40qyXudSbE,1537783632898707458,HuckSport,263673094
"""I want to score goals, win trophies and improve as a footballer and I am confident I can do that here."" Erling Haaland has been signed for Man City in a deal worth £51m. #mancity ⚽ Check out our range of football nets! https://t.co/KutKmYwIzf https://t.co/G8gIpMc98j",1537461254612299778,HuckSport,263673094
"Grab your tickets for this year's Jurassic Fields 2022 at https://t.co/ms13KHCgx8 this July 8th, 9th and 10th! We look forward to seeing you there!🤩 https://t.co/EuBshW7ki1",1536736484077731841,HuckSport,263673094
Our Badminton Tournament nets are perfect for clubs and tournaments that want to use tournament regulated nets! 🏸 #badmintontournament https://t.co/1Ys7Mh6z8O,1536374095457456129,HuckSport,263673094
A great performance from Andy Murray beating Stefanos Tsitsipas world number 5 in 3 sets! 🎾 #tennis Check out our wide range of tennis nets and related products  https://t.co/MzDYrNR45D https://t.co/ZWqCWFFZ9B,1535955079240507392,HuckSport,263673094
"Huck Nets are known for producing custom netting for use in construction, sports and industrial projects. All of our netting can be purchased online using our netting calculator and orders are sent using a 24-hour delivery service. https://t.co/qPi2wfQAEO #netting#nets https://t.co/jmuSUnVktt",1535593197518438400,HuckSport,263673094
"The suns out, it's time to take Volleyball outside! Our Beach Volleyball Set with Net and Posts has everything you need to have a brilliant game at the beach and all comes in a handy storage bag! #beachvolleyball 🏖... https://t.co/idheRRe6nh",1535246915457241088,HuckSport,263673094
"Check out our range of Rope End Swingers, a super exciting addition to any play area! From our Mini Rope End Swing to our Dragon Maxi Swinger, we have one to fit all play areas!   🐲#playequipment https://t.co/yZWK8id2Ca https://t.co/smHlMClYFd",1534924550743502850,HuckSport,263673094
"@DatFatCricketer sorry you have not had a response, please email me directly rob@hucknetting.co.uk with your order details and I will look into it for you",1534856463272878080,HuckSport,263673094
"Our Cricket Ball Machine has 19 different swing and spin settings and a delivery speed of upto 95 mph! We also have all the accessories you need, including the battery, 28 ball automatic ball feeder and bowling machine stand. #crickettraining 🏏... https://t.co/6Mse2L6CeX",1534506544469004289,HuckSport,263673094
"With only 2 games away from a place at The World Cup, Scotland lost 3-1 to Ukraine. Ukraine are now set to face Wales in the Final on Sunday #worldcup ⚽ Check out this exclusive online offer on our Full Size International Style Football Goal Nets... https://t.co/TbGPumnyuH",1534199764337696768,HuckSport,263673094
Our 50m x 2m Heavy Duty Driving Range Netting is the perfect safety solution. Its 20mm mesh stops tennis balls penetrating the net even at high impact. It is UV stabilised and rot proof so you are ensured a long lasting durable net. #golf 🏌♂... https://t.co/f7dMO0mfgX,1533837384130887680,HuckSport,263673094
"Cricket nets and cricket ground equipment from Huck Nets. Cricket cages, sight screens, ball stop netting, training aids and more. 
https://t.co/gfiuR8onLe #cricketgrounds #groundsmaintenance https://t.co/i87EC0COEn",1533056507163574273,HuckSport,263673094
"Our Driveway Barrier Safety Net - 1m x Custom Length is the perfect solution for a temporary driveway or garden barrier, attached with 6 straps,  making it quick and easy to set up and put down. #safety 🏡... https://t.co/6qauPAGzka",1532709956360843269,HuckSport,263673094
"British number 1 Cameron Norrie, encourages Emma Raducanu on upcoming Wimbledon tournament! 🎾 #wimbledon #tennis https://t.co/MzDYrNR45D https://t.co/OUGAU6HOsH",1532387823634075653,HuckSport,263673094
"Our timber bollards are the ideal product to install around the borders of playgrounds. They are suited to mark out the natural boundary of water areas, pathways and meadows. Larch posts planed, varnished, split-heart centre, pressure-proofed... https://t.co/UcyTxVRYoK",1531969825832112129,HuckSport,263673094
Bird netting installation fixings are just as important as the net to ensure effective installation. We have a mixture of main fixings and intermediate fixings. #netting 🐦https://t.co/f2iMsCwVFW https://t.co/O7testzkQ3,1531663059042934789,HuckSport,263673094
Our 45mm Brick Guard Rail Nets are made to order and conforms to EN 1263-1 ensuring areas of your site such as scaffolding and ledges are secure and as safe as possible 🏗 #building #safetynetting... https://t.co/oeimbE8gmS,1531300664411836416,HuckSport,263673094
Huck Nets' 24' x 8' Full Size Aluminium Freestanding Kwik Release Football Goals are perfect in situations where goals need to be taken down or moved often. The Kwik release design makes this quick and easy to do! 🥅 #footballnets... https://t.co/stSPPGIbqk,1530882406579945473,HuckSport,263673094
Former Real Madrid and Liverpool coach Rafael Benitez talks tonight's upcoming UEFA Champion's League final and what he did to prepare his team.🏆#UEFAchampionsleague #final https://t.co/KutKmYwIzf https://t.co/Fe0kqNRvuD,1530519261390721024,HuckSport,263673094
"Our Tournament Volleyball Net conforms with international, DVV I and DIN EN 1271 standards as do all our tournament nets so it is perfect for clubs and venues that host tournaments or want to practice using tournament regulation nets! 🏸 #badminton... https://t.co/bjmcoXq0d7",1530173236121636865,HuckSport,263673094
"Our 4 bay heavy duty cricket cage is perfect for schools and clubs due to its easy installation, the frame is made from 42.4mm OD galvanised steel for unbeatable strength and protection against the elements 🏏 #cricket... https://t.co/5wXjHsURyf",1529851112056053766,HuckSport,263673094
"British number 1 Cameron Norrie wins his first title on clay, the Lyon Open! 🎾 #britishnumber1 #tennis https://t.co/MzDYrNR45D https://t.co/xSErDAXTov",1529432099656282114,HuckSport,263673094
Our Bird Net Kit and Fixings has everything you need to protect your garden from pigeons and other large birds!  https://t.co/bd66TsYb4N #gardeningtips 🦅 https://t.co/PrhAbfnUuL,1529126336366841857,HuckSport,263673094
Steven Gerrard has loved his first 6 months as head coach for Aston Villa but what's the plan for the club's next season? https://t.co/KutKmYwIzf #astonvilla #gerrard #football ⚽ https://t.co/AsvYwybJWN,1528763943849807873,HuckSport,263673094
Make sure everyone can enjoy your play area with our range of Inclusive Play Equipment! #inclusivity #playequipment 🌻https://t.co/ojy5CBcxzK https://t.co/CwZ2K7HfH5,1528345694800687104,HuckSport,263673094
"Fall arrest safety nets are often needed in unique sizes and shapes. Huck  produce bespoke orders which include scaffold netting debris overlay, and F/R treated safety nets.   https://t.co/ZFDnuqN7KY #safetynet #fallarrest https://t.co/WTMqTo2X5x",1527983056224763905,HuckSport,263673094
What does Cristiano Ronaldo's future look like at Man Utd under new manager Erik ten Hag? #manchesterunited #ronaldo #reddevils https://t.co/b2exLJ3r4v,1527574861144633345,HuckSport,263673094
"Swimming pool nets for safety, security, and protection from leaves and debris. Make it easier to remove large items such as toys and floats. 🏊 https://t.co/qk8Mjs1yKz #swimnets https://t.co/wbU4Ahultj",1527356170138447872,HuckSport,263673094
Need netting for a project but not sure what type to use? Read this useful guide to get started. At #HuckNetUK all our netting is made to order and bespoke to suit your needs. You can order online using our #netting calculator. https://t.co/BN09YY2fDM,1526895385142341636,HuckSport,263673094
Bird proof your solar panels with Huck and prevent damage by nesting birds. Unprotected panels can sustain bird damage causing them to be inefficient or stop working completely. 🐦 https://t.co/k2hA5rJ61u #solarpanels... https://t.co/p6vbMDSGiH,1526589624629567489,HuckSport,263673094
"Our Guarantee - All our solutions come with an optional support package to ensure they remain robust &amp; relevant, catering for unforeseen problems such as application updates, user errors &amp; changes to data formats. https://t.co/ffzuByWg1g #msexcel #excelsupport https://t.co/22MQ0NlJlL",1526458257036005376,HuckSport,263673094
Will a play-off for the title of Premier League Champions really happen? Let us know your thoughts and who you're backing to lift the trophy! 🏆#liverpoolfc #mancity #premierleague https://t.co/7ly29bUt2V,1526125309002764288,HuckSport,263673094
"Huck Nets are known for producing custom netting for use in construction, sports and industrial projects. All of our netting can be purchased online using our netting calculator and orders are sent using a 24-hour delivery service. https://t.co/qPi2wfQAEO #netting #nets https://t.co/JRLTmxM6ph",1525808732239810560,HuckSport,263673094
This long volleyball net is perfect for training and is the same size as tournament regulation nets. The net is manufactured from knotless polypropylene netting and has a mesh size of approx 100mm. 🏐 #volleyball... https://t.co/MrOf8noGbY,1525447094550536193,HuckSport,263673094
Unique - Huck football goal nets are hand-made in the UK using our globally recognised knotless netting. This winning combination makes Huck goal nets the best on the market providing years of durability and incredible value. #EmiratesFACup... https://t.co/FQiGDDHi69,1525100060786233350,HuckSport,263673094
"🏏 First class cricket nets and high-quality ground equipment. Cricket cages, sight screens, ball stop netting, training aids and more.  https://t.co/71XG64d485 #cricketnets https://t.co/AwcqZtsdwE",1524777682101231616,HuckSport,263673094
"Welded mesh fencing for bird proofing in both home and business. It is an effective way of protecting buildings and gardens against pigeons and gulls. Welded mesh fencing comes in a range of different gauges, mesh sizes and roll sizes.... https://t.co/1mIGmbwAbs",1524360184671481856,HuckSport,263673094
"Huck Nets are known for producing custom netting for use in construction, sports and industrial projects. All of our netting can be purchased online using our netting calculator and orders are sent using a 24-hour delivery service. https://t.co/qPi2wfQAEO #netting #nets https://t.co/WuUjboZUDV",1524052906521018372,HuckSport,263673094
🎾Practise more with our junior size tennis nets. Perfect for honing those skills and can be used on any type of court surface. The net is made from high strength weather resistant polypropylene. The apprentice may then upset the... https://t.co/PNgIn7Ni2y,1523690520739987456,HuckSport,263673094
The Tent net climbing net is made from 16mm steel core Hercule's rope and comes complete with 2 tyre swings. https://t.co/IY4GhCNtiY #playequipment https://t.co/pdblOR9i4u,1523272771245342720,HuckSport,263673094
Think Summer and buy cricket nets &amp; equipment online. Everything you need from pavilion clocks to propagation sheets to cricket pitch boundary and marking equipment.  🏏https://t.co/71XG64d485 #cricketnets https://t.co/1abiwQ7zMd,1522910627102142466,HuckSport,263673094
"The Herring Gull, commonly known as a seagull, is a persistent bird and often needs deterring from buildings and take-away meals. Try this wire out ... https://t.co/wG4nIli0W9 https://t.co/PwlsSm1wvQ",1522566109454643200,HuckSport,263673094
"Buy cricket nets &amp; equipment online. We sell cricket netting, cricket ground supplies and cricket training equipment. Everything you need from pavilion clocks to propagation sheets to cricket pitch boundary and marking equipment. 🏏... https://t.co/IubfagerDX",1521823210752417792,HuckSport,263673094
Bird proof your solar panels with Huck and prevent damage by nesting birds. Unprotected panels can sustain bird damage causing them to be inefficient or stop working completely. https://t.co/k2hA5rJ61u #solarpanels... https://t.co/V6cEOhFovq,1521516194049765376,HuckSport,263673094
"Huck offer a complete range of tennis nets, tennis posts and windbreaks. Including 'The Worlds Finest Tennis Nets' as used at the Wimbledon championships 🎾 https://t.co/x9x3WjiKk6 #tennisnets https://t.co/oalnHyD9Vv",1521153803730493441,HuckSport,263673094
"Fall arrest safety nets are often needed in unique sizes and shapes. Huck  produce bespoke orders which include scaffold netting debris overlay, and F/R treated safety nets.   https://t.co/ZFDnuqN7KY #safetynet #fallarrest https://t.co/M0dEWlq78v",1520735551263023106,HuckSport,263673094
"Huck Nets produce custom netting for use in construction, sports &amp; industrial projects. All of our netting can be purchased online using our netting calculator &amp; orders are sent using a 24-hour delivery service. https://t.co/qPi2wfQAEO #netting... https://t.co/8RxkF4cPhS",1520373661533884417,HuckSport,263673094
Fire treated bird netting can be used on buildings and is commonly used to comply to regulatory factors. It's also suitable for use in domestic settings. 🐦 https://t.co/H7IdWKj1pY #birdnetting https://t.co/Ts463uv5eO,1520026372189605897,HuckSport,263673094
🏏Our standard 2 bay cricket cage is the perfect fixed cricket cage for clubs and schools due to the ease of installation and high build quality. It comes with a choice of green or black high tenacity knotless netting. #cricketnetting... https://t.co/PiOwoVB3BI,1519704251781586948,HuckSport,263673094
"Build a net tunnel from Hercules rope (Ø 16 mm, 6-strand, with steel core). Running surface: 0.90 m, height: 1.20 m. Network ends as standard with nuts and bolts. https://t.co/d55HFs4gPw https://t.co/u4GHuX0NrQ",1519287508332421120,HuckSport,263673094
This polyethylene tennis net is manufactured using 3mm knotted tennis netting with no rows of double mesh for optimum visibility https://t.co/HufpAZX9e4 #tennis https://t.co/KpsMY2tufa,1518979473642856448,HuckSport,263673094
