full_text,tweet_id,screen_name,user_ID
"Actors @joelmchale &amp; #KerryBishe talks to The Inside Reel about subversion, genre, chemistry, perspective and love in regards to their new mash-up romance/sci-fi film: ""Happily"". #Happily #Romance #Mystery #TVInterview https://t.co/me1j5hv2aq",1372717698212364289,insidereel,29521448
"In Episode 1 of ""The Falcon And The Winter Soldier"", the aspect of moving on is an interesting diatribe both in what these characters are willing to be and what they are trying to forget.  #Marvel #Disney+ #WinterSoldier #TheFalcon #TVReview https://t.co/RHEZb7FFlI",1372716690715373569,insidereel,29521448
"The essence of ""Paradise Lost"" is bathed in what is respected and what is inevitable. In ""The Feast"" , the essence of gluttony, greed, the encroachment of nature and the texture of ego plays heavily but done in a beautifully functional way  #horror #SxSW21 https://t.co/tg4h9JFH1y",1372715102277935107,insidereel,29521448
"The essence of ideals against isolation is an interesting form of commentary. In ""Offseason"" Jocelin Donahue plays a lady who is drawn back to a island where her mother grew up.  #island #horror #midnighters  #sxsw21  #offseason #feature #filmreview https://t.co/TkQM6Z6sOP",1372713904372076554,insidereel,29521448
"The idea of slight changes on alternative history provides an interesting context on current events. ""Witch Hunt"" does an interesting job of melding the differing textures. #satire  #perspective #elizabethmitchell #sxsw21 #filmreview https://t.co/TP9MrUG8AH",1372712709737840641,insidereel,29521448
"The intersection of reality (or pseudo-reality) and genre is always an interesting mix depending how deep the rabbit hole goes. With ""Broadcast Signal Intrusion"" , the filmmaker Jacob Gentry plays an interesting balancing game. #Midnighters #SxSW21 #Noir https://t.co/Ug7vBZ344C",1372067225859981317,insidereel,29521448
"The element of nature versus nurture takes an unexpected turn, especially with a sense of reckoning in ""Gaia"" [Midnighters] using an almost aboriginal perspective at the inset then completely turns it on its head.  #Midnighters #Gaia #FilmReview #SxSW21 https://t.co/uXuwgAkxLJ",1372028787068665857,insidereel,29521448
"In ""Ninjababy"" [Global], an unwanted by a fun loving girl with a conscience and a good head on her shoulders shows both the humanity and awkwardness of such a situation without it being too heavy or going overboard. #Comedy #Romance #Norway #Global #SxSW21 https://t.co/FduT4TfC17",1371964863417884675,insidereel,29521448
"The story of Michael Brody Jr. explored in ""Dear Mr. Brody"" [Festival Favorites/Texas Premiere) is an interesting ode on fame and money in a time where cancel culture and social media had no place. #SXSWFilm #FilmReview #Documentary https://t.co/SxBznSsVCp",1371918019857948678,insidereel,29521448
"""Prisoners Of The Ghostland"" is not a polished gem but a rough sparking ruby that delivers both fun, artistry and ruminations on themes that continue to be a cross-section of both East &amp; West.  #PrisonersOfTheGhostland #NicolasCage #SionSono #Sundance2021
https://t.co/sItxcY4Nci",1356144944679936001,insidereel,29521448
"""The Blazing World"" balances between two extremes but keeps  a steady and visually ambitious hand while telling a character story wrapped in the psychosis of a character needing to release her pain. #CarlsonYoung #Sundance2021 #TheBlazingWorld #FilmReview https://t.co/P5PFxAHaoO",1356143239380742146,insidereel,29521448
"The themes are big and some ironies and textures are quite riveting but ""All Light Everywhere"" tries to be too many places at once without find its true through line. #USDocumentaryCompetition #AllLightEverywhere #TheoAnthony #Sundance2021 #filmreview 
https://t.co/Cy1LBsbTG8",1356019234548183041,insidereel,29521448
