full_text,tweet_id,screen_name,user_ID
Airbnb (ABNB) earnings Q2 2022 - https://t.co/QMVIUiudaS #VIXC #LatestComments #Commentary #eWeatherNews,1554607541568638982,LatestComments,3088796493
Biden Justice Department sues Idaho over state's abortion ... - https://t.co/IlkWizI8CY #VIXC #LatestComments #Commentary #eWeatherNews,1554603830939209728,LatestComments,3088796493
NFL suspends Miami Dolphins owner and strips team of draft ... - https://52.6.110.3/nfl-suspends-miami-dolphins-owner-and-strips-team-of-draft-picks-in-tampering-and-tanking-probe/ #VIXC #LatestComments #Commentary #eWeatherNews,1554593534270967809,LatestComments,3088796493
Live Updates: Pelosi Taiwan Visit Draws China’s Condemnation - https://t.co/DPDMCVQZJv #VIXC #LatestComments #Commentary #eWeatherNews,1554592157029351431,LatestComments,3088796493
Biden's al Qaeda strike reveals an inconvenient truth about ... - https://t.co/AdTU8phGJ3 #VIXC #LatestComments #Commentary #eWeatherNews,1554583179624841217,LatestComments,3088796493
Wikipedia Articles Sway Some Legal Judgments - https://t.co/fYX6Rb2Qb7 #VIXC #LatestComments #Commentary #eWeatherNews,1554582083103821829,LatestComments,3088796493
"U.S. Stocks Close Weak On Growth Concerns, Geopolitical Tensions - https://t.co/m8kTeazGGM #VIXC #LatestComments #Commentary #eWeatherNews",1554576808208637953,LatestComments,3088796493
Alex Jones on trial: Sandy Hook parents testify about the ... - https://t.co/mZBTg51OBz #VIXC #LatestComments #Commentary #eWeatherNews,1554572866015969280,LatestComments,3088796493
"'My life will never, ever be the same.' Court hears first ... - https://t.co/QywydAaN7D #VIXC #LatestComments #Commentary #eWeatherNews",1554562527794794497,LatestComments,3088796493
Whence the North Pacific High’s surface NW w ... - https://t.co/O841OTP1ps #VIXC #LatestComments #Commentary #eWeatherNews,1554559446533259266,LatestComments,3088796493
Here's what embedded tweets could look like after they're edited - https://t.co/01F6Vt9rDW #VIXC #LatestComments #Commentary #eWeatherNews,1554556667521556481,LatestComments,3088796493
Private astronaut missions to the ISS will soon require a ... - https://52.6.110.3/private-astronaut-missions-to-the-iss-will-soon-require-a-nasa-chaperone/ #VIXC #LatestComments #Commentary #eWeatherNews,1554552256439123974,LatestComments,3088796493
Taiwan: Nancy Pelosi trip labelled as 'extremely ... - https://t.co/Xg9ZVxnQHY #VIXC #LatestComments #Commentary #eWeatherNews,1554551625011941378,LatestComments,3088796493
Jake Gyllenhaal set to star in 'Road House' remake for ... - https://t.co/XrTGVwRZJt #VIXC #LatestComments #Commentary #eWeatherNews,1554541935993536512,LatestComments,3088796493
Todd and Julie Chrisley 'feel like we're hemorrhaging' since ... - https://52.6.110.3/todd-and-julie-chrisley-feel-like-were-hemorrhaging-since-convictions/ #VIXC #LatestComments #Commentary #eWeatherNews,1554531561562857473,LatestComments,3088796493
We need to talk about space junk - https://52.6.110.3/we-need-to-talk-about-space-junk/ #VIXC #LatestComments #Commentary #eWeatherNews,1554531253726154752,LatestComments,3088796493
Conservative Joe Scarborough Indicts Entirety of GOP: ... - https://t.co/3aCVI9MZ02 #VIXC #LatestComments #Commentary #eWeatherNews,1554526254203912195,LatestComments,3088796493
Senate passes bill to expand death and disability benefits ... - https://t.co/UTVr1qGh6J #VIXC #LatestComments #Commentary #eWeatherNews,1554521267138699269,LatestComments,3088796493
Live Updates: As Ukraine Outlines Devastation of Civilian ... - https://t.co/9hkY8q5EBD #VIXC #LatestComments #Commentary #eWeatherNews,1554511130831339520,LatestComments,3088796493
"Hondo, Texas, City Council revokes agreement to rent ... - https://t.co/9BBeJ52CF2 #VIXC #LatestComments #Commentary #eWeatherNews",1554510914010980355,LatestComments,3088796493
Is Bio-Designed Collagen the Next Step in Animal Protein ... - https://t.co/SF5oRxeDbL #VIXC #LatestComments #Commentary #eWeatherNews,1554505838047420416,LatestComments,3088796493
Midday Nowcast: Rain and Storms Increase this Afternoon - https://t.co/lzmveNYDDK #VIXC #LatestComments #Commentary #eWeatherNews,1554501304524935170,LatestComments,3088796493
US House Speaker Nancy Pelosi lands in Taiwan amid threats ... - https://t.co/yasljo4L6z #VIXC #LatestComments #Commentary #eWeatherNews,1554500598116007937,LatestComments,3088796493
Waves of extreme heat traverse the US this week - https://52.6.110.3/waves-of-extreme-heat-traverse-the-us-this-week/ #VIXC #LatestComments #Commentary #eWeatherNews,1554490354463809537,LatestComments,3088796493
Uber earnings Q2 2022 - https://t.co/gT1GRcN3CI #VIXC #LatestComments #Commentary #eWeatherNews,1554480415724953601,LatestComments,3088796493
What's next for the US housing market - https://t.co/qwHIXwBKiW #VIXC #LatestComments #Commentary #eWeatherNews,1554479967198658560,LatestComments,3088796493
Entire Biden economic team needs to be replaced - https://t.co/X1AunNSG4u #VIXC #LatestComments #Commentary #eWeatherNews,1554475628115673088,LatestComments,3088796493
Authorities investigate after mysterious sinkhole appears in ... - https://t.co/zt9MWIPl48 #VIXC #LatestComments #Commentary #eWeatherNews,1554470344920031237,LatestComments,3088796493
Nancy Pelosi's plan to visit Taiwan sends Chinese markets ... - https://t.co/XNNBbs8udQ #VIXC #LatestComments #Commentary #eWeatherNews,1554469722061668352,LatestComments,3088796493
Convicted US Capitol rioter's son says he 'absolutely' ... - https://t.co/GKDvhu4JRZ #VIXC #LatestComments #Commentary #eWeatherNews,1554459369214967812,LatestComments,3088796493
"The 13 Best Office Chairs (2022): Budget, Luxe, Cushions, ... - https://t.co/FTyHlJTddX #VIXC #LatestComments #Commentary #eWeatherNews",1554454989778690048,LatestComments,3088796493
"Nuclear sky hotel not impossible, video creator says - https://t.co/q291UsQgT5 #VIXC #LatestComments #Commentary #eWeatherNews",1554449029127409668,LatestComments,3088796493
Three hot days before some decent rain chances pop up in ... - https://t.co/iH1GFvpYQV #VIXC #LatestComments #Commentary #eWeatherNews,1554443178291470338,LatestComments,3088796493
"Arizona, Michigan and Missouri election results 2022 - https://t.co/WXXR09uukV #VIXC #LatestComments #Commentary #eWeatherNews",1554438716919267329,LatestComments,3088796493
A New Axis? - https://t.co/dnJsE0Ng8p #VIXC #LatestComments #Commentary #eWeatherNews,1554429844947083267,LatestComments,3088796493
Amazon offers same-day Prime delivery for select retail chains - https://t.co/rIBatwdCN9 #VIXC #LatestComments #Commentary #eWeatherNews,1554429574775201795,LatestComments,3088796493
"Aug. 10 primary elections: What to expect in Arizona, ... - https://t.co/8r0RZUSr4L #VIXC #LatestComments #Commentary #eWeatherNews",1554428445974831106,LatestComments,3088796493
"Sensex, Nifty Reverse Early Losses To End Marginally Higher - https://t.co/rEntVVQyV2 #VIXC #LatestComments #Commentary #eWeatherNews",1554425043169460224,LatestComments,3088796493
First on CNN: Top economists say Democrats' health care and ... - https://t.co/siMsEbbgwj #VIXC #LatestComments #Commentary #eWeatherNews,1554418156898246656,LatestComments,3088796493
"For Asia's migrant workers, extreme heat is 'a matter of ... - https://t.co/x7GTcTbPAI #VIXC #LatestComments #Commentary #eWeatherNews",1554407810762407936,LatestComments,3088796493
The Crypto Market Crashed. They’re Still Buying Bitcoin. - https://t.co/5l8PfisjkB #VIXC #LatestComments #Commentary #eWeatherNews,1554404190146920449,LatestComments,3088796493
Brittney Griner appears in court amid ongoing trial as US ... - https://t.co/yRaEzyIGqH #VIXC #LatestComments #Commentary #eWeatherNews,1554397485505957889,LatestComments,3088796493
China could make show of force if Pelosi visits Taiwan - US - https://t.co/47rup28XOZ #VIXC #LatestComments #Commentary #eWeatherNews,1554389304826290176,LatestComments,3088796493
Toxic mine pollution has turned Ohio rivers orange. Now it's ... - https://t.co/QTLeNHB225 #VIXC #LatestComments #Commentary #eWeatherNews,1554387177378877441,LatestComments,3088796493
Nearly Typical Summer Weather for Central Alabama This Week ... - https://t.co/IYttkczRT7 #VIXC #LatestComments #Commentary #eWeatherNews,1554385038732574720,LatestComments,3088796493
"Nio, Li Auto July electric car deliveries jump, shares rise - https://t.co/D84Nm8jarE #VIXC #LatestComments #Commentary #eWeatherNews",1554378743874994178,LatestComments,3088796493
Eastern Kentucky faces even more flood risk as hundreds are ... - https://t.co/CVKWNI4Lln #VIXC #LatestComments #Commentary #eWeatherNews,1554376804441391105,LatestComments,3088796493
Rachel Maddow Burns Trump To The Ground After Biden Gets The ... - https://52.6.110.3/rachel-maddow-burns-trump-to-the-ground-after-biden-gets-the-leader-of-al-qaeda/ #VIXC #LatestComments #Commentary #eWeatherNews,1554374498794831872,LatestComments,3088796493
What India Couture Week reveals about this year's bridalwear ... - https://t.co/jhbWsEWjCT #VIXC #LatestComments #Commentary #eWeatherNews,1554366519953563649,LatestComments,3088796493
Cannabis cafes the latest addition to Thailand's tourism ... - https://t.co/Wo5AhcFBjx #VIXC #LatestComments #Commentary #eWeatherNews,1554356134848380929,LatestComments,3088796493
NASA is Crowdsourcing Cloud Research—on Mars - https://t.co/N8Zv2KIkRi #VIXC #LatestComments #Commentary #eWeatherNews,1554353327873327105,LatestComments,3088796493
U.S. to Send Another $550 Million in Arms to Ukraine - https://t.co/KPkvCsWRPu #VIXC #LatestComments #Commentary #eWeatherNews,1554348790823493632,LatestComments,3088796493
"Pelosi expected to visit Taiwan, Taiwanese and US officials say - https://t.co/FOqUGztT8v #VIXC #LatestComments #Commentary #eWeatherNews",1554345827258220544,LatestComments,3088796493
Who was al Qaeda leader Ayman al-Zawahiri? - https://t.co/EhunyCWA0O #VIXC #LatestComments #Commentary #eWeatherNews,1554335545895034883,LatestComments,3088796493
NYPD must disclose facial recognition procedures deployed ... - https://52.6.110.3/nypd-must-disclose-facial-recognition-procedures-deployed-against-black-lives-matter-protesters/ #VIXC #LatestComments #Commentary #eWeatherNews,1554327915449520128,LatestComments,3088796493
Alabama NewsCenter — 8 cool recipes that turn hot summer d ... - https://t.co/whqPZA7jHQ #VIXC #LatestComments #Commentary #eWeatherNews,1554326904802516993,LatestComments,3088796493
White House warns China against escalations over Pelosi's ... - https://t.co/Uv0sqbr8FJ #VIXC #LatestComments #Commentary #eWeatherNews,1554325220055568384,LatestComments,3088796493
Opinion | Kyrsten Sinema has all the power right now. She ... - https://t.co/38xOw8cSNh #VIXC #LatestComments #Commentary #eWeatherNews,1554323997873127424,LatestComments,3088796493
Top lawmakers renew call for DHS IG to step aside from ... - https://t.co/X3DeoaYEsh #VIXC #LatestComments #Commentary #eWeatherNews,1554314873882005505,LatestComments,3088796493
Ayman al-Zawahiri: Al-Qaeda leader killed in US drone strike - https://t.co/nHUO4yZF95 #VIXC #LatestComments #Commentary #eWeatherNews,1554308335847051264,LatestComments,3088796493
Kentucky flooding: Man rescues 5 children and 2 of his ... - https://t.co/45voTrPKEg #VIXC #LatestComments #Commentary #eWeatherNews,1554304589326950400,LatestComments,3088796493
Pinterest (PINS) Q2 2022 earnings - https://t.co/mfJUECMnPp #VIXC #LatestComments #Commentary #eWeatherNews,1554302495001903105,LatestComments,3088796493
California governor declares state of emergency over ... - https://t.co/1Uhc84bamA #VIXC #LatestComments #Commentary #eWeatherNews,1554294263055368192,LatestComments,3088796493
Northwest heat: 14 Oregon deaths may be heat-related as 13 ... - https://t.co/roN7rXYfMP #VIXC #LatestComments #Commentary #eWeatherNews,1554283924326649856,LatestComments,3088796493
Kenya’s Threat to Ban Facebook Could Backfire - https://t.co/Oxp8N4behG #VIXC #LatestComments #Commentary #eWeatherNews,1554277070561329153,LatestComments,3088796493
The Death of Ayman al-Zawahiri - https://t.co/tyCHW0zsvh #VIXC #LatestComments #Commentary #eWeatherNews,1554273596977078273,LatestComments,3088796493
Humpty Dumpty Democrats and their recession - https://t.co/f07FCMBaev #VIXC #LatestComments #Commentary #eWeatherNews,1554273294597165056,LatestComments,3088796493
"Alabama NewsCenter — University of Alabama, Fanatics create p ... - https://t.co/qerGEGvIaq #VIXC #LatestComments #Commentary #eWeatherNews",1554268768292970496,LatestComments,3088796493
"Killed at 71, Ayman al-Zawahri Led a Life of Secrecy and Violence - https://t.co/TSIomhV7qF #VIXC #LatestComments #Commentary #eWeatherNews",1554267767624409088,LatestComments,3088796493
US kills al Qaeda leader Ayman al-Zawahiri in drone strike ... - https://t.co/7And8CvGMQ #VIXC #LatestComments #Commentary #eWeatherNews,1554263045995696128,LatestComments,3088796493
Berlin Wall Fast Facts | CNN - https://52.6.110.3/berlin-wall-fast-facts-cnn/ #VIXC #LatestComments #Commentary #eWeatherNews,1554252755769987072,LatestComments,3088796493
Amazon's emissions increased dramatically last year despite ... - https://52.6.110.3/amazons-emissions-increased-dramatically-last-year-despite-carbon-neutrality-goal/ #VIXC #LatestComments #Commentary #eWeatherNews,1554251654148530176,LatestComments,3088796493
Viktor Bout: Attorney for convicted Russian arms dealer is ... - https://t.co/gXiB8Eqk3O #VIXC #LatestComments #Commentary #eWeatherNews,1554242421185282048,LatestComments,3088796493
Guy Reffitt: Jan 6. rioter who carried gun to US Capitol and ... - https://t.co/6HNoiiliO5 #VIXC #LatestComments #Commentary #eWeatherNews,1554232150614056960,LatestComments,3088796493
Guy Reffitt: Capitol rioter turned in by son gets 87 months ... - https://52.6.110.3/guy-reffitt-capitol-rioter-turned-in-by-son-gets-87-months-in-prison/ #VIXC #LatestComments #Commentary #eWeatherNews,1554227240250085377,LatestComments,3088796493
This coalition believes every ADAS feature needs a universal name - https://t.co/K22RdXky8S #VIXC #LatestComments #Commentary #eWeatherNews,1554226242999750656,LatestComments,3088796493
U.S. Stocks Close Slightly Weak As Investors Look For Direction - https://t.co/ojBiG2VlKA #VIXC #LatestComments #Commentary #eWeatherNews,1554222711492296705,LatestComments,3088796493
CDC adds 3 places to its 'high' risk list for Covid-19 - https://t.co/vhyrvHQiat #VIXC #LatestComments #Commentary #eWeatherNews,1554221789546528771,LatestComments,3088796493
Biden remains positive for Covid and 'continues to feel ... - https://52.6.110.3/biden-remains-positive-for-covid-and-continues-to-feel-well-his-doctor-says/ #VIXC #LatestComments #Commentary #eWeatherNews,1554211476533018624,LatestComments,3088796493
Severe T-Storm Warning — Parts of Montgomery Co. Until 4 pm : ... - https://t.co/zVq7H1vojE #VIXC #LatestComments #Commentary #eWeatherNews,1554210652855701505,LatestComments,3088796493
England and France have had their driest July in decades - https://t.co/G2O3BlhRJ9 #VIXC #LatestComments #Commentary #eWeatherNews,1554201183178350595,LatestComments,3088796493
How Some Parents Changed Their Politics in the Pandemic - https://t.co/R3xTgRM18m #VIXC #LatestComments #Commentary #eWeatherNews,1554200829829185537,LatestComments,3088796493
Arian Taherzadeh: Man accused of impersonating Homeland ... - https://t.co/nXnJADAAOU #VIXC #LatestComments #Commentary #eWeatherNews,1554190893166493696,LatestComments,3088796493
U.S. Warns China Not to Turn Pelosi’s Expected Trip to T ... - https://t.co/Y3TYZMU4Wc #VIXC #LatestComments #Commentary #eWeatherNews,1554186723114074112,LatestComments,3088796493
"Ultraprocessed food linked to mental decline, study finds - https://t.co/pgq1byOhN5 #VIXC #LatestComments #Commentary #eWeatherNews",1554180527493681159,LatestComments,3088796493
SEC charges 11 people in alleged $300 million crypto Ponzi scheme - https://t.co/Lv53w5NlXw #VIXC #LatestComments #Commentary #eWeatherNews,1554175400275746816,LatestComments,3088796493
Lauren Boebert Claims An Assault Weapons Ban Will Lead To ... - https://52.6.110.3/lauren-boebert-claims-an-assault-weapons-ban-will-lead-to-people-eating-dogs/ #VIXC #LatestComments #Commentary #eWeatherNews,1554172132564819971,LatestComments,3088796493
How Salman Toor Left the Old Masters Behind - https://t.co/2KTnTR9NyW #VIXC #LatestComments #Commentary #eWeatherNews,1554170155286028290,LatestComments,3088796493
Stewart and veterans slam Republicans over stalling bill to ... - https://t.co/M4oaiwb3Yg #VIXC #LatestComments #Commentary #eWeatherNews,1554159935444885505,LatestComments,3088796493
Midday Nowcast: A Sea of Humidity : The Alabama Weather Blog - https://t.co/PoB0msTR1C #VIXC #LatestComments #Commentary #eWeatherNews,1554152501510905857,LatestComments,3088796493
"5 Best Password Managers (2022): Features, Pricing, and Tips - https://t.co/mZqJ7gXCbm #VIXC #LatestComments #Commentary #eWeatherNews",1554149999335849985,LatestComments,3088796493
Sam Taggart’s Hard Sell | The New Yorker - https://t.co/LCzhF56aS9 #VIXC #LatestComments #Commentary #eWeatherNews,1554149484967460864,LatestComments,3088796493
Ukraine war: First grain ship leaves under Russia deal - https://t.co/v8ctXzB9ZB #VIXC #LatestComments #Commentary #eWeatherNews,1554146208091967489,LatestComments,3088796493
Europe's last panda discovered in museum collection - https://t.co/ezUjBhDqlp #VIXC #LatestComments #Commentary #eWeatherNews,1554139250718801922,LatestComments,3088796493
What Should a Nine-Thousand-Pound Electric Vehicle Sound Like? - https://t.co/rdXgSQBMrM #VIXC #LatestComments #Commentary #eWeatherNews,1554128895217209349,LatestComments,3088796493
Solo Stove's Fire Pit 2.0 fixes the original's biggest flaw - https://t.co/XAzRsaKx0e #VIXC #LatestComments #Commentary #eWeatherNews,1554124564824821760,LatestComments,3088796493
Opinion | Jon Stewart shows Democrats how to respond to GOP ... - https://t.co/9DfkA8zhwM #VIXC #LatestComments #Commentary #eWeatherNews,1554121640459603970,LatestComments,3088796493
Opinion: There's a good reason Jon Stewart is angry at Ted Cruz - https://52.6.110.3/opinion-theres-a-good-reason-jon-stewart-is-angry-at-ted-cruz/ #VIXC #LatestComments #Commentary #eWeatherNews,1554118573227999232,LatestComments,3088796493
"New Feminist Considerations of Masculinity, Reviewed - https://t.co/L9HnZGXJ15 #VIXC #LatestComments #Commentary #eWeatherNews",1554108224890183680,LatestComments,3088796493
"Live Updates: For First Time Since Start of War, a Ship With ... - https://t.co/4sX7QlWIMr #VIXC #LatestComments #Commentary #eWeatherNews",1554105687143288833,LatestComments,3088796493
