full_text,tweet_id,screen_name,user_ID
"Calling ALL Goo Goo Dolls Fans, we have your chance to Win the Ultimate Goo Goo Dolls Experience!

Our Favorite Buffalo Boys are headed to the Keybank Center on Saturday, September 24!

There are 3 opportunities to win amazing prizes!

More details here: https://t.co/QbL4qDBtJ1 https://t.co/hVHBxL3loO",1536332916900470785,varietywny,36383169
"Join us this TUESDAY for a special Cruise Night!

There will be a “KITT 4 Kidz” Meet &amp; Greet with KITT from TV series Knight Rider!  A chance @ $250 cash, music by Mo Porter and the usual Cruise Night Fun!

More details here: https://t.co/l7b7tY0g9k

We hope to see you Tuesday! https://t.co/p2QZ0pW1PD",1535995348006711300,varietywny,36383169
"This Tuesday is a special Cruise Night!

We have  a “KITT 4 Kidz” Meet &amp; Greet with KITT from Knight Rider &amp; chance to win $250 CASH with Variety Club’s RUBIKS CUBE contest @ 7:30pm!
  
PLUS: Music by Mo Porter &amp; the usual Cruise Night fun! Details here: https://t.co/l7b7tY0g9k https://t.co/X2wK2OOq6s",1535683536153464833,varietywny,36383169
"Today is Shredd’s Backyard Rib Throwdown taking place @ TSG BBQ located at 6272 Seneca St in Elma!

Drive -Thru Chicken Dinners are available for $14.95 starting @ 12pm.

Variety will be on site with your chance to win the 2009 Jaguar &amp; $10k!  https://t.co/KTEu9n09bB",1535596465900371970,varietywny,36383169
"Make plans with us for Variety’s “GET YOUR INDEPENDENCE ON” In-Person Meat Raffle on Saturday, June 25 taking place @ Variety in Lancaster.  

Admission is $10 &amp; includes beer/ pop/ water. Or $75 for a table of 8! Plus additional raffles! Details here: https://t.co/7PCJYVPA6I https://t.co/hrQQXD4Qg0",1535226534126141440,varietywny,36383169
"Join us at The Lake Erie Region AACA Annual Car Show on Sunday, June 12th taking place at Elma Village Green at 3007 Bowen Rd in Elma from 9am-4pm.

Variety Club will be on site at this event with chances to win the 2009 Jaguar XK and $10,000! https://t.co/BinfXwMHbO",1534943810668609543,varietywny,36383169
"Shredd’s Backyard Rib Throwdown is this Saturday, June 11 @ TSG BBQ located at 6272 Seneca St in Elma!

Drive -Thru Chicken Dinners are available for $14.95 starting @ 12pm.

Variety will be on site with your chance to win the 2009 Jaguar &amp; $10k!  https://t.co/KTEu9n09bB",1534871698587144192,varietywny,36383169
"A very big Thank You to our amazing friends over at @ChefsBuffalo!

Mary Beth &amp; Lou Billittier Jr. made a $12,330 donation to the 60th Variety Telethon celebrating 60 years of Spaghetti Parm. 

Read the official press release, here: https://t.co/QffoDwFMfI https://t.co/CtTSoO9GDu",1534596890150555651,varietywny,36383169
"Join us for Variety’s “GET YOUR INDEPENDENCE ON” In-Person Meat Raffle on Saturday, June 25! Doors open @ 6pm. 

The Meat Raffle takes place at Variety Club in Lancaster. 

Admission is $10 &amp; includes beer/ pop/ water.

Grab tickets &amp; details, today! https://t.co/7PCJYVPA6I https://t.co/izS4RRxLdW",1534506829417525248,varietywny,36383169
"Join us Tuesday, June 14th for an extra special Variety Cruise Night!

There will be a “KITT 4 Kidz” Meet &amp; Greet with KITT from TV series Knight Rider!   PLUS: Mo Porter will play!

Grab all of the details here: https://t.co/itu0CFf3dt

We hope you can join us for a great night! https://t.co/TPXbrHNb8D",1534235000568221696,varietywny,36383169
"***Attention Cruisers***

Cruise Night is cancelled for tonight due to rain.

See you next week!",1534206066246012929,varietywny,36383169
https://t.co/v1H3X5ePgE,1534189201679425536,varietywny,36383169
"Join us for Shredd’s Backyard Rib Throwdown this wknd on Saturday 6/11 @ TSG BBQ in Elma!

There will be an amateur backyard smoker enthusiast challenge. For all others, there will be Drive -Thru Chicken Dinners available for $14.95 starting at 12pm-4pm. 
https://t.co/lDgyohX3iW https://t.co/I9vXmAtYQk",1533776980721782784,varietywny,36383169
"A huge THANK YOU to our amazing sponsors of the 2022 Variety Days Fundraiser!

Grab all of details on Variety Days here: https://t.co/mrX5oCA14F https://t.co/rJ95gJozYg",1533586976443617284,varietywny,36383169
"Come by for our Final Day of the Variety Days Fundraiser to benefit the Variety kids right here in Buffalo &amp; WNY!

We are having a fun Polka Party!  $5 per person. 21+ admitted.  

Drinks, food, raffles &amp; more! https://t.co/zoQYo0baCv",1533551741987344384,varietywny,36383169
"Join us NOW- 9pm for our Final Day of the Variety Days Fundraiser to benefit the Variety Kids taking place @ 6114 Broadway in Lancaster!

The Buffalo Touch will play &amp; it will be a fun Polka Party!  $5 per person. 21+ admitted.  

Drinks, food &amp; more! https://t.co/zoQYo0baCv",1533501431298281474,varietywny,36383169
"Today is our Polka Party for Day 4 of the Variety Days Fundraiser!  It will take place from 1pm-9pm outside of Variety Club in Lancaster. 

The Buffalo Touch will play, too.  $5 per person, pay upon arrival. 21+ admitted.  

Drinks, food, raffles &amp; more! https://t.co/zoQYo0baCv",1533422137884688385,varietywny,36383169
"Happening NOW (until 11pm):  Join us at the Variety Days Fundraiser to benefit the Variety Kids right here in WNY!

Awesome Live Music from some of Buffalo's best, drinks, food, raffles &amp; more!

$5 per person, pay upon arrival. 21+ admitted.  
https://t.co/zoQYo0baCv",1533238429055692802,varietywny,36383169
"Variety Days -Day 3 is happening NOW-11pm at Variety Club located at 6114 Broadway in Lancaster. 

Flipside, Hot Daddy Rocks &amp; Assorted Nuts will play.  $5 per person, pay upon arrival. 21+ admitted.  

Plenty of cold drinks, food, raffles &amp; more!  https://t.co/zoQYo0baCv",1533208228309389312,varietywny,36383169
